title,link,source,time
Racecourse MPs slam insufficient scrutiny and lack of transparency as they urge a halt to introduction of 'damaging' affordability checks,https://www.racingpost.com/news/britain/mps-slam-insufficient-scrutiny-and-lack-of-transparency-as-they-urge-government-to-halt-introduction-of-damaging-affordability-checks-aGDQT1F3AipS/,racing_post,
Mullins and Townend conquer Auteuil with French Triumph Hurdle strike - before a truly remarkable winner of France's toughest jumps race,https://www.racingpost.com/news/reports/shes-a-very-good-filly-more-big-race-glory-for-willie-mullins-paul-townend-and-rich-ricci-as-selma-de-vary-strikes-in-french-triumph-hurdle-aUp0W2g7MqgM/,racing_post,
'I'd done all the other jobs in racing' - meet the East End boy who began training at 53 and is making a mighty fist of it,https://www.racingpost.com/news/features/interviews/id-done-all-the-other-jobs-in-racing-meet-the-east-end-boy-who-began-training-at-53-and-is-making-a-mighty-fist-of-it-a0Scf8G2pB5T/,racing_post,
Have we seen the King Charles III Stakes winner? The Royal Ascot clues we found on Naas's very informative trials card,https://www.racingpost.com/news/reports/have-we-seen-the-king-charles-iii-stakes-winner-the-royal-ascot-clues-we-found-on-naass-very-informative-trials-card-a6XLi7V15PyZ/,racing_post,
"A day that could ruin lives, enrich criminals and damage a great British industry - unless Gambling Commission board members choose to be heroes",https://www.racingpost.com/news/opinion/comment/a-day-that-could-ruin-lives-enrich-criminals-and-damage-a-great-british-industry-unless-the-gambling-commissions-board-members-choose-to-be-heroes-aLvdj4F5JWe5/,racing_post,
Karl Burke takes aim at Irish Classic with Greenham winner after breezing through £1 million milestone,https://www.racingpost.com/news/britain/karl-burke-takes-aim-at-irish-classic-with-greenham-winner-alparslan-after-breezing-through-1-million-milestone-asc3O2S5av3z/,racing_post,
Arc owners increase fortunes by £1.1 billion to secure second place in Sunday Times Rich List,https://www.racingpost.com/news/britain/arc-owners-increase-fortunes-by-1.1-billion-to-secure-second-place-in-sunday-times-rich-list-aXngt0P7CWW9,racing_post,
I think I've found the winners of both the Derby and Oaks - and Aidan O'Brien won't like it,https://www.racingpost.com/news/betting-insight/i-think-ive-found-the-winners-of-both-the-derby-and-oaks-and-aidan-obrien-wont-like-it-a5APF6Z1q0ua/,racing_post,
Ray Dawson targets Group 1 breakthrough this year - and thinks this impressive York winner can do it for him at Royal Ascot,https://www.racingpost.com/news/britain/ray-dawson-targets-group-1-breakthrough-this-year-and-thinks-this-impressive-york-winner-can-do-it-for-him-at-royal-ascot-abz6d8C37bNE/,racing_post,
A 25-1 tip for the St Leger - plus eyecatchers to note from last week,https://www.racingpost.com/news/features/regulars/a-25-1-tip-for-the-st-leger-plus-eyecatchers-to-note-from-last-week-awHu75B12F0b/,racing_post,
'It was a nasty episode that we went through' - Newmarket trainer on the way back after horsebox crash,https://www.racingpost.com/news/features/regulars/it-was-a-nasty-episode-that-we-went-through-newmarket-trainer-on-the-way-back-after-horsebox-crash-aYigc5n6qwcX/,racing_post,
"'I had a five-year plan just to get going and stay solvent, but your mindset changes - success is totally addictive'",https://www.racingpost.com/news/features/the-big-read/i-had-a-five-year-plan-just-to-get-going-and-stay-solvent-but-your-mindset-changes-success-is-totally-addictive-aUTOB8y1i1OO/,racing_post,
Another looming threat for racing - and common sense - as the Greens saddle up for a misguided crusade,https://www.racingpost.com/news/opinion/comment/another-looming-threat-for-racing-and-common-sense-as-the-greens-saddle-up-for-a-misguided-crusade-a1ci37u5y4sy/,racing_post,
'I fancy him strongly to follow up' - find out whose run last time Richard Birch believes has been underestimated,https://www.racingpost.com/horse-racing-tips/premium-tips/top-tipsters/i-fancy-him-strongly-to-follow-up-find-out-whose-run-last-time-richard-birch-believes-has-been-underestimated-agVq69P9gOCL/,racing_post,
Richard Birch's play of the day at Carlisle,https://www.racingpost.com/play-of-the-day/richard-birchs-play-of-the-day-at-carlisle-aYieM3F5G9D1/,racing_post,
"Free horseracing tips for Monday, May 17 at Carlisle, Redcar, Roscommon and Windsor",https://www.racingpost.com/horse-racing-tips/todays-top-tips/free-horseracing-tips-for-monday-may-17-at-carlisle-redcar-roscommon-and-windsor-a5sKS2C6vaQE/,racing_post,
"Jack Channon bidding to emulate his father Mick’s Classic success with 'very smart filly' in Irish 1,000 Guineas",https://www.racingpost.com/news/festivals/irish-guineas-festival/jack-channon-bidding-to-emulate-his-father-micks-classic-success-with-very-smart-filly-in-irish-1000-guineas-a4Jc97c628Xe/,racing_post,
Have we seen the Queen’s Vase winner? Plus horses to note at Newbury including the often informative London Gold Cup,https://www.racingpost.com/news/features/regulars/have-we-seen-the-queens-vase-winner-plus-horses-to-note-at-newbury-including-the-often-informative-london-gold-cup-afzgZ8m7Irfx/,racing_post,
"Dan Skelton swoops for €500,000 sale-topper in Auteuil who 'is ready-made to go straight into the big races'",https://www.racingpost.com/bloodstock/sales-reports/hopefully-he-has-a-big-future-skelton-snares-the-exciting-isaac-of-york-for-a-sale-topping-500000-in-auteuil-aOGIt9f1jwRS/,racing_post,
Australian Group 1 winner Lady Of Camelot retired following freak stingray attack,https://www.racingpost.com/news/international/australia/australian-group-1-winner-lady-of-camelot-retired-following-freak-stingray-attack-adazZ8k1lDr4/,racing_post,
Naas: 'She deserves a crack at a big one' - Havana Anna enters Commonwealth Cup picture as red-hot Ballydoyle favourite disappoints,https://www.racingpost.com/news/reports/she-deserves-a-crack-at-a-big-one-havana-anna-enters-commonwealth-cup-picture-as-red-hot-ballydoyle-favourite-disappoints-a4weW6N4oz3V/,racing_post,
Hamilton: 'It's great to be back' - Vantheman gives Tom Eaves his first winner since January after injury setback,https://www.racingpost.com/news/reports/its-great-to-be-back-vantheman-gives-tom-eaves-his-first-winner-since-january-after-injury-setback-aanLa4F1vdGs/,racing_post,
Preakness: 'This is the icing on the cake' - Napolean Solo strikes to give Chad Summers his first Triple Crown race win,https://www.racingpost.com/news/international/this-is-the-icing-on-the-cake-napolean-solo-strikes-in-the-preakness-to-give-chad-summers-his-first-triple-crown-race-win-aFPOr8T5wwPi/,racing_post,
Lockinge: 'There aren't too many horses who can quicken like he can' - well-backed Notable Speech sets up Queen Anne bid,https://www.racingpost.com/news/reports/well-backed-notable-speech-shows-an-explosive-turn-of-foot-to-dominate-the-lockinge-stakes-aOg7p0W9yAYo/,racing_post,
'He's strengthened up a good bit and the main aim will be to get him to the Breeders’ Cup',https://www.racingpost.com/news/features/stable-tours/hes-strengthened-up-a-good-bit-and-the-main-aim-will-be-to-get-him-to-the-breeders-cup-adEEg1F0p1KM/,racing_post,
'He's had a pretty extraordinary time and produced a big effort at the Breeders' Cup - you'd hope he's up to winning a Group 1',https://www.racingpost.com/news/features/stable-tours/hes-had-a-pretty-extraordinary-time-and-produced-a-big-effort-at-the-breeders-cup-youd-hope-hes-up-to-winning-a-group-1-a8sp35i5gkZ9/,racing_post,
'She’ll come forward a lot and winning a Group 1 is the aim this season’,https://www.racingpost.com/news/features/stable-tours/she-has-a-big-pedigree-and-was-impressive-in-her-maiden.-if-the-curragh-goes-well-then-the-irish-guineas-would-be-an-obvious-next-step-a4XKJ5f9buWl,racing_post,
"'That's given us the right to be more audacious and she'll probably go for the 1,000 Guineas'",https://www.racingpost.com/news/features/stable-tours/thats-given-us-the-right-to-be-more-audacious-and-shell-probably-go-for-the-1000-guineas-aTgTl8f3DVLw/,racing_post,
"'I did something so stupid, so ridiculous, so embarrassing that they couldn't possibly broadcast it - Chris Tarrant must have thought I was a prize idiot'",https://www.racingpost.com/news/features/series/i-did-something-so-stupid-so-ridiculous-so-embarrassing-that-they-couldnt-possibly-broadcast-it-chris-tarrant-must-have-thought-i-was-a-prize-idiot-aU8Rf7T0F13p/,racing_post,
Meet the Racing Post's first ever Newmarket correspondent - who used it as the launchpad for an astonishing career,https://www.racingpost.com/news/features/series/meet-the-racing-posts-first-ever-newmarket-correspondent-who-used-it-as-the-launchpad-for-an-astonishing-career-adp3N5B3jWaZ/,racing_post,
"'I had to sit in my office because I had tears in my eyes' - the most unforgettable stories in Racing Post history, as chosen by the editors",https://www.racingpost.com/news/features/series/i-had-to-sit-in-my-office-because-i-had-tears-in-my-eyes-the-most-unforgettable-stories-in-racing-post-history-as-chosen-by-the-editors-aJjSG1m9M86w/,racing_post,
'This was the start of a revolution' - the extraordinary inside story of the Racing Post's birth,https://www.racingpost.com/news/features/series/this-was-the-start-of-a-revolution-the-extraordinary-inside-story-of-the-racing-posts-birth-asQ7f6Z1aiL0/,racing_post,
WATCH: What keeps the Racing Post number one? Inside 40 years of horseracing expertise,https://www.racingpost.com/news/features/series/watch-what-keeps-the-racing-post-number-one-inside-40-years-of-horseracing-expertise-aKViL8I2Adjo/,racing_post,
Charlie Appleby was right to question his Classic crop - he was equally right to believe in Notable Speech,https://www.racingpost.com/news/reports/charlie-appleby-was-right-to-question-his-classic-crop-he-was-equally-right-to-believe-in-notable-speech-aVHAW2Z4ro00/,racing_post,
The knives are already being sharpened for Harry Cobden - but don't join the ludicrous knee-jerk reaction,https://www.racingpost.com/news/opinion/comment/the-knives-are-already-being-sharpened-for-harry-cobden-but-dont-join-the-ludicrous-knee-jerk-reaction-av0Fe9r18smd/,racing_post,
Patience is a virtue - just ask this trainer enjoying his best run of form after more than two and a half decades,https://www.racingpost.com/news/opinion/comment/patience-is-a-virtue-just-ask-this-trainer-enjoying-his-best-run-of-form-after-more-than-two-and-a-half-decades-aevLJ3X4jGfX/,racing_post,
Bookmakers threaten legal challenge to affordability checks that could mean one in five regular punters are asked for financial documents,https://www.racingpost.com/news/britain/bookmakers-threaten-legal-challenge-to-affordability-checks-that-could-mean-one-in-five-regular-punters-are-asked-for-financial-documents-asPwH4S2BvQt/,racing_post,
Illegal betting in pubs 'area of intense focus' for Irish gambling authority as research suggests at least 100 bars offer unlawful services,https://www.racingpost.com/news/ireland/illegal-betting-in-pubs-area-of-intense-focus-for-irish-gambling-authority-as-research-suggests-at-least-100-establishments-offer-unlawful-services-aOW717F0G3N4/,racing_post,
"'We're there in a mentorship role and to help maximise opportunities' - Fran Berry, Ruby Walsh and Emmet McNamara co-found new management agency for jockeys",https://www.racingpost.com/news/ireland/were-there-in-a-mentorship-role-and-to-help-maximise-opportunities-fran-berry-ruby-walsh-and-emmet-mcnamara-co-found-new-management-agency-for-jockeys-ahxnl6y40XmP/,racing_post,
"'It would be a huge way to end a brilliant season' - can the evergreen Home By The Lee do it again, this time in France?",https://www.racingpost.com/news/ireland/it-would-be-a-huge-way-to-end-a-brilliant-season-can-the-evergreen-home-by-the-lee-do-it-again-this-time-in-france-aCWK69V29MHF/,racing_post,
Olive Nicholls: 'Longer term I would love to train - and at some point I will join Dad',https://www.racingpost.com/news/features/interviews/olive-nicholls-longer-term-i-would-love-to-train-and-at-some-point-i-will-join-dad-abjuN6w01JB8/,racing_post,
'She goes to the Oaks with some of the strongest form and must stand a big chance' - Charlie Johnston Q&A,https://www.racingpost.com/news/features/interviews/she-goes-to-the-oaks-with-some-of-the-strongest-form-and-must-stand-a-big-chance-ajxv72B09K7Q/,racing_post,
‘People said it would never work’ - how an innovative trainer found an unlikely way to diversify her yard,https://www.racingpost.com/news/features/interviews/people-said-it-would-never-work-how-a-struggling-trainer-found-an-unlikely-way-to-make-ends-meet-a1xxU3k8fYVn/,racing_post,
Auteuil: Losange Bleu makes Grande Course de Haies history as Home By The Lee fails to fire,https://www.racingpost.com/news/reports/losange-bleu-makes-grande-course-de-haies-history-as-home-by-the-lee-fails-to-fire-aieJp0V6iCTM/,racing_post,
'I've been able to bring him along to arrive on D-day at 100 per cent' - Kolokico in top shape for Grand Steeple-Chase de Paris,https://www.racingpost.com/news/raceday-intel/ive-been-able-to-bring-him-along-to-arrive-on-d-day-at-100-per-cent-kolokico-in-top-shape-for-grand-steeple-chase-de-paris-aoTNA3x90oSk/,racing_post,
"Chaos, compromise or change? Ascot has gone rogue once more - now racing faces its reckoning",https://www.racingpost.com/news/opinion/comment/chaos-compromise-or-change-ascot-has-gone-rogue-once-more-now-racing-faces-its-reckoning-a5eGI2F3ZR89/,racing_post,
"Small attendance, big contradictions: key takeouts from the Westminster debate on gambling advertising",https://www.racingpost.com/news/opinion/comment/small-attendance-big-contradictions-key-takeouts-from-the-westminster-debate-on-gambling-advertising-aJGRJ4a7iOBf/,racing_post,
The Gambling Commission has not resolved this crucial issue - and ministers must not let them off the hook,https://www.racingpost.com/news/opinion/comment/the-gambling-commission-has-not-resolved-this-crucial-issue-and-ministers-must-not-let-them-off-the-hook-aiCL53x5Z5WD/,racing_post,
It should be obvious that affordability checks will not do what they're supposed to - it is vital racing helps the government realise that,https://www.racingpost.com/news/opinion/comment/it-should-be-obvious-that-affordability-checks-will-not-do-what-theyre-supposed-to-it-is-vital-racing-helps-the-government-realise-that-aOgV79N5c0Uk/,racing_post,
"Poker genius, visionary football chairman and pioneering data-led punter - the many (profitable) faces of Tony Bloom",https://www.racingpost.com/news/features/masters-of-betting/poker-genius-visionary-football-chairman-and-pioneering-data-led-punter-the-many-profitable-faces-of-tony-bloom-a0UWt2Y6DPmh/,racing_post,
"Introducing Masters of Betting, an unmissable series available now - read it all with 25% off RP+",https://www.racingpost.com/news/introducing-masters-of-betting-an-unmissable-series-next-week-in-the-racing-post-read-it-all-with-25-off-rp-aJKV17m1iNzx/,racing_post,
"'I was down £11,000 but you can't let that alter what you do' - meet one of the giants of on-course betting",https://www.racingpost.com/news/features/masters-of-betting/i-was-down-11000-but-you-cant-let-that-alter-what-you-do-meet-one-of-the-giants-of-on-course-betting-aXYs01f58AHh/,racing_post,
When science met punting: the godfather of modern-day betting and his golden rules that remain valid to this day,https://www.racingpost.com/news/features/masters-of-betting/when-science-met-punting-the-godfather-of-modern-day-betting-and-his-golden-rules-that-remain-valid-to-this-day-aO1b67N07bKR/,racing_post,
How a dodgy bank loan led to nearly 40 years as a pro punter - proving old-school methods still have their place,https://www.racingpost.com/news/features/masters-of-betting/how-a-dodgy-bank-loan-led-to-nearly-40-years-as-a-pro-punter-proving-old-school-methods-still-have-their-place-aKazg3g7sdy3/,racing_post,
Patience pays off for Richards after a double with Lahore and Romantic Fantasy,https://www.scmp.com/sport/racing/article/3353887/patience-pays-jamie-richards-after-double-lahore-and-romantic-fantasy,scmp_racing,2026-05-17 19:24
Lui slams home brilliant Sha Tin treble as competitive championship rages on,https://www.scmp.com/sport/racing/article/3353885/francis-lui-slams-home-brilliant-sha-tin-treble-competitive-championship-rages,scmp_racing,2026-05-17 18:52
"Orman and So combine with three solid chances at Sha Tin, headlined by Perfectday",https://www.scmp.com/sport/racing/article/3353814/james-orman-and-chris-so-combine-three-solid-chances-sha-tin-headlined-perfectday,scmp_racing,2026-05-16 17:45
Lor ‘lucky’ to have Joao Moreira aboard Everyone’s Star at Sha Tin,https://www.scmp.com/sport/racing/article/3353805/frankie-lor-lucky-have-joao-moreira-aboard-everyones-star-sha-tin-sunday,scmp_racing,2026-05-16 15:00
Happy Valley set to provide trainers’ championship with its decisive swing,https://www.scmp.com/sport/racing/article/3353536/happy-valley-set-provide-trainers-championship-its-decisive-swing-shum-takes-over,scmp_racing,2026-05-14 18:30
Purton eyes Group One glory in Australia ahead of ride on Romantic Thor in Champions and Chater,https://www.scmp.com/sport/racing/article/3353533/zac-purton-eyes-group-one-glory-australia-ahead-ride-romantic-thor-champions-and-chater,scmp_racing,2026-05-14 16:00
Shum hits the front in trainers’ title with dominant Valley treble,https://www.scmp.com/sport/racing/article/3353477/danny-shum-hits-front-trainers-championship-dominant-happy-valley-treble,scmp_racing,2026-05-13 23:41
SCMP Best Bets: Lucrative Eight can be a profitable wager at Sha Tin,https://www.scmp.com/sport/racing/article/3353832/scmp-best-bets-lucrative-eight-can-be-profitable-wager-sha-tin,scmp_racing,2026-05-16 21:52
馬場浮世繪│巫偉傑「小」女打氣掂 (Racecourse Vignette | Ricky Yiu's daughter's cheer delivers),https://www.stheadline.com/realtime-racing/3573409/馬場浮世繪巫偉傑小女打氣掂,singtao_racing,2026-05-17 11:54 (15小時前)
"馬場浮世繪│巴黎組合「夢照發」 (Racecourse Vignette | Paris Partnership's ""Dream Manifests"")",https://www.stheadline.com/realtime-racing/3573408/馬場浮世繪巴黎組合夢照發,singtao_racing,2026-05-17 11:54 (15小時前)
"馬場密探048｜「神馳」蔡廄大熱食尾胡 (Racecourse Insider 048 | Hot favourite ""Spirit Chaser"" from Ting's stable wins by a whisker)",https://www.stheadline.com/realtime-racing/3573404/馬場密探048神馳蔡廄大熱食尾胡,singtao_racing,2026-05-17 10:54 (16小時前)
馬場浮世繪│Napoleon Solo勝出必利是錦標 (Racecourse Vignette | Napoleon Solo wins the Preakness Stakes),https://www.stheadline.com/realtime-racing/3573405/馬場浮世繪Napoleon-Solo勝出必利是錦標,singtao_racing,2026-05-17 10:54 (16小時前)
"馬場密探048｜「臻至辰」半冷取勝 (Racecourse Insider 048 | ""Perfect Day"" wins as a semi-outsider)",https://www.stheadline.com/realtime-racing/3573401/馬場密探048臻至辰半冷取勝,singtao_racing,2026-05-17 10:54 (16小時前)
馬場密探048｜「百勝威龍」呂廄中三元 (Racecourse Insider 048 | Lui's stable scores a treble),https://www.stheadline.com/realtime-racing/3573391/馬場密探048百勝威龍呂廄中三元,singtao_racing,2026-05-17 10:54 (16小時前)
"馬場密探048｜「夢照發」後上險勝 (Racecourse Insider 048 | ""Dream Manifests"" comes from behind to win by a narrow margin)",https://www.stheadline.com/realtime-racing/3573380/馬場密探048夢照發後上險勝,singtao_racing,2026-05-17 09:54 (17小時前)
"馬場密探048｜「自動自覺」袁幸堯起孖 (Racecourse Insider 048 | Yuan Xingyao scores a double with ""Self-Motivated"")",https://www.stheadline.com/realtime-racing/3573377/馬場密探048自動自覺袁幸堯起孖,singtao_racing,2026-05-17 09:54 (17小時前)
"馬場密探048｜「傑岀雷霆」捧獅子會盃 (Racecourse Insider 048 | ""Outstanding Thunder"" wins the Lions Club Cup)",https://www.stheadline.com/realtime-racing/3573361/馬場密探048傑岀雷霆捧獅子會盃,singtao_racing,2026-05-17 08:54 (18小時前)
"馬場密探048｜「巴閉精」大熱取勝 (Racecourse Insider 048 | Hot favourite ""Excellent Spirit"" wins)",https://www.stheadline.com/realtime-racing/3573357/馬場密探048巴閉精大熱取勝,singtao_racing,2026-05-17 08:54 (18小時前)
"馬場密探048｜「小魔怪」打開勝門 (Racecourse Insider 048 | ""Little Monster"" opens its winning account)",https://www.stheadline.com/realtime-racing/3573332/馬場密探048小魔怪打開勝門,singtao_racing,2026-05-17 06:54 (20小時前)
"馬場密探048｜「快樂高球」一放到底 (Racecourse Insider 048 | ""Happy Golf"" leads from start to finish)",https://www.stheadline.com/realtime-racing/3573327/馬場密探048快樂高球一放到底,singtao_racing,2026-05-17 06:54 (20小時前)
"馬場密探048｜「拉合爾」輕勝開齋 (Racecourse Insider 048 | ""Lahore"" wins easily, breaking its maiden)",https://www.stheadline.com/realtime-racing/3573320/馬場密探048拉合爾輕勝開齋,singtao_racing,2026-05-17 06:54 (20小時前)
"馬場密探048｜「齊歡最樂」今季第三捷 (Racecourse Insider 048 | ""All Fun and Joy"" scores its third win this season)",https://www.stheadline.com/realtime-racing/3573316/馬場密探048齊歡最樂今季第三捷,singtao_racing,2026-05-17 05:54 (21小時前)
"渣打冠軍暨遮打盃海外參賽馬「利森名園」抵港 (Overseas entrant ""Risky Eight"" arrives in Hong Kong for the Standard Chartered Champions & Chater Cup)",https://www.stheadline.com/realtime-racing/3573304/渣打冠軍暨遮打盃海外參賽馬利森名園抵港,singtao_racing,2026-05-17 04:54 (22小時前)
"「風雲武士」回配潘頓爭第七W (""Stormy Knight"" reunites with Purton, aiming for a seventh win)",https://www.stheadline.com/realtime-racing/3573281/風雲武士回配潘頓爭第七W,singtao_racing,2026-05-17 03:54 (23小時前)
"布浩榮周三接手「顏色之皇」 (Ben Ho Yung takes the ride on ""King of Colors"" on Wednesday)",https://www.stheadline.com/realtime-racing/3573279/布浩榮周三接手顏色之皇,singtao_racing,2026-05-18 02:54 (2026-05-17 10:27 HKT)
"田泰安「利高八斗」「捷足奔馳」 (Teetan on ""Lucky Eight"" and ""Swift Pace"")",https://www.stheadline.com/realtime-racing/3573139/田泰安利高八斗捷足奔馳,singtao_racing,2026-05-18 02:54 (2026-05-16 18:13 HKT)
"馬場浮世繪｜世界盃雷神睇好... (Racecourse Vignette | ""Thunder God"" (Moreira) tips for the World Cup...)",https://www.stheadline.com/realtime-racing/3573127/馬場浮世繪世界盃雷神睇好,singtao_racing,2026-05-18 02:54 (2026-05-16 17:45 HKT)
潘頓澳洲客串起孖 太太Nicole分享花絮 (Purton scores a double during his Australian stint; wife Nicole shares highlights),https://www.stheadline.com/realtime-racing/3573094/潘頓澳洲客串起孖-太太Nicole分享花絮,singtao_racing,2026-05-18 02:54 (2026-05-16 15:38 HKT)
Fasig-Tipton Midlantic Sale Begins Under New Format,https://www.bloodhorse.com/horse-racing/articles/291931/fasig-tipton-midlantic-sale-begins-under-new-format,bloodhorse_news,"2026-05-18 19:48 (ByOlivia NewmanToday, 7:48 PM)"
Sequel Brings Powerhouse Broman Consignment to F-T Sale,https://www.bloodhorse.com/horse-racing/articles/291933/sequel-brings-powerhouse-broman-consignment-to-f-t-sale,bloodhorse_news,"2026-05-18 18:54 (ByOlivia NewmanToday, 6:54 PM)"
"Lopez Not Dwelling On Preakness Victory, Eyes Haskell",https://www.bloodhorse.com/horse-racing/articles/291932/lopez-not-dwelling-on-preakness-victory-eyes-haskell,bloodhorse_news,"2026-05-18 17:36 (Today, 5:36 PM)"
Preakness Win a 'Moment of Pride' for Summers,https://www.bloodhorse.com/horse-racing/articles/291930/preakness-win-a-moment-of-pride-for-summers,bloodhorse_news,"2026-05-18 14:18 (BySean CollinsToday, 2:18 PM)"
Embroidery's 'Perfect' Victoria Mile Win Nets BC Bid,https://www.bloodhorse.com/horse-racing/articles/291929/embroiderys-perfect-victoria-mile-win-nets-bc-bid,bloodhorse_news,"2026-05-18 13:32 (ByBob KieckheferToday, 1:32 PM)"
Veteran Rothfire Takes Doomben Ten Thousand Stakes,https://www.bloodhorse.com/horse-racing/articles/291904/veteran-rothfire-takes-doomben-ten-thousand-stakes,bloodhorse_news,"2026-05-18 13:17 (ByKarl Patterson/ANZ Bloodstock NewsandZiva Mullins/ANZ BloodstockToday, 1:17 PM)"
Lovcen Expected Favorite for Japanese Derby,https://www.bloodhorse.com/horse-racing/articles/291911/lovcen-expected-favorite-for-japanese-derby,bloodhorse_news,"2026-05-18 08:00 (ByNaohiro GodaToday, 8:00 AM)"
Burnham Square Keeps Rolling on Turf,https://www.bloodhorse.com/horse-racing/articles/291908/burnham-square-keeps-rolling-on-turf,bloodhorse_news,"2026-05-17 22:48 (ByByron KingYesterday, 10:48 PM)"
Owner Gold Strikes Preakness Gold With Napoleon Solo,https://www.bloodhorse.com/horse-racing/articles/291910/owner-gold-strikes-preakness-gold-with-napoleon-solo,bloodhorse_news,"2026-05-17 21:50 (ByBob EhaltYesterday, 9:50 PM)"
"All Things Considered, Strong Handle for Preakness",https://www.bloodhorse.com/horse-racing/articles/291909/all-things-considered-strong-handle-for-preakness,bloodhorse_news,"2026-05-17 21:15 (ByFrank AngstYesterday, 9:15 PM)"
"Napoleon Solo Shines in Preakness, Repels Iron Honor",https://www.bloodhorse.com/horse-racing/articles/291901/napoleon-solo-shines-in-preakness-repels-iron-honor,bloodhorse_news,"2026-05-17 19:25 (BySean CollinsYesterday, 7:25 PM)"
"Back on Turf, Warming Brings the Heat in Gallorette",https://www.bloodhorse.com/horse-racing/articles/291907/back-on-turf-warming-brings-the-heat-in-gallorette,bloodhorse_news,"2026-05-17 18:29 (ByFrank AngstYesterday, 6:29 PM)"
