title,link,source,time
Derby flop to star miler? Gosdens' powers of reinvention put to the test with fascinating Lockinge favourite,https://www.racingpost.com/news/raceday-intel/the-big-story/derby-flop-to-star-miler-gosdens-powers-of-reinvention-put-to-the-test-with-fascinating-lockinge-favourite-auBOT1y1VkyF/,racing_post,
'Everything is right for him' - Tom Segal pinpoints one in the Lockinge on an action-packed Saturday,https://www.racingpost.com/horse-racing-tips/premium-tips/pricewise/everything-is-right-for-him-tom-segal-pinpoints-one-in-the-lockinge-on-an-action-packed-saturday-a8VSo3b6B8SM/,racing_post,
"‘If the sky’s the limit, I think we touched the sky’ - Lossiemouth’s sister heading to Ireland after €440,000 sale",https://www.racingpost.com/bloodstock/sales-reports/if-the-skys-the-limit-i-think-we-touched-the-sky-lossiemouths-sister-heading-to-ireland-after-440000-strike-at-inaugural-aktem-sale-aGcCA8m6L3BE/,racing_post,
Jockey facing possible lengthy whip ban very sorry for his 'mistake' - but trainer insists he didn't hit horse on the head,https://www.racingpost.com/news/britain/overseas-jockey-facing-possible-lengthy-whip-ban-was-fully-briefed-about-british-rules-aRHps6g6KEMl/,racing_post,
Leopardstown: Aidan O'Brien 'couldn't be happier' as Gold Cup favourite Scandinavia tees up Royal Ascot bid with narrow Saval Beg victory,https://www.racingpost.com/news/reports/scandinavia-tees-up-royal-ascot-with-a-determined-victory-in-the-saval-beg-aqSsj2a6ShCH/,racing_post,
Derby dream alive for Andrew Balding after Item's Dante heroics - as he confirms Royal Ascot aim for another brilliant York winner,https://www.racingpost.com/news/britain/derby-dream-alive-for-andrew-balding-after-items-dante-heroics-as-he-confirms-royal-ascot-aim-for-another-brilliant-york-winner-aPsUP5N9Ab8e/,racing_post,
2.35 Newbury: 'He's ready to go' - Zeus Olympios targets Group 1 glory against stacked Lockinge field,https://www.racingpost.com/news/raceday-intel/he-needs-to-win-his-group-1-and-hes-ready-to-go-zeus-olympios-faces-europes-best-milers-in-epic-clash-au91O0t9PozL/,racing_post,
"As it happened: Portcullis stays unbeaten on big day for King and Queen, Rahiebb shines in Yorkshire Cup and could Constitution Hill go to Germany?",https://www.racingpost.com/news/festivals/york-dante-festival/dante-festival-live-all-the-latest-going-news-non-runners-market-movers-and-more-on-yorkshire-cup-day-rqpX02f5stUr/,racing_post,
Eurovision Song Contest: Sam Hart's four Grand Final tips include a 100-1 outsider,https://www.racingpost.com/sport/special-events/eurovision/2026-eurovision-song-contest-grand-final-predictions-betting-tips-and-odds-aJAd32b7uUdP/,racing_post,
Kalpana's return plus Epsom and Ascot clues - three more races you can't miss on a belting Saturday,https://www.racingpost.com/news/raceday-intel/kalpanas-return-plus-epsom-and-ascot-clues-three-more-races-you-cant-miss-on-a-belting-saturday-aQvQ98g0kxVp/,racing_post,
3.10 Newbury: Will the Carnarvon Stakes again prove a key Commonwealth Cup trial? Keith Melrose has spotted a big discrepancy in the ante-post odds,https://www.racingpost.com/news/raceday-intel/will-the-carnarvon-stakes-again-prove-a-key-commonwealth-cup-trial-keith-melrose-has-spotted-a-big-discrepancy-in-the-ante-post-odds-aAFTC4s62nIV/,racing_post,
3.45 Newbury: The London Gold Cup has thrown up Group 1 horses galore - and our tipsters all agree on this year's standout,https://www.racingpost.com/news/raceday-intel/the-london-gold-cup-has-thrown-up-group-1-horses-galore-and-all-our-three-experts-agree-on-this-years-standout-aQUdH3B5tTGj/,racing_post,
3.25 Auteuil: Evergreen 11-year-old Home By The Lee takes on French Champion Hurdle mission as he goes for glory in third Grade 1 this spring,https://www.racingpost.com/news/raceday-intel/evergreen-11-year-old-home-by-the-lee-takes-on-french-champion-hurdle-mission-as-he-goes-for-glory-in-third-grade-1-this-spring-avUih7O6sDBF/,racing_post,
"'I think he'll win the Commonwealth Cup so take the 16-1 now' - Johnny and DJ with their weekend wagers, Classic tips and thoughts on VAR",https://www.racingpost.com/horse-racing-tips/premium-tips/johnny-v-dj/i-think-hell-win-the-commonwealth-cup-so-take-the-16-1-now-johnny-and-dj-with-their-weekend-wagers-classic-tips-and-thoughts-on-var-aHCix6g6v3dh/,racing_post,
Patience is a virtue - just ask this trainer enjoying his best run of form after more than two and a half decades,https://www.racingpost.com/news/opinion/comment/patience-is-a-virtue-just-ask-this-trainer-enjoying-his-best-run-of-form-after-more-than-two-and-a-half-decades-aevLJ3X4jGfX/,racing_post,
The knives are already being sharpened for Harry Cobden - but don't join the ludicrous knee-jerk reaction,https://www.racingpost.com/news/opinion/comment/the-knives-are-already-being-sharpened-for-harry-cobden-but-dont-join-the-ludicrous-knee-jerk-reaction-av0Fe9r18smd/,racing_post,
Olive Nicholls: 'Longer term I would love to train - and at some point I will join Dad',https://www.racingpost.com/news/features/interviews/olive-nicholls-longer-term-i-would-love-to-train-and-at-some-point-i-will-join-dad-abjuN6w01JB8/,racing_post,
Newmarket: 'Charlie said keep calm and carry on' - Appleby team back in business with a double on the Rowley Mile,https://www.racingpost.com/news/reports/charlie-just-said-to-keep-calm-and-carry-on-appleby-team-back-in-business-with-a-double-on-the-rowley-mile-aZGpT1I74m0R/,racing_post,
George Boughey makes bold Billy Loughnane claim as he predicts top jockey can become a ‘great trainer’,https://www.racingpost.com/news/britain/george-boughey-makes-bold-billy-loughnane-claim-as-he-predicts-top-jockey-can-become-a-great-trainer-aGPvi4O2FXDe/,racing_post,
"'Everything my kids have ever eaten, every time I switch on a light or put petrol in my car, a horse has paid for that'",https://www.racingpost.com/bloodstock/features/a-day-in-the-life/everything-my-kids-have-ever-eaten-every-time-i-switch-on-a-light-or-put-petrol-in-my-car-a-horse-has-paid-for-that-afbNy5U1uMsJ/,racing_post,
Dante: 'He keeps answering the questions' - Item stays unbeaten and cut to 6-1 for Derby as Juddmonte star again,https://www.racingpost.com/news/reports/item-maintains-unbeaten-record-and-enhances-derby-claims-to-continue-fine-week-for-juddmonte-aBSjX0d4TmWO/,racing_post,
York: 'Absolute machine' See The Fire scores historic repeat success at track where she was bred to excel,https://www.racingpost.com/news/reports/absolute-machine-see-the-fire-scores-historic-repeat-success-at-track-where-she-was-bred-to-excel-avPeo0O8IV3D/,racing_post,
Salisbury: 'He's got bags of speed' - Clive Cox thrilled as debutant delivers impressive performance,https://www.racingpost.com/news/reports/hes-got-bags-of-speed-clive-cox-thrilled-as-debutant-delivers-impressive-performance-al8PR4N1VdgR/,racing_post,
Perth: Olly Murphy's red-hot start to the season continues as course hat-trick makes it five winners in two days,https://www.racingpost.com/news/reports/olly-murphys-red-hot-start-to-the-season-continues-as-course-hat-trick-makes-it-five-winners-in-two-days-axxjR8k2vAUZ/,racing_post,
'He's strengthened up a good bit and the main aim will be to get him to the Breeders’ Cup',https://www.racingpost.com/news/features/stable-tours/hes-strengthened-up-a-good-bit-and-the-main-aim-will-be-to-get-him-to-the-breeders-cup-adEEg1F0p1KM/,racing_post,
'He's had a pretty extraordinary time and produced a big effort at the Breeders' Cup - you'd hope he's up to winning a Group 1',https://www.racingpost.com/news/features/stable-tours/hes-had-a-pretty-extraordinary-time-and-produced-a-big-effort-at-the-breeders-cup-youd-hope-hes-up-to-winning-a-group-1-a8sp35i5gkZ9/,racing_post,
'She’ll come forward a lot and winning a Group 1 is the aim this season’,https://www.racingpost.com/news/features/stable-tours/she-has-a-big-pedigree-and-was-impressive-in-her-maiden.-if-the-curragh-goes-well-then-the-irish-guineas-would-be-an-obvious-next-step-a4XKJ5f9buWl,racing_post,
"'That's given us the right to be more audacious and she'll probably go for the 1,000 Guineas'",https://www.racingpost.com/news/features/stable-tours/thats-given-us-the-right-to-be-more-audacious-and-shell-probably-go-for-the-1000-guineas-aTgTl8f3DVLw/,racing_post,
"'I did something so stupid, so ridiculous, so embarrassing that they couldn't possibly broadcast it - Chris Tarrant must have thought I was a prize idiot'",https://www.racingpost.com/news/features/series/i-did-something-so-stupid-so-ridiculous-so-embarrassing-that-they-couldnt-possibly-broadcast-it-chris-tarrant-must-have-thought-i-was-a-prize-idiot-aU8Rf7T0F13p/,racing_post,
Meet the Racing Post's first ever Newmarket correspondent - who used it as the launchpad for an astonishing career,https://www.racingpost.com/news/features/series/meet-the-racing-posts-first-ever-newmarket-correspondent-who-used-it-as-the-launchpad-for-an-astonishing-career-adp3N5B3jWaZ/,racing_post,
"'I had to sit in my office because I had tears in my eyes' - the most unforgettable stories in Racing Post history, as chosen by the editors",https://www.racingpost.com/news/features/series/i-had-to-sit-in-my-office-because-i-had-tears-in-my-eyes-the-most-unforgettable-stories-in-racing-post-history-as-chosen-by-the-editors-aJjSG1m9M86w/,racing_post,
'This was the start of a revolution' - the extraordinary inside story of the Racing Post's birth,https://www.racingpost.com/news/features/series/this-was-the-start-of-a-revolution-the-extraordinary-inside-story-of-the-racing-posts-birth-asQ7f6Z1aiL0/,racing_post,
WATCH: What keeps the Racing Post number one? Inside 40 years of horseracing expertise,https://www.racingpost.com/news/features/series/watch-what-keeps-the-racing-post-number-one-inside-40-years-of-horseracing-expertise-aKViL8I2Adjo/,racing_post,
I'm getting a headache already after draw bias at York leaves me completely bewildered,https://www.racingpost.com/news/opinion/comment/im-getting-a-headache-already-after-draw-bias-at-york-leaves-me-completely-bewildered-arikR6m5HrCp/,racing_post,
In these tough times for punters it's never been more important we stick together - and this is how we do it,https://www.racingpost.com/news/opinion/comment/in-these-tough-times-for-punters-its-never-been-more-important-we-stick-together-and-this-is-how-we-do-it-aHwSx2a6ouqm/,racing_post,
Betting expert hits back at 'clearly ludicrous' claim affordability checks can't be assessed until they are implemented,https://www.racingpost.com/news/britain/betting-expert-hits-back-at-clearly-ludicrous-claim-affordability-checks-cant-be-assessed-until-they-are-implemented-ahd4d8x0Ok1g/,racing_post,
Newbury's Lockinge card isn't just about one race - which future stars could emerge from a race well known for producing lots of winners?,https://www.racingpost.com/news/britain/newburys-lockinge-card-isnt-just-about-one-race-which-future-stars-could-emerge-from-a-race-well-known-for-producing-lots-of-winners-aSTDW5O4OkIb/,racing_post,
The mile division is wide open before the Lockinge - what are the strengths and weaknesses of the main players?,https://www.racingpost.com/news/britain/2026-boyle-sports-lockinge-stakes-contenders-assessing-the-key-runners-for-the-big-race-at-newbury-on-saturday-avssj4b5Dj2H/,racing_post,
Illegal betting in pubs 'area of intense focus' for Irish gambling authority as research suggests at least 100 bars offer unlawful services,https://www.racingpost.com/news/ireland/illegal-betting-in-pubs-area-of-intense-focus-for-irish-gambling-authority-as-research-suggests-at-least-100-establishments-offer-unlawful-services-aOW717F0G3N4/,racing_post,
"'We're there in a mentorship role and to help maximise opportunities' - Fran Berry, Ruby Walsh and Emmet McNamara co-found new management agency for jockeys",https://www.racingpost.com/news/ireland/were-there-in-a-mentorship-role-and-to-help-maximise-opportunities-fran-berry-ruby-walsh-and-emmet-mcnamara-co-found-new-management-agency-for-jockeys-ahxnl6y40XmP/,racing_post,
"'It would be a huge way to end a brilliant season' - can the evergreen Home By The Lee do it again, this time in France?",https://www.racingpost.com/news/ireland/it-would-be-a-huge-way-to-end-a-brilliant-season-can-the-evergreen-home-by-the-lee-do-it-again-this-time-in-france-aCWK69V29MHF/,racing_post,
Irish Grand National winner Soldier In Milan could sport new silks next season as British owner buys into Aintree candidate,https://www.racingpost.com/news/ireland/irish-grand-national-winner-soldier-in-milan-could-sport-new-silks-next-season-as-british-owner-buys-into-aintree-candidate-aQWPv6v82FXl/,racing_post,
'She goes to the Oaks with some of the strongest form and must stand a big chance' - Charlie Johnston Q&A,https://www.racingpost.com/news/features/interviews/she-goes-to-the-oaks-with-some-of-the-strongest-form-and-must-stand-a-big-chance-ajxv72B09K7Q/,racing_post,
‘People said it would never work’ - how an innovative trainer found an unlikely way to diversify her yard,https://www.racingpost.com/news/features/interviews/people-said-it-would-never-work-how-a-struggling-trainer-found-an-unlikely-way-to-make-ends-meet-a1xxU3k8fYVn/,racing_post,
"'I was riding against the best in America, now I've come back and it's tricky - but I'm not here to fart about'",https://www.racingpost.com/news/features/interviews/i-was-riding-against-the-best-in-america-now-ive-come-back-and-its-tricky-but-im-not-here-to-fart-about-aVmjb0B2Etuw/,racing_post,
Japanese star Forever Young now highly unlikely to run in the Prince of Wales's Stakes at Royal Ascot,https://www.racingpost.com/news/festivals/royal-ascot/japanese-star-forever-young-now-highly-unlikely-to-run-in-the-prince-of-waless-stakes-at-royal-ascot-a45MC3t34Oda/,racing_post,
High-class mare Apple Away set for Grade 1 challenge in the French Champion Hurdle,https://www.racingpost.com/news/britain/high-class-mare-apple-away-set-for-grade-1-challenge-in-the-french-champion-hurdle-aJGkO4y6i9Bo/,racing_post,
Top Australian sprinter ruled out of Royal Ascot and career in jeopardy after stingray attack on Brisbane beach,https://www.racingpost.com/news/festivals/royal-ascot/top-australian-sprinter-ruled-out-of-royal-ascot-and-career-in-jeopardy-after-stingray-attack-on-brisbane-beach-abYF41B7MYEs/,racing_post,
"Chaos, compromise or change? Ascot has gone rogue once more - now racing faces its reckoning",https://www.racingpost.com/news/opinion/comment/chaos-compromise-or-change-ascot-has-gone-rogue-once-more-now-racing-faces-its-reckoning-a5eGI2F3ZR89/,racing_post,
"Small attendance, big contradictions: key takeouts from the Westminster debate on gambling advertising",https://www.racingpost.com/news/opinion/comment/small-attendance-big-contradictions-key-takeouts-from-the-westminster-debate-on-gambling-advertising-aJGRJ4a7iOBf/,racing_post,
The Gambling Commission has not resolved this crucial issue - and ministers must not let them off the hook,https://www.racingpost.com/news/opinion/comment/the-gambling-commission-has-not-resolved-this-crucial-issue-and-ministers-must-not-let-them-off-the-hook-aiCL53x5Z5WD/,racing_post,
It should be obvious that affordability checks will not do what they're supposed to - it is vital racing helps the government realise that,https://www.racingpost.com/news/opinion/comment/it-should-be-obvious-that-affordability-checks-will-not-do-what-theyre-supposed-to-it-is-vital-racing-helps-the-government-realise-that-aOgV79N5c0Uk/,racing_post,
"Poker genius, visionary football chairman and pioneering data-led punter - the many (profitable) faces of Tony Bloom",https://www.racingpost.com/news/features/masters-of-betting/poker-genius-visionary-football-chairman-and-pioneering-data-led-punter-the-many-profitable-faces-of-tony-bloom-a0UWt2Y6DPmh/,racing_post,
"Introducing Masters of Betting, an unmissable series available now - read it all with 25% off RP+",https://www.racingpost.com/news/introducing-masters-of-betting-an-unmissable-series-next-week-in-the-racing-post-read-it-all-with-25-off-rp-aJKV17m1iNzx/,racing_post,
"'I was down £11,000 but you can't let that alter what you do' - meet one of the giants of on-course betting",https://www.racingpost.com/news/features/masters-of-betting/i-was-down-11000-but-you-cant-let-that-alter-what-you-do-meet-one-of-the-giants-of-on-course-betting-aXYs01f58AHh/,racing_post,
When science met punting: the godfather of modern-day betting and his golden rules that remain valid to this day,https://www.racingpost.com/news/features/masters-of-betting/when-science-met-punting-the-godfather-of-modern-day-betting-and-his-golden-rules-that-remain-valid-to-this-day-aO1b67N07bKR/,racing_post,
How a dodgy bank loan led to nearly 40 years as a pro punter - proving old-school methods still have their place,https://www.racingpost.com/news/features/masters-of-betting/how-a-dodgy-bank-loan-led-to-nearly-40-years-as-a-pro-punter-proving-old-school-methods-still-have-their-place-aKazg3g7sdy3/,racing_post,
Purton eyes Group One glory in Australia ahead of ride on Romantic Thor in Champions and Chater,https://www.scmp.com/sport/racing/article/3353533/zac-purton-eyes-group-one-glory-australia-ahead-ride-romantic-thor-champions-and-chater,scmp_racing,2026-05-14 16:00
Shum hits the front in trainers’ title with dominant Valley treble,https://www.scmp.com/sport/racing/article/3353477/danny-shum-hits-front-trainers-championship-dominant-happy-valley-treble,scmp_racing,2026-05-13 23:41
In-form duo of Teetan and Size combine with Beauty Alliance at Happy Valley,https://www.scmp.com/sport/racing/article/3353235/form-pairing-karis-teetan-and-john-size-combine-beauty-alliance-happy-valley,scmp_racing,2026-05-12 15:00
SCMP Best Bets: Ace War can lead the pack at Happy Valley,https://www.scmp.com/sport/racing/article/3353314/scmp-best-bets-ace-war-can-lead-pack-happy-valley,scmp_racing,2026-05-12 21:40
艾兆禮「安泰」「八仟好運」 (Alfred Chan on 'Antai' and 'Eight Thousand Fortunes'),https://www.stheadline.com/realtime-racing/3572811/艾兆禮安泰八仟好運,singtao_racing,2026-05-15 09:36 (17小時前)
"田泰安今早操「利高八斗」力爭五連勝 (Karis Teetan worked ""Regency Horse"" this morning, aiming for five consecutive wins)",https://www.stheadline.com/realtime-racing/3572714/田泰安今早操利高八斗力爭五連勝,singtao_racing,2026-05-15 08:36 (18小時前)
馬場浮世繪│麥都華被釘牌五年 (Racecourse Vignettes | Matthew Chadwick suspended for five years),https://www.stheadline.com/realtime-racing/3572781/馬場浮世繪麥都華被釘牌五年,singtao_racing,2026-05-15 08:36 (18小時前)
"樂景傑錦標「飛速巨霸」冀打破「名演說」與「輕易事」兩強局面創驚喜 (Lockinge Stakes: ""Flying Mighty"" hopes to break the duopoly of ""Mostahdaf"" and ""Modern Games"" to create a surprise)",https://www.stheadline.com/realtime-racing/3572778/樂景傑錦標飛速巨霸冀打破名演說與輕易事兩強局面創驚喜,singtao_racing,2026-05-15 08:36 (18小時前)
"何澤堯探完「金鎗六十」周日搏殺 (Vincent Ho to race on Sunday after visiting ""Golden Sixty"")",https://www.stheadline.com/realtime-racing/3572708/何澤堯探完金鎗六十周日搏殺,singtao_racing,2026-05-15 06:36 (20小時前)
韋紀力獲准在渣打冠軍暨遮打盃中策騎出賽 (Mark Zahra granted permission to ride in the Standard Chartered Champions & Chater Cup),https://www.stheadline.com/realtime-racing/3572731/韋紀力獲准在渣打冠軍暨遮打盃中策騎出賽,singtao_racing,2026-05-15 06:36 (20小時前)
"「肥仔精神」今早落樓   騎馬人迅速拉回 (""Chubby Spirit"" got loose this morning; the rider quickly brought it back)",https://www.stheadline.com/realtime-racing/3572701/肥仔精神今早落樓-騎馬人迅速拉回,singtao_racing,2026-05-15 06:36 (20小時前)
"「巧繡生花」回復勇銳力爭維多利亞一哩賽桂冠 (""Well Done Mate"" regains sharpness to contend for the Victoria Mile crown)",https://www.stheadline.com/realtime-racing/3572729/巧繡生花回復勇銳力爭維多利亞一哩賽桂冠,singtao_racing,2026-05-15 06:36 (20小時前)
"渣打冠軍暨遮打盃海外參賽馬「大怪奇」抵港 (Overseas runner ""Daiki"" for the Standard Chartered Champions & Chater Cup arrives in Hong Kong)",https://www.stheadline.com/realtime-racing/3572728/渣打冠軍暨遮打盃海外參賽馬大怪奇抵港,singtao_racing,2026-05-15 06:36 (20小時前)
"香港馬王「嘉應高昇」連破場地時間紀錄續居浪琴世界最佳馬匹排名榜首 (Hong Kong Horse of the Year ""Ka Ying Star"" breaks track records consecutively, remaining at the top of the Longines World's Best Racehorse Rankings)",https://www.stheadline.com/realtime-racing/3572721/香港馬王嘉應高昇連破場地時間紀錄續居浪琴世界最佳馬匹排名榜首,singtao_racing,2026-05-15 06:36 (20小時前)
"郭富城新貴「舞林盛宴」初出即搏 (Aaron Kwok's new acquisition ""Dancing Feast"" to race immediately on debut)",https://www.stheadline.com/realtime-racing/3572696/郭富城新貴舞林盛宴初出即搏,singtao_racing,2026-05-15 05:36 (21小時前)
黃嘉雯周日兩駒出賽 (Carmaney Wong has two horses racing on Sunday),https://www.stheadline.com/realtime-racing/3572688/黃嘉雯周日兩駒出賽,singtao_racing,2026-05-15 04:36 (22小時前)
馬場浮世繪｜Danon Bourbon征美傷腳 西村淳也超一鞭被罰 (Racecourse Vignettes | Danon Bourbon injured its leg campaigning in America; Junya Nishimura fined for one whip over limit),https://www.stheadline.com/realtime-racing/3572316/馬場浮世繪Danon-Bourbon征美傷腳-西村淳也超一鞭被罰,singtao_racing,2026-05-16 02:36 (2026-05-14 12:19 HKT)
"馬場密探048｜「包裝福星」轉場報捷 (Racecourse Insider 048 | ""Packing Fook Star"" wins after switching venues)",https://www.stheadline.com/realtime-racing/3572178/馬場密探048包裝福星轉場報捷,singtao_racing,2026-05-16 02:36 (2026-05-13 23:15 HKT)
"馬場浮世繪│潘頓「追風」次次成功 (Racecourse Vignettes | Zac Purton's ""Chasing Wind"" successful every time)",https://www.stheadline.com/realtime-racing/3572176/馬場浮世繪潘頓追風次次成功,singtao_racing,2026-05-16 02:36 (2026-05-13 23:04 HKT)
"馬場密探048｜「馬達」飛到馬到勝出 (Racecourse Insider 048 | ""Ma Da"" wins upon arrival)",https://www.stheadline.com/realtime-racing/3572174/馬場密探048馬達飛到馬到勝出,singtao_racing,2026-05-16 02:36 (2026-05-13 23:02 HKT)
"馬場密探048｜「驕陽雄心」沈廄中三元 (Racecourse Insider 048 | ""Proud Heart"" scores a hat-trick for the Shum stable)",https://www.stheadline.com/realtime-racing/3572158/馬場密探048驕陽雄心沈廄中三元,singtao_racing,2026-05-16 02:36 (2026-05-13 22:59 HKT)
"馬場浮世繪│蔡約翰又「獵寶勤」 (Racecourse Vignettes | John Size again with ""Hunting Treasure"")",https://www.stheadline.com/realtime-racing/3572170/馬場浮世繪蔡約翰又獵寶勤,singtao_racing,2026-05-16 02:36 (2026-05-13 22:47 HKT)
"馬場密探048｜「追風」四配潘頓俱勝 (Racecourse Insider 048 | ""Chasing Wind"" wins all four races when paired with Zac Purton)",https://www.stheadline.com/realtime-racing/3572149/馬場密探048追風四配潘頓俱勝,singtao_racing,2026-05-16 02:36 (2026-05-13 21:43 HKT)
"馬場密探048｜「奔放」捧法國賽馬會盃 (Racecourse Insider 048 | ""Runaway"" wins the Prix du Jockey Club)",https://www.stheadline.com/realtime-racing/3572140/馬場密探048奔放捧法國賽馬會盃,singtao_racing,2026-05-16 02:36 (2026-05-13 21:02 HKT)
No Easy Answers for a Triple Crown Under Siege,https://www.bloodhorse.com/horse-racing/articles/291883/no-easy-answers-for-a-triple-crown-under-siege,bloodhorse_news,"2026-05-16 21:00 (ByJay HovdeyToday, 9:00 PM)"
My Miss Mo Finds More in Black-Eyed Susan,https://www.bloodhorse.com/horse-racing/articles/291889/my-miss-mo-finds-more-in-black-eyed-susan,bloodhorse_news,"2026-05-16 20:23 (ByBob EhaltToday, 8:23 PM)"
"Incredibolt, Taj Mahal at 5-1 in Early Preakness Wagers",https://www.bloodhorse.com/horse-racing/articles/291888/incredibolt-taj-mahal-at-5-1-in-early-preakness-wagers,bloodhorse_news,"2026-05-16 19:43 (BySean CollinsToday, 7:43 PM)"
Riley Mott Returns to Laurel Park With Incredibolt,https://www.bloodhorse.com/horse-racing/articles/291887/riley-mott-returns-to-laurel-park-with-incredibolt,bloodhorse_news,"2026-05-16 19:23 (Today, 7:23 PM)"
Navajo Warrior Wins Pimlico Special in Stakes Debut,https://www.bloodhorse.com/horse-racing/articles/291886/navajo-warrior-wins-pimlico-special-in-stakes-debut,bloodhorse_news,"2026-05-16 19:21 (ByFrank AngstToday, 7:21 PM)"
Margie's Intention Repeats Maryland Magic in DuPont,https://www.bloodhorse.com/horse-racing/articles/291882/margies-intention-repeats-maryland-magic-in-dupont,bloodhorse_news,"2026-05-16 17:52 (ByOlivia NewmanToday, 5:52 PM)"
Peach Tie Defends Home Track in Miss Preakness,https://www.bloodhorse.com/horse-racing/articles/291884/peach-tie-defends-home-track-in-miss-preakness,bloodhorse_news,"2026-05-16 16:50 (BySean CollinsToday, 4:50 PM)"
Stakes Preview: Preakness Stakes & Dinner Party Stakes,https://www.bloodhorse.com/horse-racing/videos/291885/stakes-preview-preakness-stakes-and-dinner-party-stakes,bloodhorse_news,"2026-05-16 16:48 (Today, 4:48 PM)"
NYRA Announces Saratoga Breakfast and Farm Tours,https://www.bloodhorse.com/horse-racing/articles/291881/nyra-announces-saratoga-breakfast-and-farm-tours,bloodhorse_news,"2026-05-16 15:02 (Today, 3:02 PM)"
Pair of Incidents Mar Early Portion of Laurel Park Card,https://www.bloodhorse.com/horse-racing/articles/291880/pair-of-incidents-mar-early-portion-of-laurel-park-card,bloodhorse_news,"2026-05-16 14:29 (ByFrank AngstToday, 2:29 PM)"
