title,link,source,time
He's produced a hit film with Samuel L Jackson - now he says winning the Derby would be his 'greatest achievement',https://www.racingpost.com/news/festivals/derby-festival/film-producer-george-waud-conquering-the-betfred-derby-will-be-probably-my-greatest-achievement-aZnm94X0K3ST/,racing_post,
'He looks a much faster model' - Tom Segal has 20-1 and 16-1 fancies for Royal Ascot,https://www.racingpost.com/horse-racing-tips/premium-tips/ante-post-tips/he-looks-a-much-faster-model-tom-segal-has-20-1-and-16-1-fancies-for-royal-ascot-aNqXT9u5MNoD/,racing_post,
‘The excitement is off the scale’ - ITV pundit Kevin Blake counting down the days to James J Braddock’s Derby bid,https://www.racingpost.com/news/festivals/derby-festival/good-horses-should-win-from-any-draw-excitement-builds-at-epsom-as-anna-lisa-balding-weighs-in-on-britains-leading-derby-hope-a09EF6R5yDPn/,racing_post,
"'I don't just want to survive, I want to be happy, and my happiness is horses' - an inspirational quote from an inspirational woman",https://www.racingpost.com/news/ireland/i-dont-just-want-to-survive-i-want-to-be-happy-and-my-happiness-is-horses-an-inspirational-quote-from-an-inspirational-woman-aSZiO3l9Briy/,racing_post,
Confirmed runners and riders for the Derby and Oaks at Epsom: Christophe Soumillon bags big ride for Aidan O'Brien,https://www.racingpost.com/news/festivals/derby-festival/confirmed-runners-and-riders-for-the-derby-and-oaks-at-epsom-aZOHu2a4Hvjb/,racing_post,
The Derby draw is the talk of the town - but does stalls position actually have an impact on the Epsom Classic?,https://www.racingpost.com/news/betting-insight/the-derby-draw-is-the-talk-of-the-town-but-does-stalls-position-actually-have-an-impact-on-the-epsom-classic-alGPC2z67BQZ/,racing_post,
"Bought by the son, trained by the father, inspired by the legend - the family affair behind the ultimate Derby fairytale",https://www.racingpost.com/bloodstock/features/in-focus/bought-by-the-son-trained-by-the-father-inspired-by-the-legend-the-family-affair-behind-the-ultimate-derby-fairytale-an2OU4w8601d/,racing_post,
'It would create opportunities for illegal operators to grow' - Irish bookmakers fear potential new EU betting tax,https://www.racingpost.com/news/ireland/it-would-create-opportunities-for-illegal-operators-to-grow-irish-bookmakers-fear-potential-new-eu-betting-tax-an0RR1J0h4bn/,racing_post,
Derby runner-up Ambiente Friendly up for sale at Tattersalls July,https://www.racingpost.com/bloodstock/news/sales-news/derby-runner-up-ambiente-friendly-up-for-sale-at-tattersalls-july-aSwYx1r3RtwB/,racing_post,
Levy yield projected to have hit post-reform high of £110m but 'significant concern' remains over turnover trends,https://www.racingpost.com/news/britain/levy-yield-projected-to-have-hit-post-reform-high-of-110m-but-significant-concern-remains-over-turnover-trends-aUqoJ7P6oaDM/,racing_post,
A 16-1 shot 'expected to be in the shake-up' and a 4.3 million guineas 200-1 outsider - who are Amo Racing's two Derby runners?,https://www.racingpost.com/news/festivals/derby-festival/a-16-1-shot-expected-to-be-in-the-shake-up-and-a-4.3-million-guineas-200-1-outsider-who-are-amo-racings-two-derby-runners-a3Y2s9k4FdEE,racing_post,
'I fancy him to outstay the favourite' - Tom Segal is pinning his hopes on one horse in the Queen Anne,https://www.racingpost.com/horse-racing-tips/premium-tips/ante-post-tips/i-fancy-him-to-outstay-the-favourite-tom-segal-is-pinning-his-hopes-on-one-horse-in-the-queen-anne-aBAMw4b46PZN/,racing_post,
"Who are the most exciting unexposed three-year-olds in Britain? Finally, it’s a quiz question I can answer",https://www.racingpost.com/news/opinion/ross-brierley/who-are-the-most-exciting-unexposed-three-year-olds-in-britain-finally-its-a-quiz-question-i-can-answer-adoNi1j572uk/,racing_post,
I fancy more Classic glory for Aidan O’Brien this weekend - but with this 12-1 shot rather than one of the big guns,https://www.racingpost.com/news/opinion/comment/i-fancy-more-classic-glory-for-aidan-obrien-this-weekend-but-with-this-12-1-shot-rather-than-one-of-the-big-guns-appVs5I5xVL3/,racing_post,
WATCH: Bow Echo continues his Royal Ascot preparations - plus a multiple Group 1 winner who appears to be progressing quickly at home,https://www.racingpost.com/news/newmarket-gallops/watch-bow-echo-continues-his-royal-ascot-preparations-plus-a-multiple-group-1-winner-who-appears-to-be-progressing-quickly-at-home-aR75N5o1vvKc/,racing_post,
'I've no doubt he remains well handicapped' - Paul Kealy with a strong Thursday selection,https://www.racingpost.com/horse-racing-tips/premium-tips/top-tipsters/ive-no-doubt-he-remains-well-handicapped-paul-kealy-with-a-strong-thursday-selection-atr0q3k2Lqks/,racing_post,
'The trip will bring out the best in her' - Alan Sweetman has two fancies from Leopardstown on Thursday,https://www.racingpost.com/horse-racing-tips/premium-tips/view-from-ireland/the-trip-will-bring-out-the-best-in-her-alan-sweetman-has-two-fancies-from-leopardstown-on-thursday-arv0V4i2CdBa/,racing_post,
"Free horse racing tips for Thursday, June 4 at Ffos Las, Hamilton, Leopardstown, Lingfield and Wetherby",https://www.racingpost.com/horse-racing-tips/todays-top-tips/free-horse-racing-tips-for-thursday-june-4-at-ffos-las-hamilton-leopardstown-lingfield-and-wetherby-aha8l6A4mTSp/,racing_post,
Big-race trends: key stats to help you find the winners of the King Charles III Stakes and Queen Elizabeth II Jubilee Stakes,https://www.racingpost.com/horse-racing-tips/premium-tips/ante-post-tips/big-race-trends-key-stats-to-help-you-find-the-winners-of-the-king-charles-iii-stakes-and-queen-elizabeth-ii-jubilee-stakes-aAWVQ7T43qBg/,racing_post,
New report reveals an untapped global audience of 200 million for racing,https://www.racingpost.com/news/britain/new-report-reveals-an-untapped-global-audience-of-200-million-for-racing-apNu31n7Pieh/,racing_post,
"'Every single day is precious, don't waste a moment' - poignant win for Rob Burrow Racing Club on second anniversary of rugby legend's death",https://www.racingpost.com/news/reports/every-single-day-is-precious-dont-waste-a-moment-poignant-win-for-rob-burrow-racing-club-on-second-anniversary-of-rugby-legends-death-atIDv8Q8oYns/,racing_post,
Melbourne Cup-winning trainers fighting to avoid disqualification for banned treatment on raceday,https://www.racingpost.com/news/international/australia/melbourne-cup-winning-trainers-fighting-to-avoid-disqualification-for-banned-treatment-on-raceday-anYwf0i8E8Kz/,racing_post,
IHRB responds to Listowel watering controversy after heated row with Shark Hanlon over ground conditions,https://www.racingpost.com/news/ireland/ihrb-responds-to-listowel-watering-controversy-after-heated-row-with-shark-hanlon-over-ground-conditions-adrpN1r9EaXa/,racing_post,
Who will win the 2026 Derby and Oaks at Epsom based on previous trends?,https://www.racingpost.com/news/festivals/derby-festival/who-will-win-the-2026-derby-and-oaks-at-epsom-based-on-previous-trends-ai4mx8B5WKdD/,racing_post,
'I could see it easing a bit further' - Derby track going changed with more rain expected on Thursday,https://www.racingpost.com/news/festivals/derby-festival/i-could-see-it-easing-a-bit-further-derby-track-going-changed-with-more-rain-expected-on-thursday-aZC7R9f1SxZh/,racing_post,
"Let's get ready to rumble! Frank Warren has high hopes for the Derby meeting with more than 60,000 expected at Epsom",https://www.racingpost.com/news/festivals/derby-festival/lets-get-ready-to-rumble-frank-warren-has-high-hopes-for-the-derby-meeting-with-more-than-60000-expected-at-epson-aJWPP8f9F2Cb/,racing_post,
Why the Epsom ground is likely to be softer than advertised,https://www.racingpost.com/news/betting-insight/why-the-epsom-ground-is-likely-to-be-softer-than-advertised-ashYN2o9Ll5S/,racing_post,
"Nottingham: 900,000gns breeze-up purchase makes perfect start for Crisfords to tee up Royal Ascot bid",https://www.racingpost.com/news/reports/900000gns-breeze-up-purchase-makes-perfect-start-for-crisfords-to-tee-up-royal-ascot-bid-aHa605j6BRsO/,racing_post,
Newton Abbot: 'It's an amazing place' - Kielan Woods praises Oaksey House team after first winner back from hip injury,https://www.racingpost.com/news/reports/its-an-amazing-place-kielan-woods-praises-oaksey-house-team-after-first-winner-back-from-hip-injury-alDyp5m9xqRe/,racing_post,
Andrew Balding strikes in Italian Derby - days before Item bids for Classic glory at Epsom,https://www.racingpost.com/news/reports/andrew-balding-strikes-in-italian-derby-days-before-item-bids-for-classic-glory-at-epsom-aLLhz4U8Qqr4/,racing_post,
'Stand by your beds if Willie Mullins has this one ready to right the wrongs of last year's Ascot disappointment',https://www.racingpost.com/news/features/series/stand-by-your-beds-if-willie-mullins-has-this-one-ready-to-right-the-wrongs-of-last-years-ascot-disappointment-a14kh5T3cICQ/,racing_post,
Why almost everything you read about football statistics is nonsense - and what it says about the traps punters can fall into,https://www.racingpost.com/sport/40-years-of-expertise/why-almost-everything-you-read-about-football-statistics-is-nonsense-and-what-it-says-about-the-traps-punters-can-fall-into-ayyST3x9vEvp/,racing_post,
Spotting stars on the Newmarket gallops: what you’re looking out for when trying to find the next Frankel,https://www.racingpost.com/news/features/series/spotting-stars-on-the-newmarket-gallops-what-youre-looking-out-for-when-trying-to-find-the-next-frankel-ayA6t9e5al4Y/,racing_post,
‘The edge you’ve got is your own eyes’ - how one of jump racing’s top judges stays ahead of the machines,https://www.racingpost.com/news/features/series/the-edge-youve-got-is-your-own-eyes-how-one-of-jump-racings-top-judges-stays-ahead-of-the-machines-aA6oL7f2QbDT/,racing_post,
The future of form study: James Willoughby and Keith Melrose assess how the game will evolve for punters,https://www.racingpost.com/news/features/series/the-future-of-form-study-james-willoughby-and-keith-melrose-assess-how-the-game-will-evolve-for-punters-ayFlm2I0lkQO/,racing_post,
How Aidan O'Brien accidentally encapsulated the essence of a modern Derby,https://www.racingpost.com/news/opinion/comment/how-aidan-obrien-accidentally-encapsulated-the-essence-of-a-modern-derby-akdWa2M2uGFp/,racing_post,
It is time for a Group 1 evening meeting in Britain - perhaps even a Classic,https://www.racingpost.com/news/opinion/comment/it-is-time-for-a-group-1-evening-meeting-in-britain-perhaps-even-a-classic-afL2a4G6N71E/,racing_post,
Paul Kealy with a horse 'tailormade for a big handicap' among five tips for Epsom on Saturday - including a Derby pick,https://www.racingpost.com/news/opinion/comment/paul-kealy-with-a-horse-tailormade-for-a-big-handicap-among-five-tips-for-epsom-on-saturday-including-a-derby-pick-aDHbd1Q0Dtfm/,racing_post,
A Derby outsider is firmly on my radar after last week served as a reminder to look beyond the obvious,https://www.racingpost.com/news/opinion/comment/a-derby-outsider-is-firmly-on-my-radar-after-last-week-served-as-a-reminder-to-look-beyond-the-obvious-aZhDe0S2Zvaz/,racing_post,
Aidan O'Brien reveals Precise's Oaks participation in doubt after heavy rain hits Epsom,https://www.racingpost.com/news/festivals/derby-festival/aidan-obrien-reveals-precises-oaks-participation-in-doubt-after-heavy-rain-hits-epsom-af5OV3V4xj6n/,racing_post,
Dermot Weld has some 'major targets' in mind for Juddmonte's hugely impressive Curragh winner,https://www.racingpost.com/news/ireland/dermot-weld-has-some-major-targets-in-mind-for-juddmontes-hugely-impressive-curragh-winner-aSQkT3D53qPy/,racing_post,
How Aidan O'Brien is threatening to outperform his greatest seasons,https://www.racingpost.com/news/festivals/derby-festival/how-aidan-obrien-is-threatening-to-outperform-his-greatest-seasons-aUicg9x02Zxc/,racing_post,
Kieren Fallon: 'Constitution River would have won the Derby - but Aidan O'Brien will win it anyway',https://www.racingpost.com/news/festivals/derby-festival/kieren-fallon-constitution-river-would-have-won-the-derby-but-aidan-will-win-it-anyway-aPuYo6J2RdPM/,racing_post,
"'One minute I'm in the White House watching Donald Trump and the King hang out, then I'm back here to ride out and the trainer's in a grump'",https://www.racingpost.com/news/features/interviews/one-minute-im-in-the-white-house-watching-donald-trump-and-the-king-hang-out-then-im-back-here-to-ride-out-and-the-trainers-in-a-grump-aRw7V4i8GkEG/,racing_post,
'People think I say things to boost up horses. I don't. Ever. I only say what I think at the time. Maybe I'm a bit of a dreamer',https://www.racingpost.com/news/features/the-big-read/people-think-i-say-things-to-boost-up-horses.-i-dont.-ever.-i-only-say-what-i-think-at-the-time.-maybe-im-a-bit-of-a-dreamer-aW2zx7I51kAo,racing_post,
'Donald Trump with taste' - meet the president's boyhood pal who combines fine art with fine horses and now owns the Derby favourite,https://www.racingpost.com/news/features/interviews/donald-trump-with-taste-meet-the-presidents-boyhood-pal-who-combines-fine-art-with-fine-horses-and-now-owns-the-derby-favourite-ap4Oo3Z3v8q1/,racing_post,
'You can't be more sorry than I am' - remorseful jockey's return to the winner's enclosure after a coma and a prison sentence,https://www.racingpost.com/news/features/interviews/you-cant-be-more-sorry-than-i-am-remorseful-jockeys-return-to-the-winners-enclosure-after-a-coma-and-a-prison-sentence-auQIa8d6gz6V/,racing_post,
An exceptional colt who defied belief or workmanlike? Constitution River divides opinion,https://www.racingpost.com/news/betting-insight/an-exceptional-colt-who-defied-belief-or-workmanlike-constitution-river-divides-opinion-aC0kX7X62Mqi/,racing_post,
WATCH: Constitution River lights up Paris | The Front Page,https://www.racingpost.com/video/the-front-page/watch-constitution-river-lights-up-paris-the-front-page-av14k7N12Vam/,racing_post,
Big punters have already been 'displaced' to the black market - the danger is that more may follow,https://www.racingpost.com/news/opinion/comment/big-punters-have-already-been-displaced-to-the-black-market-the-danger-is-that-more-may-follow-aTfsR1x2Et5B/,racing_post,
Government washes its hands of responsibility as uncertainty over affordability checks continues,https://www.racingpost.com/news/opinion/comment/government-washes-its-hands-of-responsibility-as-uncertainty-over-affordability-checks-continues-akddj7t9IN3g/,racing_post,
Frustration as regulator struggles to get a grip on ballooning black market and social media advertising,https://www.racingpost.com/news/opinion/comment/new-research-highlights-the-scale-of-the-challenge-facing-new-illegal-gambling-taskforce-aNhcN4l09YYc/,racing_post,
"Chaos, compromise or change? Ascot has gone rogue once more - now racing faces its reckoning",https://www.racingpost.com/news/opinion/comment/chaos-compromise-or-change-ascot-has-gone-rogue-once-more-now-racing-faces-its-reckoning-a5eGI2F3ZR89/,racing_post,
"Poker genius, visionary football chairman and pioneering data-led punter - the many (profitable) faces of Tony Bloom",https://www.racingpost.com/news/features/masters-of-betting/poker-genius-visionary-football-chairman-and-pioneering-data-led-punter-the-many-profitable-faces-of-tony-bloom-a0UWt2Y6DPmh/,racing_post,
"Introducing Masters of Betting, an unmissable series available now - read it all with 25% off RP+",https://www.racingpost.com/news/introducing-masters-of-betting-an-unmissable-series-next-week-in-the-racing-post-read-it-all-with-25-off-rp-aJKV17m1iNzx/,racing_post,
"'I was down £11,000 but you can't let that alter what you do' - meet one of the giants of on-course betting",https://www.racingpost.com/news/features/masters-of-betting/i-was-down-11000-but-you-cant-let-that-alter-what-you-do-meet-one-of-the-giants-of-on-course-betting-aXYs01f58AHh/,racing_post,
When science met punting: the godfather of modern-day betting and his golden rules that remain valid to this day,https://www.racingpost.com/news/features/masters-of-betting/when-science-met-punting-the-godfather-of-modern-day-betting-and-his-golden-rules-that-remain-valid-to-this-day-aO1b67N07bKR/,racing_post,
How a dodgy bank loan led to nearly 40 years as a pro punter - proving old-school methods still have their place,https://www.racingpost.com/news/features/masters-of-betting/how-a-dodgy-bank-loan-led-to-nearly-40-years-as-a-pro-punter-proving-old-school-methods-still-have-their-place-aKazg3g7sdy3/,racing_post,
Bentley looking for repeat with last year’s Derby placegetter Angel at the Valley,https://www.scmp.com/sport/racing/article/3355661/bentley-looking-repeat-one-time-derby-place-getter-packing-angel-valley,scmp_racing,2026-06-02 18:00
"The HK Racing Postscript: who’s hot, who’s not and the best win and ride of May",https://www.scmp.com/sport/racing/article/3355525/hong-kong-racing-postscript-whos-hot-whos-not-and-best-win-and-ride-may,scmp_racing,2026-06-01 18:00
Newnham’s Eagle aims to continue Golden run on seven-day backup at Valley,https://www.scmp.com/sport/racing/article/3355524/mark-newnhams-eagle-aims-continue-golden-run-seven-day-backup-happy-valley,scmp_racing,2026-06-01 14:28
Light Years Charm gives Eustace landmark Group Three victory in Hong Kong,https://www.scmp.com/sport/racing/article/3355469/light-years-charm-provides-david-eustace-landmark-group-three-victory-hong-kong,scmp_racing,2026-05-31 19:26
Fownes draws two clear in championship race as trio of debutants strike,https://www.scmp.com/sport/racing/article/3355471/caspar-fownes-draws-two-clear-championship-race-trio-debutants-strike-sha-tin,scmp_racing,2026-05-31 19:53
SCMP Best Bets: Run Run Timing can stop the clock at Happy Valley,https://www.scmp.com/sport/racing/article/3355738/scmp-best-bets-run-run-timing-can-stop-clock-happy-valley,scmp_racing,2026-06-02 21:38
Patch Of Stars shines bright to continue meteoric rise in Sha Tin Vase for Man,https://www.scmp.com/sport/racing/article/3355465/patch-stars-shines-bright-continue-meteoric-rise-sha-tin-vase-manfred-man,scmp_racing,2026-05-31 18:53
馬場密探048｜「凌登」沈廄食尾胡 (Racecourse Insider 048 | Ling Teng gives Shum Stable a final win),https://www.stheadline.com/realtime-racing/3579339/馬場密探048凌登沈廄食尾胡,singtao_racing,2026-06-03 15:37 (12小時前)
馬場浮世繪│奧爾民「首」勝游廄馬 (Racecourse Ukiyo-e | O'Brien gets first win for Yau Stable),https://www.stheadline.com/realtime-racing/3579334/馬場浮世繪奧爾民首勝游廄馬,singtao_racing,2026-06-03 15:37 (12小時前)
馬場密探048｜「銀亮奔騰」游廄起孖 (Racecourse Insider 048 | Silver Bright Gallop gives Yau Stable a double),https://www.stheadline.com/realtime-racing/3579336/馬場密探048銀亮奔騰游廄起孖,singtao_racing,2026-06-03 15:37 (12小時前)
馬場浮世繪│巴度終「博」到頭馬 (Racecourse Ukiyo-e | Badel finally snags a winner),https://www.stheadline.com/realtime-racing/3579333/馬場浮世繪巴度終博到頭馬,singtao_racing,2026-06-03 15:37 (12小時前)
馬場密探048｜「電源之駒」巴度起孖 (Racecourse Insider 048 | Power Of The Charger gives Badel a double),https://www.stheadline.com/realtime-racing/3579323/馬場密探048電源之駒巴度起孖,singtao_racing,2026-06-03 14:37 (13小時前)
馬場密探048｜「星運少爵」騎練齊起孖 (Racecourse Insider 048 | Star Fortune Prince: jockey and trainer both get a double),https://www.stheadline.com/realtime-racing/3579315/馬場密探048星運少爵騎練齊起孖,singtao_racing,2026-06-03 14:37 (13小時前)
"馬場浮世繪│郭富城入場撐「寶典」 (Racecourse Ukiyo-e | Aaron Kwok attends to support ""Bao Dian"")",https://www.stheadline.com/realtime-racing/3579318/馬場浮世繪郭富城入場撐寶典,singtao_racing,2026-06-03 14:37 (13小時前)
馬場密探048｜「星辰千帥」大熱奪標 (Racecourse Insider 048 | Star Commander wins as hot favourite),https://www.stheadline.com/realtime-racing/3579311/馬場密探048星辰千帥大熱奪標,singtao_racing,2026-06-03 13:37 (14小時前)
王賢訊李佳芯齊為學生打氣 (Wong Yin-sun and Ali Lee cheer on students),https://www.stheadline.com/realtime-racing/3579201/王賢訊李佳芯齊為學生打氣,singtao_racing,2026-06-03 13:37 (14小時前)
馬場密探048｜「先到先得」艾道拿100W (Racecourse Insider 048 | First Come First Served gives Purton his 100th win),https://www.stheadline.com/realtime-racing/3579298/馬場密探048先到先得艾道拿100W,singtao_racing,2026-06-03 13:37 (14小時前)
馬場密探048｜「博愛先鋒」順利補中 (Racecourse Insider 048 | Pioneer Of Philanthropy makes good on its promise),https://www.stheadline.com/realtime-racing/3579292/馬場密探048博愛先鋒順利補中,singtao_racing,2026-06-03 12:37 (15小時前)
金誠剛周日復出「扶搖勢勁」 (Golden Strong returns on Sunday with Fuyou Shijing),https://www.stheadline.com/realtime-racing/3579207/金誠剛周日復出扶搖勢勁,singtao_racing,2026-06-03 12:37 (15小時前)
"馬場密探048｜「首駿」十倍冷門險勝 (Racecourse Insider 048 | First Gallop, a 10-1 outsider, narrowly wins)",https://www.stheadline.com/realtime-racing/3579286/馬場密探048首駿十倍冷門險勝,singtao_racing,2026-06-03 12:37 (15小時前)
"袁幸堯為「自動自覺」爭連捷 (Yuen Hing-yiu aims for consecutive wins with ""Automatic"")",https://www.stheadline.com/realtime-racing/3579213/袁幸堯為自動自覺爭連捷,singtao_racing,2026-06-03 11:37 (16小時前)
馬場密探048｜「富裕君子」今季第三捷 (Racecourse Insider 048 | Wealthy Gentleman claims third win this season),https://www.stheadline.com/realtime-racing/3579277/馬場密探048富裕君子今季第三捷,singtao_racing,2026-06-03 11:37 (16小時前)
馬場浮世繪│「格倫島」爭盃有變數 (Racecourse Ukiyo-e | Uncertainties for Glen Island in cup race bid),https://www.stheadline.com/realtime-racing/3579228/馬場浮世繪格倫島爭盃有變數,singtao_racing,2026-06-03 09:37 (18小時前)
馬場浮世繪│鮑楚湄墮馬需時休養 (Racecourse Ukiyo-e | Alice Bao needs time to recuperate after a fall),https://www.stheadline.com/realtime-racing/3579222/馬場浮世繪鮑楚湄墮馬需時休養,singtao_racing,2026-06-03 09:37 (18小時前)
"吳嵩赴澳慶祝《賽馬天下》50週年慶典 (Ng Sung travels to Macau to celebrate ""Racing World""'s 50th anniversary)",https://www.stheadline.com/realtime-racing/3579218/吳嵩赴澳慶祝賽馬天下50週年慶典,singtao_racing,2026-06-03 09:37 (18小時前)
田泰安「華美之威」「穿甲金鷹」 (Karis Teetan with Majestic Beauty and Armoured Golden Eagle),https://www.stheadline.com/realtime-racing/3578851/田泰安華美之威穿甲金鷹,singtao_racing,2026-06-04 03:37 (2026-06-02 17:30 HKT)
「常多笑」轉倉即拼 (Always Smiling to race immediately after stable transfer),https://www.stheadline.com/realtime-racing/3578753/常多笑轉倉即拼,singtao_racing,2026-06-04 03:37 (2026-06-02 14:23 HKT)
シックスペンスは武豊との新コンビで安田記念へ【次走報】 (Sixpence to Yasuda Kinen with new partner Yutaka Take [Next Race Report]),https://tospo-keiba.jp,tospo_keiba,2026-06-03 04:18
Ways and Means Seeks Back-to-Back Bed o' Roses Wins,https://www.bloodhorse.com/horse-racing/articles/292247/ways-and-means-seeks-back-to-back-bed-o-roses-wins,bloodhorse_news,"2026-06-04 21:39 (ByLizzy MaddenToday, 9:39 PM)"
Ag Bullet Aims for Repeat Victory in Jaipur Stakes,https://www.bloodhorse.com/horse-racing/articles/292245/ag-bullet-aims-for-repeat-victory-in-jaipur-stakes,bloodhorse_news,"2026-06-04 17:29 (ByFrank AngstToday, 5:29 PM)"
Vitruvian Man Represents New Twist on Ownership,https://www.bloodhorse.com/horse-racing/articles/292244/vitruvian-man-represents-new-twist-on-ownership,bloodhorse_news,"2026-06-04 17:06 (ByKaren M. JohnsonToday, 5:06 PM)"
Stakes Winner Tap Into This to Stand at Valor Farm,https://www.bloodhorse.com/horse-racing/articles/292240/stakes-winner-tap-into-this-to-stand-at-valor-farm,bloodhorse_news,"2026-06-04 16:25 (ByEric MitchellToday, 4:25 PM)"
Jimmy P Gets Up Late to Win Beverly R. Steinman,https://www.bloodhorse.com/horse-racing/articles/292239/jimmy-p-gets-up-late-to-win-beverly-r-steinman,bloodhorse_news,"2026-06-04 16:19 (Today, 4:19 PM)"
Evangeline Downs Ready for Louisiana Legends Card,https://www.bloodhorse.com/horse-racing/articles/292241/evangeline-downs-ready-for-louisiana-legends-card,bloodhorse_news,"2026-06-04 15:58 (Today, 3:58 PM)"
"Toledano, Mavis Take Top Honors at Upperville Show",https://www.bloodhorse.com/horse-racing/articles/292242/toledano-mavis-take-top-honors-at-upperville-show,bloodhorse_news,"2026-06-04 15:52 (Today, 3:52 PM)"
Accomplished Owner/Breeder Susan Casner Dies May 27,https://www.bloodhorse.com/horse-racing/articles/292238/accomplished-owner-breeder-susan-casner-dies-may-27,bloodhorse_news,"2026-06-04 15:08 (Today, 3:08 PM)"
Fasig-Tipton Releases The July Sale Catalog,https://www.bloodhorse.com/horse-racing/articles/292236/fasig-tipton-releases-the-july-sale-catalog,bloodhorse_news,"2026-06-04 14:37 (Today, 2:37 PM)"
Amelia Earhart Heads Field of Nine in Epsom Oaks,https://www.bloodhorse.com/horse-racing/articles/292235/amelia-earhart-heads-field-of-nine-in-epsom-oaks,bloodhorse_news,"2026-06-04 14:35 (BySadie Iddenden/Racing PostToday, 2:35 PM)"
Churchill Downs Unveils Gallop For Good Initiative,https://www.bloodhorse.com/horse-racing/articles/292232/churchill-downs-unveils-gallop-for-good-initiative,bloodhorse_news,"2026-06-04 14:33 (Today, 2:33 PM)"
Crude Velocity Carries Momentum Into Woody Stephens,https://www.bloodhorse.com/horse-racing/articles/292234/crude-velocity-carries-momentum-into-woody-stephens,bloodhorse_news,"2026-06-04 14:29 (ByKaren M. JohnsonToday, 2:29 PM)"
