title,link,source,time
"Sam Houston, MyRacehorse Launch Ownership Initiative",https://www.bloodhorse.com/horse-racing/articles/290011/sam-houston-myracehorse-launch-ownership-initiative,bloodhorse_news,"2026-02-11 05:26 (Monday, 3:27 PM)"
Harry Angel Colt Tops Day 2 of Inglis Classic Sale,https://www.bloodhorse.com/horse-racing/articles/290009/harry-angel-colt-tops-day-2-of-inglis-classic-sale,bloodhorse_news,"2026-02-11 05:26 (ByTrevor Marshallsea/ANZ Bloodstock NewsMonday, 1:37 PM)"
"Meaning Upsets Super Corredora, Explora in Las Virgenes",https://www.bloodhorse.com/horse-racing/articles/290003/meaning-upsets-super-corredora-explora-in-las-virgenes,bloodhorse_news,"2026-02-11 05:26 (ByOlivia NewmanSunday, 7:34 PM)"
Roll On Big Joe Rolls On For Third Straight Stakes Win,https://www.bloodhorse.com/horse-racing/articles/290004/roll-on-big-joe-rolls-on-for-third-straight-stakes-win,bloodhorse_news,"2026-02-11 05:26 (ByJoe PerezSunday, 6:38 PM)"
Grade 1 Winner Iscreamuscream Heads F-T Mixed Sale,https://www.bloodhorse.com/horse-racing/articles/290001/grade-1-winner-iscreamuscream-heads-f-t-mixed-sale,bloodhorse_news,"2026-02-11 05:26 (ByOlivia NewmanSunday, 5:57 PM)"
Casse Pointing Silent Tactic Toward Rebel Stakes,https://www.bloodhorse.com/horse-racing/articles/290002/casse-pointing-silent-tactic-toward-rebel-stakes,bloodhorse_news,"2026-02-11 05:26 (Sunday, 5:14 PM)"
Extreme Choice Filly Tops Day 1 of Inglis Classic Sale,https://www.bloodhorse.com/horse-racing/articles/290000/extreme-choice-filly-tops-day-1-of-inglis-classic-sale,bloodhorse_news,"2026-02-11 05:26 (ByTrevor Marshallsea/ANZ Bloodstock NewsSunday, 2:29 PM)"
Japan's Kentucky Derby Hopefuls Target Saudi Glory,https://www.bloodhorse.com/horse-racing/articles/289999/japans-kentucky-derby-hopefuls-target-saudi-glory,bloodhorse_news,"2026-02-11 05:26 (ByNaohiro GodaSunday, 1:06 PM)"
Maysam Highlights Strong Hill 'n' Dale Offering,https://www.bloodhorse.com/horse-racing/articles/289971/maysam-highlights-strong-hill-n-dale-offering,bloodhorse_news,"2026-02-11 05:26 (ByOlivia NewmanSunday, 5:00 AM)"
Plutarch Gives Baffert 14th Robert B. Lewis Victory,https://www.bloodhorse.com/horse-racing/articles/289977/plutarch-gives-baffert-14th-robert-b-lewis-victory,bloodhorse_news,"2026-02-11 05:26 (ByTracy GantzSaturday, 9:01 PM)"
Splendora Wins Season Debut in D. Wayne Lukas Stakes,https://www.bloodhorse.com/horse-racing/articles/289975/splendora-wins-season-debut-in-d-wayne-lukas-stakes,bloodhorse_news,"2026-02-11 05:26 (ByLizzy MaddenSaturday, 7:52 PM)"
Champion Filly Nitrogen Impresses in Season Opener,https://www.bloodhorse.com/horse-racing/articles/289976/champion-filly-nitrogen-impresses-in-season-opener,bloodhorse_news,"2026-02-11 05:26 (ByFrank AngstSaturday, 6:34 PM)"
Strauss Earns Landmark Victory in Abu Dhabi Gold Cup,https://www.bloodhorse.com/horse-racing/articles/289973/strauss-earns-landmark-victory-in-abu-dhabi-gold-cup,bloodhorse_news,"2026-02-11 05:26 (Saturday, 5:30 PM)"
Kentucky Derby Hopeful Blackout Time Pointed to Rebel,https://www.bloodhorse.com/horse-racing/articles/289974/kentucky-derby-hopeful-blackout-time-pointed-to-rebel,bloodhorse_news,"2026-02-11 05:26 (Saturday, 4:27 PM)"
"Renegade, Zany Victorious in Preps at Tampa Bay Downs",https://www.bloodhorse.com/horse-racing/articles/289969/renegade-zany-victorious-in-preps-at-tampa-bay-downs,bloodhorse_news,"2026-02-11 05:26 (ByByron KingSaturday, 4:09 PM)"
"Depth, Value On Display at Upcoming Inglis Classic Sale",https://www.bloodhorse.com/horse-racing/articles/289968/depth-value-on-display-at-upcoming-inglis-classic-sale,bloodhorse_news,"2026-02-11 05:26 (ByTayla Dyke/ANZ Bloodstock NewsSaturday, 2:21 PM)"
Court Orders Release of Sands of Mali Certificates,https://www.bloodhorse.com/horse-racing/articles/289970/court-orders-release-of-sands-of-mali-certificates,bloodhorse_news,"2026-02-11 05:26 (ByPeter Scargill/Racing PostSaturday, 1:59 PM)"
Friday Night Lights: New UK Approach Sees Strong Start,https://www.bloodhorse.com/horse-racing/articles/289966/friday-night-lights-new-uk-approach-sees-strong-start,bloodhorse_news,"2026-02-11 05:26 (ByDavid Carr/Racing PostSaturday, 1:43 PM)"
Oaklawn Park Bans Trainer Mason,https://www.bloodhorse.com/horse-racing/articles/289965/oaklawn-park-bans-trainer-mason,bloodhorse_news,"2026-02-11 05:26 (ByBloodHorse StaffSaturday, 1:22 PM)"
Dettori's Grand Finale Rivaled by a Long-Ago Swan Song,https://www.bloodhorse.com/horse-racing/articles/289954/dettoris-grand-finale-rivaled-by-a-long-ago-swan-song,bloodhorse_news,"2026-02-11 05:26 (ByJay HovdeyFriday, 8:00 PM)"
Late Charge: Silent Tactic Claims Southwest,https://www.bloodhorse.com/horse-racing/articles/289952/late-charge-silent-tactic-claims-southwest,bloodhorse_news,"2026-02-11 05:26 (ByByron KingFriday, 7:31 PM)"
Talk to Me Jimmy Posts Loud Victory in Withers,https://www.bloodhorse.com/horse-racing/articles/289951/talk-to-me-jimmy-posts-loud-victory-in-withers,bloodhorse_news,"2026-02-11 05:26 (ByBob EhaltFriday, 7:14 PM)"
More Than a Diva Tops Inglis Digital USA February Sale,https://www.bloodhorse.com/horse-racing/articles/289953/more-than-a-diva-tops-inglis-digital-usa-february-sale,bloodhorse_news,"2026-02-11 05:26 (Friday, 5:40 PM)"
Zozos' First Foal is a Pennsylvania-Bred Filly,https://www.bloodhorse.com/horse-racing/articles/289949/zozos-first-foal-is-a-pennsylvania-bred-filly,bloodhorse_news,"2026-02-11 05:26 (ByEric MitchellFriday, 2:58 PM)"
Delaware Park Donates Over $166K to Charity in 2025,https://www.bloodhorse.com/horse-racing/articles/289950/delaware-park-donates-over-166k-to-charity-in-2025,bloodhorse_news,"2026-02-11 05:26 (Friday, 2:53 PM)"
Space Invasion Tops Final Session of Tatts February,https://www.bloodhorse.com/horse-racing/articles/289948/space-invasion-tops-final-session-of-tatts-february,bloodhorse_news,"2026-02-11 05:26 (ByJames Thomas/Racing PostFriday, 2:50 PM)"
NYRA Suspends New CAW Restrictions During Feb. 6 Card,https://www.bloodhorse.com/horse-racing/articles/289947/nyra-suspends-new-caw-restrictions-during-feb-6-card,bloodhorse_news,"2026-02-11 05:26 (ByByron KingFriday, 1:52 PM)"
Scintillation highlights I Am Invincible quartet,https://news.google.com/rss/articles/CBMiggFBVV95cUxQVjNmOGk2bFc1b1FydDR2YUdnWHhTTDJtMXluZ25jMDZEbDZkaDZMd0lHcHNWdExFUlBiR0drd3Y2YS1Qb1ZLVnpqbkNORnhzbmdPWXA1c3JodGs2OXBPWkpvUGhBOEpwZk9lREJzbDhMd2oxdWM4YnN1Snl2d3ZXYkF3?oc=5,the_straight,2026-02-11 05:16
Emerging tyro trainer seeking special result on Matamata Breeders’ Stakes day,https://news.google.com/rss/articles/CBMipwFBVV95cUxQV0VDX2JyRHQtYTJCbnQ2eFpEckZ2eENrd3UyeDlDWVh3bnlRMl90WDJEU1hIR2pDenJFRFZ1eDBydUZFRUJLSzY0TWhvVnY2dm1UakZ5NFBta2E5Zng2MjBPdWc2eW9QV011TWtGdndmQUtZUlFtcjllUU5rdXdUMTg2V0FHemF0aFg0Q01WcWthVXlLcjhBUE5RT0VPekJra1BSanFpWQ?oc=5,the_straight,2026-02-11 05:16
"The year the prediction markets broke – Kalshi, the Super Bowl and the questions that remain",https://news.google.com/rss/articles/CBMiuAFBVV95cUxPRi1Wb3lwRnhCX0xBempzRDJCcUprQ2NOcDVWOU82ZGZFSTFkQngteHlnbmhwb1l6T1lHeVR3R0lxc1ZPRmJ6TGFrNHJWeURiWWo2cWxzT3hmQnhTZjZRSXJTV0lxd0t2X0U5ZjIzS3pPb3p3YU5pd0pnTEFIQjdCeUZnZFJpcS1tX2R0OE4wVG1TcTlOZzVHdUp1eS1xUFJkUGQzVTI2emdHYjV1U1NSQUExRVh6a0xs?oc=5,the_straight,2026-02-11 03:09
Run The Numbers – The Redoute’s renaissance,https://news.google.com/rss/articles/CBMid0FVX3lxTE5pZlZzRkZ1NVlYQTlYTlZ0Z1hZa3RneTFpWVlIMW1lbXRmb1B3Z3Bvdk9kci1WUXItZVBuV1dPZGNVY1I1dGVXRFFfdmhRUHpnaE9QUVo5ZzFuRS11bmNocl9ObEk2Sm81YVZOaTQ2elVtYUZ2aDdR?oc=5,the_straight,2026-02-09 22:44
Ex-Entain executive joins Aussie gaming company Aristocrat,https://news.google.com/rss/articles/CBMijwFBVV95cUxNOGNOeG5aMTdYaHgtMFAzV2YtMlFjemFDSG9oQTF1bksxc2NGSjFJdTBsclZ1S2Zpa1pLcDEydmtfdEljVWw4SDZzNE5RNFc1YWZZQTdXMEtUWGpaTS1MZ2c5cDN2V1ZZZWo5c2JNVUo0YkFTQmNJcWZGaG5fUWZPQkozVHE3T2s4NjhNMHpVbw?oc=5,the_straight,2026-02-09 05:44
Classic’s Angel investors seeking stallion prospect to boost Equine Growth Fund’s fortunes,https://news.google.com/rss/articles/CBMitwFBVV95cUxNWWdTWWJkd1FwNU5uRTBvd1d6OEVMdk1DYXA3NnlLcXZXZmdQRmMyWG9rcDRlTTQ5MUc1NmlpNXRMd3ZpdkNxeFBiRk9CbHZVdW45dzNFdkY5aDdJNHVwYmdLM1VWcEJGeDVPTXVyRzRIZ1pIVHhxa3E5MWZvY1FMSnVXQm5BZlZob0pCdERiSDlmNm1GaHpBLXhjYVZKMExhSnVkZ0F3Y0NCNUl5UkV1NEY4VlNEYTg?oc=5,the_straight,2026-02-09 10:35
Godolphin colts poised for Lightning return,https://news.google.com/rss/articles/CBMie0FVX3lxTE9TQzlzMmFlZjdYMUV0M1Z3WW1TUlpMV0twUGpHQlJrSk14UjNjVERlTDhRT2o5UmtCUFUxVDg1SldLZkYyQ3NXTzlmbDVkeXpIYW5iek9zdVNoUFo4bjRoVXZoU0FsRy1ZQW9WbjBDV2N2REJLeG9iRHYzUQ?oc=5,the_straight,2026-02-09 06:14
Top-end strength drives Inglis Classic to $57 million result,https://news.google.com/rss/articles/CBMikAFBVV95cUxPVDZjWGNkRFM4eWd3ZUZaWDljTV9MbFcxb0pfRkRaWU9ublVaZlBzNE10ZXZMRXQtM2xjLVM1OXNDaDdiNEdzUTA1dUFfdk1PRS1NbjljanVUZnIydEF6eHAyTUdFdkQzaGpZb2E2RVBDVjFLMzlGa0pEVWgyYW5TRHhzdDRaRkd5Rm45MW80MUc?oc=5,the_straight,2026-02-10 07:49
Colic claims top SA sprinter Queman,https://news.google.com/rss/articles/CBMicEFVX3lxTE9ucUI5a3RUczB1Rkt4RGhQT1RGTVlvVEdwbDlhcFJoY1A2UllRRGptUFBIT3U5YTJXVnNlb1dyckRaVmtnVGhjVDd5Ulg3d3l5UkNUVVNWNW1ZUlUtV29zZEJDNVFiV0dvcGxfQXgweDg?oc=5,the_straight,2026-02-10 05:24
Australian Guineas off autumn radar for Sheza Alibi,https://news.google.com/rss/articles/CBMihgFBVV95cUxPZXhqSEVGb2dVcEVTaUdqRlI0Q01VeUpCZ0tPWTdCZlZ3c083XzBRTEtic2JLQ0JBMUQ4OEVSUTVoZnRURGpVRHpDY1BZd1E4UGJVUEJkR21BLW9DYmdhaUNFV1dzcjZQTTZRNkFEUjhzLU9UXzdSeHkwbWpsTkFkOHJ0QjZ6Zw?oc=5,the_straight,2026-02-10 04:19
Too Darn Hot opportunity highlights latest Tattersalls and Inglis collaboration,https://news.google.com/rss/articles/CBMiqwFBVV95cUxOQ2YxcTRiVUFtMnY1aWJmMXlvNHFzaFl3TE4xdVN6eHNoSnFjbGhhZlVhTUMxRnpnaXNxdllMZy1NWUJid3BVN2FEd3I3VU1mVGl3YmE2dlFBSnpnaDNYMjB4WkpPSm5fQUZFTjZlY1hJaTZrMjkyelpGUnp0ODljQTlXc1RxMmRUOHRlekRUaGtUdDh2NjZ3cXVjTklzTXhwY2t4VUk0S1NJS28?oc=5,the_straight,2026-02-09 19:49
RWWA’s sustainability front and centre in major industry review,https://news.google.com/rss/articles/CBMilAFBVV95cUxPMHNIWmNYSkR1X213U3ltdFMzXzNJQkUwTjhIUllUQmk2WDlKeHg1d1dpdkp2eWNYc2VjNEhUVngtSWxUY0dMRnNyeHlSWER1aG84TF9wNEthM3hZclBFd2tBblgwUC1ERlQ2VHhpeFQ3LVJYSTRrVGRDSjJuRDJWRkhwNU83UW93Wk1QckYxdERIeDdo?oc=5,the_straight,2026-02-10 04:09
Caught short – Investigations launched over Hobart Cup distance bungle,https://news.google.com/rss/articles/CBMinAFBVV95cUxPOEZSWkZlUlVBNXRuVHVXREVndlV1V0FjTHphUUxYTkVCSWdSSEhLeElnVjJodUtOZG9QOFVIeXBiSWRmT08zVEZvSnVEMEM4MzhBLUpXZ2Q4V3YwNF9MU3Z5VkEtd0lGVFdoeTV2SVpYNlFTQmVPM2ZMX3JsZmRLcUJYaVd3a2RPeFcwNDVJYjVhMEpNNGJMcVFBbFY?oc=5,the_straight,2026-02-10 22:39
Whitby assesses Cool Archie stud future after retirement,https://news.google.com/rss/articles/CBMijAFBVV95cUxPWklQRmtZakVYclBqU3NvTWZTU2twZ0tYY0diQmxnY3NLcEw0Smp3bnBKQ0FpYkJIM2tacjdic3lQMFZpRmFGQ3FXSlVzZDUzSGxobk9RVHIybXNSLUs0YWVJbGVNLTBvdGdvY2xyaGlkWmtNN0tCeXJVQ1BpVmFXVjh4R3E3ZV9TZGZHSA?oc=5,the_straight,2026-02-11 04:52
Iscreamuscream fetches US$1.5 million at Kentucky sale,https://news.google.com/rss/articles/CBMiiAFBVV95cUxPWGRsNDRuVkYyNGwzR2J2c25adXpvMWthbjY4Zkp6OHhfR093RjdqTkVGNm54SUhEeEtFckJDaXVuOGo1a3VTdE5Kdzd0Wm9nTUFvaDREYlNTLU9QOGhqSmRyU1BSV1lHTXJzWTRWS0QtOXh5NFVrSW5vT1RQa2duQURteEtNb1E3?oc=5,the_straight,2026-02-10 03:59
Price marvels at Diamond contender Guest House’s fortitude,https://news.google.com/rss/articles/CBMijgFBVV95cUxNbjVMRTVDQ00tZERIWjlEcXlQc0w3eGUxc1NROExmWk8xR01ZSUxpbEYwaDJoQ1IzbTh6cE5pX3NLRkdnOVhJRmF0bFRBc0NCSzZzM08yQTV3U2hHS2hIZ2hlek9OT3FPclk3VHlETDAtSXJabkFURjZ6RV9jTUxTSkhhbDVmSXdhWTQtX1JB?oc=5,the_straight,2026-02-10 02:39
Uncertain future for Goulburn Valley Equine Hospital,https://news.google.com/rss/articles/CBMihwFBVV95cUxQeVJrbWlhMXdrTmRlN3RFTVFWMV9TdEZHcFNKcXNqME9MTzFIVlFKLWp4ZExHOHhQMFVPREFnMXFvVDdtWXBwU0ZLdkZIUk82OXU3YnRWU2RvVUdSNThPdUlteGoxSGtIT3NDWjNNUi14YXI3OFRYWkNhZHIybWh4SmN4NDZ3a0E?oc=5,the_straight,2026-02-10 05:34
"Ghaiyyath colt fetches $625,000 as Inglis Classic ends on a high",https://www.anzbloodstocknews.com/ghaiyyath-colt-fetches-625000-as-inglis-classic-ends-on-a-high/,anz_bloodstock,"February 11, 2026"
Harry Angel colt sets the standard on a solid day of trade at the Classic sale,https://www.anzbloodstocknews.com/harry-angel-colt-sets-the-standard-on-a-solid-day-of-trade-at-the-classic-sale/,anz_bloodstock,"February 10, 2026"
Extreme Choice filly takes a starring role on day one at the Classic sale,https://www.anzbloodstocknews.com/extreme-choice-filly-takes-a-starring-role-on-day-one-at-the-classic-sale/,anz_bloodstock,"February 9, 2026"
Depth and value to the fore as Inglis Classic gets underway,https://www.anzbloodstocknews.com/depth-and-value-to-the-fore-as-inglis-classic-gets-underway/,anz_bloodstock,"February 8, 2026"
Alma Vale eyes major juvenile prizes as Inglis Classic Sale beckons,https://www.anzbloodstocknews.com/alma-vale-eyes-major-juvenile-prizes-as-inglis-classic-sale-beckons/,anz_bloodstock,"February 7, 2026"
Tennis star Nick Kyrgios bags first winner at Canberra,https://www.anzbloodstocknews.com/tennis-star-nick-kyrgios-bags-first-winner-at-canberra/,anz_bloodstock,"February 7, 2026"
Inglis Classic Yearling Sale: Six things we learnt on Day 3,https://www.ttrausnz.com.au/edition/2026-02-11/inglis-classic-yearling-sale-six-things-we-learnt-on-day-3,ttr_ausnz,2026-02-11
"It was another solid day of trade as the 2026 Inglis Classic Yearling Sale came to a close, with a Ghaiyyath colt from Wentwood Grange seizing control and topping the sale at $625,000.",https://www.ttrausnz.com.au/edition/2026-02-11/sale-toppers-dollar625000-ghaiyyath-colt-tops-the-2026-inglis-classic-yearling-sale,ttr_ausnz,2026-02-11
In today's 'The TTR Ten' - Inglis Classic Sales Edition - Steve Vardy from Vardy Thoroughbreds answers 10 rapid-fire questions.,https://www.ttrausnz.com.au/edition/2026-02-11/the-ttr-ten-with-steve-vardy-inglis-classic-sales-edition,ttr_ausnz,2026-02-11
"Trade continued at a good pace on the second day of the Inglis Classic Yearling Sale with the gross and clearance rate rising on the same point last year. The full brother to Stretan Angel topped the day at $540,000. TTR runs through five key points of interest from the second day of the Inglis Classic Yearling Sale.",https://www.ttrausnz.com.au/edition/2026-02-10/inglis-classic-yearling-sale-five-things-we-learnt-on-day-2,ttr_ausnz,2026-02-11
"A strong appetite for colts dominated Day 2 of the 2026 Inglis Classic Yearling Sale, with a powerful, mature Harry Angel colt the standout - headlining the session and topping the day at $540,000.",https://www.ttrausnz.com.au/edition/2026-02-10/sale-toppers-colts-take-charge-on-day-2-as-540k-harry-angel-tops-the-session,ttr_ausnz,2026-02-11
"Several Derby prospects put their hands up with wins, but it was Numbers who made it count in the G3 Centenary Vase for Frankie Lor. The former Group 1-placed Australian will head to the Listed Classic Cup next. Jockey Andrea Atzeni had a treble, while trainers Mark Newnham and David Hayes kept each other honest at the top of the Trainer’s Premiership with a winner each.",https://www.ttrausnz.com.au/edition/2026-02-10/hong-kong-review-numbers-adds-to-classic-series-count,ttr_ausnz,2026-02-11
"Several Australian racing and breeding businesses are already saving on administration costs by using offshore businesses to do labour intensive work. With the advent of the internet and remote working, a company like Apteum demonstrates how costs of admin can be lowered while increasing responsiveness in the social media space.",https://www.ttrausnz.com.au/edition/2026-02-10/increasing-labour-costs-outsourcing-administration-can-help-lower-costs,ttr_ausnz,2026-02-11
In today's 'The TTR Ten' - Inglis Classic Sales Edition - Adam Watt from Dynamic Thoroughbreds answers 10 rapid-fire questions.,https://www.ttrausnz.com.au/edition/2026-02-10/the-ttr-ten-with-adam-watt-inglis-classic-sales-edition,ttr_ausnz,2026-02-11
"The metrics held steady on Day 1 of the Inglis Classic Yearling Sale with the gross for the day up on the same time last year, while the average and median dropped slightly on 2025 but the average was up on 2024. TTR runs through five key points of interest from the opening day of the Inglis Classic Yearling Sale.",https://www.ttrausnz.com.au/edition/2026-02-09/inglis-classic-yearling-sale-five-things-we-learnt-on-day-1,ttr_ausnz,2026-02-11
Sale-toppers: Extreme Choice filly leads the way on Day 1,https://www.ttrausnz.com.au/edition/2026-02-09/sale-toppers-extreme-choice-filly-leads-the-way-on-day-1,ttr_ausnz,2026-02-11
A mare that means more than most: Light Up The Room reflecting the Ridgmont environment,https://www.ttrausnz.com.au/edition/2026-02-09/a-mare-that-means-more-than-most-light-up-the-room-reflecting-the-ridgmont-environment,ttr_ausnz,2026-02-11
Buy of the Weekend: Closer To Free’s brilliant debut,https://www.ttrausnz.com.au/edition/2026-02-09/buy-of-the-weekend-closer-to-frees-brilliant-debut,ttr_ausnz,2026-02-11
Race-by-race tips and previews for Gosford on Wednesday,https://www.smh.com.au/sport/racing/race-by-race-tips-and-previews-for-gosford-on-wednesday-20260210-p5o11e.html,smh_racing,Updated
Trainer says settled gelding ready to fire on return to racing,https://www.smh.com.au/sport/racing/trainer-says-settled-gelding-ready-to-fire-on-return-to-racing-20260210-p5o11a.html,smh_racing,"February 10, 2026"
Leading jockey looks to pick up where he left off at headquarters,https://www.smh.com.au/sport/racing/leading-jockey-looks-to-pick-up-where-he-left-off-at-headquarters-20260209-p5o0rx.html,smh_racing,"February 9, 2026"
Tips and race-by-race guide for Wyong on Tuesday,https://www.smh.com.au/sport/racing/tips-and-race-by-race-guide-for-wyong-on-tuesday-20260209-p5o0ra.html,smh_racing,Updated
Highland Dancer ready to make all the right moves at Muswellbrook,https://www.smh.com.au/sport/racing/highland-dancer-ready-to-make-all-the-right-moves-at-muswellbrook-20260208-p5o0h5.html,smh_racing,"February 8, 2026"
Tips and race-by-race guide for Muswellbrook on Monday,https://www.smh.com.au/sport/racing/tips-and-race-by-race-guide-for-muswellbrook-on-monday-20260208-p5o0gj.html,smh_racing,"February 8, 2026"
J-Mac outed as Tempted puts writing on the wall in quest for group 1,https://www.smh.com.au/sport/racing/j-mac-outed-as-tempted-puts-writing-on-the-wall-in-quest-for-group-1-20260207-p5o0b5.html,smh_racing,"February 7, 2026"
Race-by-race preview and tips for Port Macquarie on Sunday,https://www.smh.com.au/sport/racing/race-by-race-preview-and-tips-for-port-macquarie-on-sunday-20260207-p5o0b2.html,smh_racing,"February 7, 2026"
Flying Jett out to continue soaring form at Port Macquarie,https://www.smh.com.au/sport/racing/flying-jett-out-to-continue-soaring-form-at-port-macquarie-20260207-p5o0b1.html,smh_racing,"February 7, 2026"
Keys have Alibaba primed for raid on Inglis riches and beyond,https://www.smh.com.au/sport/racing/keys-have-alibaba-primed-for-raid-on-inglis-riches-and-beyond-20260206-p5o03f.html,smh_racing,"February 6, 2026"
Race-by-race preview and tips for Walcha on Friday,https://www.smh.com.au/sport/racing/race-by-race-preview-and-tips-for-walcha-on-friday-20260205-p5nzvq.html,smh_racing,"February 5, 2026"
Igniter faces another talented Brown runner back at one turn,https://news.google.com/rss/articles/CBMiigFBVV95cUxNVU1wc282YWV4Xy1fYnlnQjd5RXFjWFB5N2ZHUXpWTmRFbmlxV3J4X0lFU1BGYVVRVVYzd0xoc0x3cVF0SHEzTVN5QTY3RDRLeHRDMWNmZU85Rk1tRnY1XzNxcGhjeG5sMzR2bWJHeXBxdjVJMHM0bjBRMXAydE5EVERQZTZNckRqMGc?oc=5,drf_news,2026-02-09 17:59
"D'Angelo breaks slump, takes aim with Bronze Bullet",https://news.google.com/rss/articles/CBMieEFVX3lxTE9pOXdfT2pnWTd4VGFqdXZqXzRkQS1PZU90cFNXOEF4Ti1PcmQwcWFiT2p4OUE2RDQwWHZlT3JpSU9nV0JibzdsQ1ZxR1c5V2NOSG5mWWdkVmRhTDgzVzEtN0tJVnZodzllS1Fzbkl2b2dFclhQNGt2Qw?oc=5,drf_news,2026-02-09 18:09
Holiday Pay holds off the closers in Winsham Lad,https://news.google.com/rss/articles/CBMib0FVX3lxTFBSVHVGZVFVT21vVFIwZVNTb1IwSTFKamoxV3Y3Rkd1MDI2TGg1STNUekFmbzQ1dzVlSzY4X0Fua3JIS0VTMkdyVFJ2RU9LUHhuek1OSE1oNG5BMF9wQ1ZObWVLWFdCdnBaeEhLMGp6dw?oc=5,drf_news,2026-02-09 21:02
"Yonkers: Tuesday's program now has Pick 5 carryover, guaranteed pool",https://news.google.com/rss/articles/CBMilAFBVV95cUxNbG9PNEV2THlMQ1NtbzlXMGlXbm5pVG5RZnBnaVFVRHQ1eUZIZTcwRzAwanp1Q2M1NTJGcV9DLUxqb081MGpvOWt4VlFuRDRPNEFkV1I0Qk1hNjdyRXpTeUJSVUxkWVhPT1JQS25aRVJncDRSMGZ6dFZBYzVDOXdPejRIbFNmb2ZleWwyMWl2S2NDLUZf?oc=5,drf_news,2026-02-10 04:14
"Del Mar: Oceanside Stakes gets purse hike, new conditions",https://news.google.com/rss/articles/CBMihwFBVV95cUxQekwtS19mRkhIWVJHc1dhMjNHS2JYRThaTXBJV3BhTXFjV2lRNWhtMVlCVjNzWHp2bWlrZjktOW1MYjI0ckhZMG5XVHowTmY2RHhEMGRraW01WlQybnBSRnVBWHM1OE9UTDhpWW5RR1lEQy1VOVhYbnFmOVQ2WHZiYzY4Unh0M3M?oc=5,drf_news,2026-02-10 15:04
"Brad Free's Santa Anita Horses to Watch for the week of Feb. 6-8, 2026",https://news.google.com/rss/articles/CBMihAFBVV95cUxNdkJEZVFrUDNtb3NpUmxxa2dkWUxjbDRGdTRtSUpyZGRxNXUxdE5MUFY0VWdDMGtqY0RRVkRLVmRLbmFZZ3RFNGhjUTVxT25rRUMtZ3NBMXRoM1VsZ0ppdnpyWFdVMm1NQnUwZktCQ1VEblpYeGFfRHZUVlNueWVtb21vNXc?oc=5,drf_news,2026-02-10 11:16
Paladin the individual favorite in fourth Kentucky Derby Future Wager pool,https://news.google.com/rss/articles/CBMilwFBVV95cUxNU1hfVHEtOTlhcDFieEU1Q2JJbXJsWXlWaHVOakNybTVSalJEQnBhRW9lQ2U3LWltaG5veGkwdEFWUlRIUVZvXzZ2b0VuYm9kZW12QjFQNWMwU3FCcjR1YXJkb1hlV0hVNHhVQml6VjVhMTNyYUFYc2tqc01NanJFZWJMSWJNUC1zTHhoR2xDSm1LM3Y4U3hN?oc=5,drf_news,2026-02-10 14:30
Ohio drug-testing lab's accreditation suspended by HIWU,https://news.google.com/rss/articles/CBMiggFBVV95cUxOQmN6QnF5WnllWTBUcE1tZF9jYWRrWjJVbmtDRnNvMzBNVVQwa1RqX3JEc3JORVp3UjQtLXFBQUFuMHY3bW1FTEZMc2hueUx4VFdMTE1qN0JzanRJdU51ZlNKaGh4WV9GQkNyS2E1cUo4d05teVpRNU5pRVhkNDgwVXl3?oc=5,drf_news,2026-02-10 14:30
Brown debut winners well worth following,https://news.google.com/rss/articles/CBMic0FVX3lxTFA3Q1hsb0FGVlZlN3lKVXVRLUl5Qm9zS19CWDI1UlpZTno1OW5lQl9DNnpxWjN3U19seHFBM2lZYTJremlqdEFHYmdFZE9yNEIyWU5OeWRSb1lQejBTTEh3Wnc1VGlTMnFCYnBQaDVoU1pMbk0?oc=5,drf_news,2026-02-09 18:09
Wednesday TimeformUS Highlight Horse: Breslau can bounce back from disappointing effort,https://news.google.com/rss/articles/CBMiqgFBVV95cUxOaGhBa1FPY3B0RWJWeTFnVzRKNF8xcEJvSms3SzB2bGdTV19HNlNVa1FHdGgtS0xtMkJ3MUtWS21ibUZrNnhNek1DLVJRWEdEbC1PV1N3REtCSUMwX2cta09sakJuZUxYVmNNcUxIb0p5U2FKTkhxYXY0V0kyS2xwYVg0eWU1Z2ZMM2kxZ0pUVDgtWWZfbVJHYzFNaEcza294bTNwRUtlczJQZw?oc=5,drf_news,2026-02-10 18:05
Yonkers: Analysis for Wednesday 2/11,https://news.google.com/rss/articles/CBMiZkFVX3lxTE1vQkJLOUVyNEVQa0IwYlZMRVB6dlRSUnk2SW1RNmNDWlNvcC1KeF9EMU00Vmc5T1Y3NVNwNEptTkRJWS02S2ZzUG1IR09QOGNCOFNaUDFMQlZCRUtyMnZGbktILUc1QQ?oc=5,drf_news,2026-02-09 18:45
Yonkers: Analysis for Thursday 2/12,https://news.google.com/rss/articles/CBMiZEFVX3lxTE5TVy1Ick1iNXBOQ0VYcDBkb0p0Vmx1X20xS0xndzl0bmRoSFA4T3lWR0JkZy1FXy1xZVBBZ1NMTTJjak9MNzF5eXpFd1dCb1loaUR0SjhrZVNFNktfend2eGpzOG0?oc=5,drf_news,2026-02-10 22:09
"Ingrid Mason banned from Oaklawn after search finds syringes, needles",https://news.google.com/rss/articles/CBMie0FVX3lxTE5oNnBOTzRDSE0xc19Hc1YwcE9SSkl0ZnVNMW9ZVWRiM1I2bVZBUzg0V21uV0JORGhtNExrcWFxZFhYR0VRYy1sVk90RkhoVkFsSzRlU2lENno3NlU1ZWJvNzdObUd4SnYwcGRtcXNnbUZuemQwQ2U3UFRzYw?oc=5,drf_news,2026-02-09 21:02
Meadowlands: 2026 stakes information announced,https://news.google.com/rss/articles/CBMiekFVX3lxTE5xN01seXlRaldINnQ3S1hKUW42TmppNkpsN25nOEJGc3pIY0FiX2lveUhzOWd2eU1rZHhNbnlvWE03ZHJmd3NyOUl3aFhHY09oVUZIZW5lbjNJRDFxMHVXbllLTjhwVmxOYWM1LVU1T3h2SEJJbUhuaXRB?oc=5,drf_news,2026-02-10 16:06
"Hong Kong selections for Wednesday, Feb. 11, 2026",https://news.google.com/rss/articles/CBMidkFVX3lxTE54WFYzVGF6UEp3TFlUQXRCblhLa2tDYlJ0WHF0UXB0V2JYaUI4Vno4X0RPRUxCZEE2QzBWeV9lZHhPYXgxcEdXcUlJTk5lYzFOYVZjZk5yS0FibWRIOWF4ZHgyZGFUVlhndERSWVNmMUlsTUNIRXc?oc=5,drf_news,2026-02-10 16:23
Hall of Fame horseman King Leatherbury dies at age 92,https://news.google.com/rss/articles/CBMifEFVX3lxTE16cTdSUFVzZUlRbXVUTVRCNGNnV0tfY1ZzbjAtekNxSktXbXB4OFA0TWlvQmV2bEVyNXd3SEpKZTZRNUpjdEd4T21wQmlUcXVZVXI4aE5yRWp0M2JwMU5JWnhHZXJ0VkFxdlpXQV9Vc2Q4MlBTVG45cnktb24?oc=5,drf_news,2026-02-11 01:03
Pocono: Talented fields set for Saturday's 2026 opener,https://news.google.com/rss/articles/CBMifkFVX3lxTFBUN2xsTWhELWw3WWFlS0ZyR1JiX1pnRTVNbldEWEpuZi1UbW1hMmpQeUlRZnAyQ3ZOaUtuV1FOZ1BVdWtOem1OdHJnRXpZSFpMT0VHLVZHUEtmV08xcGhfTFdHbXhmdDFtUnJMV0Y0YUVtYmJRN3lpbkFLQzlpdw?oc=5,drf_news,2026-02-10 21:57
Hayes chases third straight winner as championship duel heats up,https://news.google.com/rss/articles/CBMiiwFBVV95cUxOUHBsT2RsSURydEZfanJDRFlpYkJOdFh0dXk5Q3dzUk9SdkhTNzFZX0VWM0IzbWlsbDI2M212dzNtbEJWMW1TVEVsMmdwMXJPbjYxaTlzUGVMcTR1X3hGS3RrZHkwbzZ1b20yWmY3T01ZSU9PWEhtVzkzNHFIem1wdnllUHNkd1ozT1Vj?oc=5,drf_news,2026-02-10 16:23
History beckons as Ka Ying Rising excels in barrier trial lead-up to Queen’s Silver Jubilee Cup,https://news.google.com/rss/articles/CBMiqwFBVV95cUxQRElEbXBIUWFpWF9jYWdEVGkwZWM1cG9uSmtNSXlEV3QxOHRVUUYtUW1leEFZMW5zY01WQWNQM1diYzVxTUsxTW1VMkhnUl9jUldndWhYeGp0dEdnM21KVUxoRWJKQWxHV2JtTlFNeHQ3WWl2YWtadENVY0lpcm5RRmpJS1JRbmFTN2hIemRhM0hVcGVxSno1amdJWVVzcHRqdFdYT3F1RE9iaGc?oc=5,drf_news,2026-02-10 16:23
Yonkers: Pick 4 carryovers now available,https://news.google.com/rss/articles/CBMickFVX3lxTE5FSnFmOFBFTVdrZUVTUFFSUm9oaWZxaEVKVUt2SHNxb1pmamh5UWUtM3BrSjBudVB4dUNiaV9ZbldSdkg0UldpQk9XUHpTOUVVWER5T21PLWE1VmgweUd5NTA3d0c3X0dwQllHSGthYV9Qdw?oc=5,drf_news,2026-02-10 21:51
Shenandoah Downs: Fifteen stallions scheduled to stand in Virginia for 2026,https://news.google.com/rss/articles/CBMikwFBVV95cUxNaDdVbnNjcjZya3ZVVVIzUG1UTHdfVTN3dEs2QjUxT3dKQndYV1lqTWRZTGduci12OTVLRDBfdGcxQklYM3FRR1JiZzl2dm1TSTNRMUJRUnRfU1FiUXExVGttdzF4VzlRWEhlUDV5bFNiVnVKRDFNbFNpLXhGYV9LdE56d0pYYVllRm1ISWQwWWlQZlU?oc=5,drf_news,2026-02-10 23:01
Harness: Hambletonian Society staking payments due February 15,https://news.google.com/rss/articles/CBMijwFBVV95cUxONVRqSERGbkl4eUtwV0xxOS1ndlR0TVFGeXJtZnBfSDUxNVVSY1BqanA0dWlPeE85Z09QRVdJVlIwQXE5bTRJOFRGUDlOWWlwbFA1WDhKS094NVd1WW5EYldfUmZjcXFUalp5dkYwNThVUVQwZzNCQ0I3eWk3d2sxaWRIRk9RZ1pNcWl2bW5fVQ?oc=5,drf_news,2026-02-09 19:09
