title,link,source,time
Bookmakers threaten legal challenge to affordability checks that could mean one in five regular punters are asked for financial documents,https://www.racingpost.com/news/britain/bookmakers-threaten-legal-challenge-to-affordability-checks-that-could-mean-one-in-five-regular-punters-are-asked-for-financial-documents-asPwH4S2BvQt/,racing_post,
Lockinge: 'There aren't too many horses who can quicken like he can' - well-backed Notable Speech sets up Queen Anne bid,https://www.racingpost.com/news/reports/well-backed-notable-speech-shows-an-explosive-turn-of-foot-to-dominate-the-lockinge-stakes-aOg7p0W9yAYo/,racing_post,
Charlie Appleby was right to question his Classic crop - he was equally right to believe in Notable Speech,https://www.racingpost.com/news/reports/charlie-appleby-was-right-to-question-his-classic-crop-he-was-equally-right-to-believe-in-notable-speech-aVHAW2Z4ro00/,racing_post,
'There's every chance he'll be primed and ready to go' - Tom Segal thinks this trainer's Hamilton strike-rate is about to get even better,https://www.racingpost.com/horse-racing-tips/premium-tips/pricewise/theres-every-chance-hell-be-primed-and-ready-to-go-tom-segal-thinks-this-trainers-hamilton-strike-rate-is-about-to-get-even-better-aDhJ28N4xwKP/,racing_post,
"'I had a five-year plan just to get going and stay solvent, but your mindset changes - success is totally addictive'",https://www.racingpost.com/news/features/the-big-read/i-had-a-five-year-plan-just-to-get-going-and-stay-solvent-but-your-mindset-changes-success-is-totally-addictive-aUTOB8y1i1OO/,racing_post,
Notable Speech throws down a marker in Lockinge - but don't rule out this beaten horse reversing the form at Royal Ascot,https://www.racingpost.com/news/betting-insight/notable-speech-throws-down-a-marker-in-lockinge-but-dont-rule-out-this-beaten-horse-reversing-the-form-at-royal-ascot-aZqff4Z874n9/,racing_post,
Newbury: 'The Fillies & Mares will be the big plan' - major Ascot targets for Kalpana after successful return,https://www.racingpost.com/news/reports/the-fillies-mares-will-be-the-big-plan-major-ascot-targets-for-kalpana-after-successful-return-a0EPA0S4WY7f/,racing_post,
Bangor: Emotional day for Donald McCain as trainer saddles 250th course winner following death of his mother Beryl,https://www.racingpost.com/news/reports/donald-mccain-saddles-250th-course-winner-on-emotional-day-as-grain-doudairies-strikes-in-feature-race-aFibu8i4jM8T/,racing_post,
"'Hopefully he has a big future' - Skelton snares the exciting Isaac Of York for a sale-topping €500,000 in Auteuil",https://www.racingpost.com/bloodstock/sales-reports/hopefully-he-has-a-big-future-skelton-snares-the-exciting-isaac-of-york-for-a-sale-topping-500000-in-auteuil-aOGIt9f1jwRS/,racing_post,
12.01 Laurel Park: Brittany Russell out to complete a Triple Crown full set for women as Taj Mahal bids for Preakness glory,https://www.racingpost.com/news/raceday-intel/brittany-russell-out-to-complete-a-triple-crown-full-set-for-women-as-taj-mahal-bids-for-preakness-glory-aBqio4j1i0ph/,racing_post,
'He's in great form and just needs a change in luck' - trainer insight and horses to note for Hamilton's Sunday Series card on ITV,https://www.racingpost.com/news/raceday-intel/hes-in-great-form-and-just-needs-a-change-in-luck-trainer-insight-and-horses-to-note-for-hamiltons-sunday-series-card-on-itv-aV25i1y0rnnq/,racing_post,
'She's really lovely' says Aidan O'Brien - the three most exciting horses on Royal Ascot Trials day at Naas,https://www.racingpost.com/news/raceday-intel/shes-really-lovely-says-aidan-obrien-the-three-most-exciting-horses-on-royal-ascot-trials-day-at-naas-aVB9Y7Q1k8KC/,racing_post,
'I've been able to bring him along to arrive on D-day at 100 per cent' - Kolokico in top shape for Grand Steeple-Chase de Paris,https://www.racingpost.com/news/raceday-intel/ive-been-able-to-bring-him-along-to-arrive-on-d-day-at-100-per-cent-kolokico-in-top-shape-for-grand-steeple-chase-de-paris-aoTNA3x90oSk/,racing_post,
‘People thought I was off my rocker’ - remembering a TV legend who courted controversy while owning a leading Cheltenham hope,https://www.racingpost.com/news/features/series/people-thought-i-was-off-my-rocker-remembering-a-tv-legend-who-courted-controversy-while-owning-a-leading-cheltenham-hope-ag1Mv1Z5Pzxh/,racing_post,
Patience is a virtue - just ask this trainer enjoying his best run of form after more than two and a half decades,https://www.racingpost.com/news/opinion/comment/patience-is-a-virtue-just-ask-this-trainer-enjoying-his-best-run-of-form-after-more-than-two-and-a-half-decades-aevLJ3X4jGfX/,racing_post,
The knives are already being sharpened for Harry Cobden - but don't join the ludicrous knee-jerk reaction,https://www.racingpost.com/news/opinion/comment/the-knives-are-already-being-sharpened-for-harry-cobden-but-dont-join-the-ludicrous-knee-jerk-reaction-av0Fe9r18smd/,racing_post,
Charlie Appleby colt impresses before Sandown Listed bid as Godolphin stars are put through their paces on the Rowley Mile,https://www.racingpost.com/news/newmarket-gallops/charlie-appleby-colt-impresses-before-sandown-listed-bid-as-godolphin-stars-are-put-through-their-paces-on-the-rowley-mile-a3TYV7f7SFSw/,racing_post,
'He has huge potential' - once-raced little brother of Arc winner set for Classic challenge and is the pick of top jockey,https://www.racingpost.com/news/international/france/he-has-huge-potential-once-raced-little-brother-of-arc-winner-set-for-classic-challenge-and-is-the-pick-of-top-jockey-a6Bbv5a101Mo/,racing_post,
"‘If the sky’s the limit, I think we touched the sky’ - Lossiemouth’s sister heading to Ireland after €440,000 sale",https://www.racingpost.com/bloodstock/sales-reports/if-the-skys-the-limit-i-think-we-touched-the-sky-lossiemouths-sister-heading-to-ireland-after-440000-strike-at-inaugural-aktem-sale-aGcCA8m6L3BE/,racing_post,
George Boughey makes bold Billy Loughnane claim as he predicts top jockey can become a ‘great trainer’,https://www.racingpost.com/news/britain/george-boughey-makes-bold-billy-loughnane-claim-as-he-predicts-top-jockey-can-become-a-great-trainer-aGPvi4O2FXDe/,racing_post,
Jockey facing possible lengthy whip ban very sorry for his 'mistake' - but trainer insists he didn't hit horse on the head,https://www.racingpost.com/news/britain/overseas-jockey-facing-possible-lengthy-whip-ban-was-fully-briefed-about-british-rules-aRHps6g6KEMl/,racing_post,
'He's strengthened up a good bit and the main aim will be to get him to the Breeders’ Cup',https://www.racingpost.com/news/features/stable-tours/hes-strengthened-up-a-good-bit-and-the-main-aim-will-be-to-get-him-to-the-breeders-cup-adEEg1F0p1KM/,racing_post,
'He's had a pretty extraordinary time and produced a big effort at the Breeders' Cup - you'd hope he's up to winning a Group 1',https://www.racingpost.com/news/features/stable-tours/hes-had-a-pretty-extraordinary-time-and-produced-a-big-effort-at-the-breeders-cup-youd-hope-hes-up-to-winning-a-group-1-a8sp35i5gkZ9/,racing_post,
'She’ll come forward a lot and winning a Group 1 is the aim this season’,https://www.racingpost.com/news/features/stable-tours/she-has-a-big-pedigree-and-was-impressive-in-her-maiden.-if-the-curragh-goes-well-then-the-irish-guineas-would-be-an-obvious-next-step-a4XKJ5f9buWl,racing_post,
"'That's given us the right to be more audacious and she'll probably go for the 1,000 Guineas'",https://www.racingpost.com/news/features/stable-tours/thats-given-us-the-right-to-be-more-audacious-and-shell-probably-go-for-the-1000-guineas-aTgTl8f3DVLw/,racing_post,
"'I did something so stupid, so ridiculous, so embarrassing that they couldn't possibly broadcast it - Chris Tarrant must have thought I was a prize idiot'",https://www.racingpost.com/news/features/series/i-did-something-so-stupid-so-ridiculous-so-embarrassing-that-they-couldnt-possibly-broadcast-it-chris-tarrant-must-have-thought-i-was-a-prize-idiot-aU8Rf7T0F13p/,racing_post,
Meet the Racing Post's first ever Newmarket correspondent - who used it as the launchpad for an astonishing career,https://www.racingpost.com/news/features/series/meet-the-racing-posts-first-ever-newmarket-correspondent-who-used-it-as-the-launchpad-for-an-astonishing-career-adp3N5B3jWaZ/,racing_post,
"'I had to sit in my office because I had tears in my eyes' - the most unforgettable stories in Racing Post history, as chosen by the editors",https://www.racingpost.com/news/features/series/i-had-to-sit-in-my-office-because-i-had-tears-in-my-eyes-the-most-unforgettable-stories-in-racing-post-history-as-chosen-by-the-editors-aJjSG1m9M86w/,racing_post,
'This was the start of a revolution' - the extraordinary inside story of the Racing Post's birth,https://www.racingpost.com/news/features/series/this-was-the-start-of-a-revolution-the-extraordinary-inside-story-of-the-racing-posts-birth-asQ7f6Z1aiL0/,racing_post,
WATCH: What keeps the Racing Post number one? Inside 40 years of horseracing expertise,https://www.racingpost.com/news/features/series/watch-what-keeps-the-racing-post-number-one-inside-40-years-of-horseracing-expertise-aKViL8I2Adjo/,racing_post,
I'm getting a headache already after draw bias at York leaves me completely bewildered,https://www.racingpost.com/news/opinion/comment/im-getting-a-headache-already-after-draw-bias-at-york-leaves-me-completely-bewildered-arikR6m5HrCp/,racing_post,
In these tough times for punters it's never been more important we stick together - and this is how we do it,https://www.racingpost.com/news/opinion/comment/in-these-tough-times-for-punters-its-never-been-more-important-we-stick-together-and-this-is-how-we-do-it-aHwSx2a6ouqm/,racing_post,
'I'd be swaying towards Ireland' - Owen Burrows still has Classic hopes  as he considers next move for unbeaten Raaheeb ('I'd be swaying towards Ireland' - Owen Burrows still has Classic hopes as he considers next move for unbeaten Raaheeb),https://www.racingpost.com/news/britain/id-be-swaying-towards-ireland-owen-burrows-still-has-classic-hopes-as-he-considers-next-move-for-unbeaten-raaheeb-ak7mZ1k5R8fK/,racing_post,
Derby dream alive for Andrew Balding after Item's Dante heroics - as he confirms Royal Ascot aim for another brilliant York winner,https://www.racingpost.com/news/britain/derby-dream-alive-for-andrew-balding-after-items-dante-heroics-as-he-confirms-royal-ascot-aim-for-another-brilliant-york-winner-aPsUP5N9Ab8e/,racing_post,
Betting expert hits back at 'clearly ludicrous' claim affordability checks can't be assessed until they are implemented,https://www.racingpost.com/news/britain/betting-expert-hits-back-at-clearly-ludicrous-claim-affordability-checks-cant-be-assessed-until-they-are-implemented-ahd4d8x0Ok1g/,racing_post,
Illegal betting in pubs 'area of intense focus' for Irish gambling authority as research suggests at least 100 bars offer unlawful services,https://www.racingpost.com/news/ireland/illegal-betting-in-pubs-area-of-intense-focus-for-irish-gambling-authority-as-research-suggests-at-least-100-establishments-offer-unlawful-services-aOW717F0G3N4/,racing_post,
"'We're there in a mentorship role and to help maximise opportunities' - Fran Berry, Ruby Walsh and Emmet McNamara co-found new management agency for jockeys",https://www.racingpost.com/news/ireland/were-there-in-a-mentorship-role-and-to-help-maximise-opportunities-fran-berry-ruby-walsh-and-emmet-mcnamara-co-found-new-management-agency-for-jockeys-ahxnl6y40XmP/,racing_post,
"'It would be a huge way to end a brilliant season' - can the evergreen Home By The Lee do it again, this time in France?",https://www.racingpost.com/news/ireland/it-would-be-a-huge-way-to-end-a-brilliant-season-can-the-evergreen-home-by-the-lee-do-it-again-this-time-in-france-aCWK69V29MHF/,racing_post,
Irish Grand National winner Soldier In Milan could sport new silks next season as British owner buys into Aintree candidate,https://www.racingpost.com/news/ireland/irish-grand-national-winner-soldier-in-milan-could-sport-new-silks-next-season-as-british-owner-buys-into-aintree-candidate-aQWPv6v82FXl/,racing_post,
Olive Nicholls: 'Longer term I would love to train - and at some point I will join Dad',https://www.racingpost.com/news/features/interviews/olive-nicholls-longer-term-i-would-love-to-train-and-at-some-point-i-will-join-dad-abjuN6w01JB8/,racing_post,
'She goes to the Oaks with some of the strongest form and must stand a big chance' - Charlie Johnston Q&A,https://www.racingpost.com/news/features/interviews/she-goes-to-the-oaks-with-some-of-the-strongest-form-and-must-stand-a-big-chance-ajxv72B09K7Q/,racing_post,
‘People said it would never work’ - how an innovative trainer found an unlikely way to diversify her yard,https://www.racingpost.com/news/features/interviews/people-said-it-would-never-work-how-a-struggling-trainer-found-an-unlikely-way-to-make-ends-meet-a1xxU3k8fYVn/,racing_post,
"'I was riding against the best in America, now I've come back and it's tricky - but I'm not here to fart about'",https://www.racingpost.com/news/features/interviews/i-was-riding-against-the-best-in-america-now-ive-come-back-and-its-tricky-but-im-not-here-to-fart-about-aVmjb0B2Etuw/,racing_post,
Auteuil: Losange Bleu makes Grande Course de Haies history as Home By The Lee fails to fire,https://www.racingpost.com/news/reports/losange-bleu-makes-grande-course-de-haies-history-as-home-by-the-lee-fails-to-fire-aieJp0V6iCTM/,racing_post,
"Chaos, compromise or change? Ascot has gone rogue once more - now racing faces its reckoning",https://www.racingpost.com/news/opinion/comment/chaos-compromise-or-change-ascot-has-gone-rogue-once-more-now-racing-faces-its-reckoning-a5eGI2F3ZR89/,racing_post,
"Small attendance, big contradictions: key takeouts from the Westminster debate on gambling advertising",https://www.racingpost.com/news/opinion/comment/small-attendance-big-contradictions-key-takeouts-from-the-westminster-debate-on-gambling-advertising-aJGRJ4a7iOBf/,racing_post,
The Gambling Commission has not resolved this crucial issue - and ministers must not let them off the hook,https://www.racingpost.com/news/opinion/comment/the-gambling-commission-has-not-resolved-this-crucial-issue-and-ministers-must-not-let-them-off-the-hook-aiCL53x5Z5WD/,racing_post,
It should be obvious that affordability checks will not do what they're supposed to - it is vital racing helps the government realise that,https://www.racingpost.com/news/opinion/comment/it-should-be-obvious-that-affordability-checks-will-not-do-what-theyre-supposed-to-it-is-vital-racing-helps-the-government-realise-that-aOgV79N5c0Uk/,racing_post,
"Poker genius, visionary football chairman and pioneering data-led punter - the many (profitable) faces of Tony Bloom",https://www.racingpost.com/news/features/masters-of-betting/poker-genius-visionary-football-chairman-and-pioneering-data-led-punter-the-many-profitable-faces-of-tony-bloom-a0UWt2Y6DPmh/,racing_post,
"Introducing Masters of Betting, an unmissable series available now - read it all with 25% off RP+",https://www.racingpost.com/news/introducing-masters-of-betting-an-unmissable-series-next-week-in-the-racing-post-read-it-all-with-25-off-rp-aJKV17m1iNzx/,racing_post,
"'I was down £11,000 but you can't let that alter what you do' - meet one of the giants of on-course betting",https://www.racingpost.com/news/features/masters-of-betting/i-was-down-11000-but-you-cant-let-that-alter-what-you-do-meet-one-of-the-giants-of-on-course-betting-aXYs01f58AHh/,racing_post,
When science met punting: the godfather of modern-day betting and his golden rules that remain valid to this day,https://www.racingpost.com/news/features/masters-of-betting/when-science-met-punting-the-godfather-of-modern-day-betting-and-his-golden-rules-that-remain-valid-to-this-day-aO1b67N07bKR/,racing_post,
How a dodgy bank loan led to nearly 40 years as a pro punter - proving old-school methods still have their place,https://www.racingpost.com/news/features/masters-of-betting/how-a-dodgy-bank-loan-led-to-nearly-40-years-as-a-pro-punter-proving-old-school-methods-still-have-their-place-aKazg3g7sdy3/,racing_post,
Lor ‘lucky’ to have Joao Moreira aboard Everyone’s Star at Sha Tin,https://www.scmp.com/sport/racing/article/3353805/frankie-lor-lucky-have-joao-moreira-aboard-everyones-star-sha-tin-sunday,scmp_racing,2026-05-16 15:00
Happy Valley set to provide trainers’ championship with its decisive swing,https://www.scmp.com/sport/racing/article/3353536/happy-valley-set-provide-trainers-championship-its-decisive-swing-shum-takes-over,scmp_racing,2026-05-14 18:30
Purton eyes Group One glory in Australia ahead of ride on Romantic Thor in Champions and Chater,https://www.scmp.com/sport/racing/article/3353533/zac-purton-eyes-group-one-glory-australia-ahead-ride-romantic-thor-champions-and-chater,scmp_racing,2026-05-14 16:00
Danny Shum hits the front in trainers’ championship with dominant Happy Valley treble,https://www.scmp.com/sport/racing/article/3353477/danny-shum-hits-front-trainers-championship-dominant-happy-valley-treble,scmp_racing,2026-05-13 23:41
SCMP Best Bets: Lucrative Eight can be a profitable wager at Sha Tin,https://www.scmp.com/sport/racing/article/3353832/scmp-best-bets-lucrative-eight-can-be-profitable-wager-sha-tin,scmp_racing,2026-05-16 21:52
布浩榮周三接手「顏色之皇」 (George Boughey takes over 'King of Colours' on Wednesday),https://www.stheadline.com/realtime-racing/3573279/布浩榮周三接手顏色之皇,singtao_racing,2026-05-17 02:32 (12分鐘前)
田泰安「利高八斗」「捷足奔馳」 (Karis Teetan's 'Rich Eight' and 'Swift Gallop'),https://www.stheadline.com/realtime-racing/3573139/田泰安利高八斗捷足奔馳,singtao_racing,2026-05-16 10:44 (16小時前)
馬場浮世繪｜世界盃雷神睇好... (Racecourse Ukiyo-e | Joao Moreira favors the World Cup...),https://www.stheadline.com/realtime-racing/3573127/馬場浮世繪世界盃雷神睇好,singtao_racing,2026-05-16 10:44 (16小時前)
潘頓澳洲客串起孖 太太Nicole分享花絮 (Zac Purton scores a double during Australian guest rides; wife Nicole shares highlights),https://www.stheadline.com/realtime-racing/3573094/潘頓澳洲客串起孖-太太Nicole分享花絮,singtao_racing,2026-05-16 07:44 (19小時前)
"「正本」系梁柏濤兩匹生力軍配雷神出擊 (Leung Pak-to's ""Zing"" stable has two new forces paired with Joao Moreira)",https://www.stheadline.com/realtime-racing/3573087/正本系梁柏濤兩匹生力軍配雷神出擊,singtao_racing,2026-05-16 07:44 (19小時前)
「鄉村威龍」舊名重用要留神？ (Should we be cautious about the reuse of 'Country Dragon's' old name?),https://www.stheadline.com/realtime-racing/3573078/鄉村威龍舊名重用要留神,singtao_racing,2026-05-16 07:44 (19小時前)
袁幸堯為靚女馬主鄧仿淇建功？ (Did Yuen Hang-yiu achieve success for beautiful owner Tang Fong-kei?),https://www.stheadline.com/realtime-racing/3573074/袁幸堯為靚女馬主鄧仿淇建功,singtao_racing,2026-05-16 06:44 (20小時前)
艾兆禮「安泰」「八仟好運」 (Andrea Atzeni's 'An Tai' and 'Eight Grand Fortune'),https://www.stheadline.com/realtime-racing/3572811/艾兆禮安泰八仟好運,singtao_racing,2026-05-17 02:44 (2026-05-15 17:30 HKT)
"田泰安今早操「利高八斗」力爭五連勝 (Karis Teetan worked 'Rich Eight' this morning, aiming for a fifth consecutive win)",https://www.stheadline.com/realtime-racing/3572714/田泰安今早操利高八斗力爭五連勝,singtao_racing,2026-05-17 02:44 (2026-05-15 16:30 HKT)
馬場浮世繪│麥都華被釘牌五年 (Racecourse Ukiyo-e | Matthew Chadwick banned for five years),https://www.stheadline.com/realtime-racing/3572781/馬場浮世繪麥都華被釘牌五年,singtao_racing,2026-05-17 02:44 (2026-05-15 16:02 HKT)
樂景傑錦標「飛速巨霸」冀打破「名演說」與「輕易事」兩強局面創驚喜 ('Speedzilla' hopes to break the duopoly of 'Notable Speech' and 'Easy Event' in the Lockinge Stakes to create a surprise),https://www.stheadline.com/realtime-racing/3572778/樂景傑錦標飛速巨霸冀打破名演說與輕易事兩強局面創驚喜,singtao_racing,2026-05-17 02:44 (2026-05-15 15:56 HKT)
何澤堯探完「金鎗六十」周日搏殺 (Vincent Ho to race on Sunday after visiting 'Golden Sixty'),https://www.stheadline.com/realtime-racing/3572708/何澤堯探完金鎗六十周日搏殺,singtao_racing,2026-05-17 02:44 (2026-05-15 14:20 HKT)
韋紀力獲准在渣打冠軍暨遮打盃中策騎出賽 (Mark Zahra permitted to ride in the Standard Chartered Champions & Chater Cup),https://www.stheadline.com/realtime-racing/3572731/韋紀力獲准在渣打冠軍暨遮打盃中策騎出賽,singtao_racing,2026-05-17 02:44 (2026-05-15 14:07 HKT)
「肥仔精神」今早落樓   騎馬人迅速拉回 ('Fat Boy Spirit' unseated its rider this morning; the rider quickly brought it back),https://www.stheadline.com/realtime-racing/3572701/肥仔精神今早落樓-騎馬人迅速拉回,singtao_racing,2026-05-17 02:44 (2026-05-15 14:00 HKT)
「巧繡生花」回復勇銳力爭維多利亞一哩賽桂冠 ('Embroidery' regains form and aims for the Victoria Mile crown),https://www.stheadline.com/realtime-racing/3572729/巧繡生花回復勇銳力爭維多利亞一哩賽桂冠,singtao_racing,2026-05-17 02:44 (2026-05-15 13:59 HKT)
渣打冠軍暨遮打盃海外參賽馬「大怪奇」抵港 (Overseas runner 'Incredibolt' arrives in Hong Kong for the Standard Chartered Champions & Chater Cup),https://www.stheadline.com/realtime-racing/3572728/渣打冠軍暨遮打盃海外參賽馬大怪奇抵港,singtao_racing,2026-05-17 02:44 (2026-05-15 13:54 HKT)
香港馬王「嘉應高昇」連破場地時間紀錄續居浪琴世界最佳馬匹排名榜首 (Hong Kong Horse of the Year 'Romantic Warrior' repeatedly breaks track records and remains atop the Longines World's Best Racehorse Rankings),https://www.stheadline.com/realtime-racing/3572721/香港馬王嘉應高昇連破場地時間紀錄續居浪琴世界最佳馬匹排名榜首,singtao_racing,2026-05-17 02:44 (2026-05-15 13:45 HKT)
郭富城新貴「舞林盛宴」初出即搏 (Aaron Kwok's new acquisition 'Dancing Feast' makes a bold debut),https://www.stheadline.com/realtime-racing/3572696/郭富城新貴舞林盛宴初出即搏,singtao_racing,2026-05-17 02:44 (2026-05-15 12:48 HKT)
黃嘉雯周日兩駒出賽 (Carmaney Wong has two horses running on Sunday),https://www.stheadline.com/realtime-racing/3572688/黃嘉雯周日兩駒出賽,singtao_racing,2026-05-17 02:44 (2026-05-15 12:27 HKT)
馬場浮世繪｜Danon Bourbon征美傷腳 西村淳也超一鞭被罰 (Racecourse Ukiyo-e | Danon Bourbon injured its leg campaigning in America; Atsuya Nishimura penalized for exceeding whip limit),https://www.stheadline.com/realtime-racing/3572316/馬場浮世繪Danon-Bourbon征美傷腳-西村淳也超一鞭被罰,singtao_racing,2026-05-17 02:44 (2026-05-14 12:19 HKT)
Owner Gold Strikes Preakness Gold With Napoleon Solo,https://www.bloodhorse.com/horse-racing/articles/291910/owner-gold-strikes-preakness-gold-with-napoleon-solo,bloodhorse_news,"2026-05-17 21:50 (ByBob EhaltToday, 9:50 PM)"
"All Things Considered, Strong Handle for Preakness",https://www.bloodhorse.com/horse-racing/articles/291909/all-things-considered-strong-handle-for-preakness,bloodhorse_news,"2026-05-17 21:15 (ByFrank AngstToday, 9:15 PM)"
"Napoleon Solo Stars in Preakness, Repels Iron Honor",https://www.bloodhorse.com/horse-racing/articles/291901/napoleon-solo-stars-in-preakness-repels-iron-honor,bloodhorse_news,"2026-05-17 19:25 (BySean CollinsToday, 7:25 PM)"
"Back on Turf, Warming Brings the Heat in Gallorette",https://www.bloodhorse.com/horse-racing/articles/291907/back-on-turf-warming-brings-the-heat-in-gallorette,bloodhorse_news,"2026-05-17 18:29 (ByFrank AngstToday, 6:29 PM)"
Fort Washington Repeats in Dinner Party Stakes,https://www.bloodhorse.com/horse-racing/articles/291906/fort-washington-repeats-in-dinner-party-stakes,bloodhorse_news,"2026-05-17 18:01 (ByOlivia NewmanToday, 6:01 PM)"
Strong Finish Lifts Bring the Smoke in Maryland Sprint,https://www.bloodhorse.com/horse-racing/articles/291905/strong-finish-lifts-bring-the-smoke-in-maryland-sprint,bloodhorse_news,"2026-05-17 16:03 (ByFrank AngstToday, 4:03 PM)"
"Sovereignty, Always a Runner Among Saratoga Workers",https://www.bloodhorse.com/horse-racing/articles/291902/sovereignty-always-a-runner-among-saratoga-workers,bloodhorse_news,"2026-05-17 14:58 (Today, 2:58 PM)"
Notable Speech Bounces Back With Lockinge Victory,https://www.bloodhorse.com/horse-racing/articles/291903/notable-speech-bounces-back-with-lockinge-victory,bloodhorse_news,"2026-05-17 14:39 (ByLiam Headd/Racing PostToday, 2:39 PM)"
Obliteration Back to Winning Ways in Chick Lang Stakes,https://www.bloodhorse.com/horse-racing/articles/291900/obliteration-back-to-winning-ways-in-chick-lang-stakes,bloodhorse_news,"2026-05-17 13:06 (ByLizzy MaddenToday, 1:06 PM)"
One Thousand Guineas Winner Cachet Dies in Japan,https://www.bloodhorse.com/horse-racing/articles/291899/one-thousand-guineas-winner-cachet-dies-in-japan,bloodhorse_news,"2026-05-17 12:59 (ByLydia Symonds/Racing PostToday, 12:59 PM)"
Embroidery Seeks a Third Grade 1 Win in Victoria Mile,https://www.bloodhorse.com/horse-racing/articles/291890/embroidery-seeks-a-third-grade-1-win-in-victoria-mile,bloodhorse_news,"2026-05-17 12:52 (ByBob KieckheferToday, 12:52 PM)"
Spectacular Spring Weather Welcomes Preakness Fans,https://www.bloodhorse.com/horse-racing/articles/291898/spectacular-spring-weather-welcomes-preakness-fans,bloodhorse_news,"2026-05-17 10:18 (ByFrank AngstToday, 10:18 AM)"
No Easy Answers for a Triple Crown Under Siege,https://www.bloodhorse.com/horse-racing/articles/291883/no-easy-answers-for-a-triple-crown-under-siege,bloodhorse_news,"2026-05-16 21:00 (ByJay HovdeyYesterday, 9:00 PM)"
