title,link,source,time
Rare red weather warning sees four Wednesday fixtures cancelled - with BHA to assess other meetings 'on a case-by-case basis',https://www.racingpost.com/news/britain/changes-to-race-programmes-at-nottingham-and-salisbury-as-rare-red-weather-warning-issued-in-britain-aUZgr2B0gf2B/,racing_post,
'I was really lit up and hit him over the head with his frying pan' - lessons in discipline from Sir Mark Prescott (and one William Haggas will never forget),https://www.racingpost.com/news/features/series/i-was-really-lit-up-and-hit-him-over-the-head-with-his-frying-pan-lessons-in-discipline-from-sir-mark-prescott-and-one-william-haggas-will-never-forget-agyGB0w8oySM/,racing_post,
Andy Burnham wanted to 'relegate gambling sponsorship of sport to the history books' – and now he's set to be PM,https://www.racingpost.com/news/britain/andy-burnham-wanted-to-relegate-gambling-sponsorship-of-sport-to-the-history-books-and-now-hes-set-to-be-pm-aGuH08o8lC9s/,racing_post,
George Boughey hopeful Bow Echo's 'best days are still ahead' with star miler on course for Gstaad rematch at Goodwood,https://www.racingpost.com/news/festivals/royal-ascot/george-boughey-hopeful-bow-echos-best-days-are-still-ahead-with-star-miler-on-course-for-gstaad-rematch-at-goodwood-azwis6C68GYl/,racing_post,
Bookies left reeling after 'string of punter-friendly results' at Royal Ascot as World Cup affects turnover,https://www.racingpost.com/news/festivals/royal-ascot/bookies-left-reeling-after-string-of-punter-friendly-results-at-royal-ascot-as-world-cup-affects-turnover-aipZH3D5Id0K/,racing_post,
Watch: Royal Ascot 2026 review | The Front Page,https://www.racingpost.com/video/the-front-page/watch-royal-ascot-2026-review-the-front-page-alep14d8qDuF/,racing_post,
Victory for Gstaad at Ascot would have been a terrible look for racing - the sport must now take decisive action against team tactics,https://www.racingpost.com/news/opinion/comment/victory-for-gstaad-at-ascot-would-have-been-a-terrible-look-for-racing-the-sport-must-now-take-decisive-action-against-team-tactics-aCaE87g1Nse9/,racing_post,
Owen Burrows excited to take on O'Brien big guns in first Irish Derby bid with unbeaten star - and buoyed by Royal Ascot performances,https://www.racingpost.com/news/festivals/irish-derby-festival/owen-burrows-excited-to-take-on-obrien-big-guns-in-first-irish-derby-bid-with-unbeaten-star-and-buoyed-by-royal-ascot-performances-aU1f95R0Bqex/,racing_post,
'It should be very strong' - Coolmara Stables optimistic after Grade 1-winning update ahead of Tattersalls Ireland,https://www.racingpost.com/bloodstock/news/sales-news/it-should-be-very-strong-coolmara-stables-optimistic-after-grade-1-winning-update-ahead-of-tattersalls-ireland-a37Tp8z2k5m3/,racing_post,
A rare win for gambling as minister backs industry growth and refuses to bow to advertising pressure,https://www.racingpost.com/news/opinion/comment/a-rare-win-for-gambling-as-minister-backs-industry-growth-and-refuses-to-bow-to-advertising-pressure-a5a8u0S22trQ/,racing_post,
Wesley Ward has found a Royal Ascot loophole – and the rest may as well have stayed at home,https://www.racingpost.com/news/features/regulars/hunt-cup-throws-up-york-and-goodwood-clues-a-handicap-loophole-is-exploited-and-a-gap-in-the-programme-what-we-learned-at-royal-ascot-asO2R9r3ZomM/,racing_post,
He got his life lessons off the gangsters and gamblers of London's dog tracks - now he's taking private jets with Ryan Moore as part of the Coolmore crew,https://www.racingpost.com/news/features/interviews/he-learned-about-life-on-londons-dog-tracks-with-gangsters-and-gamblers-now-hes-taking-private-jets-with-ryan-moore-as-part-of-the-coolmore-crew-a58kt2P11oaj/,racing_post,
Ka Ying Rising at the royal meeting would be a sight to behold - but the cards are massively stacked against Ascot,https://www.racingpost.com/news/opinion/comment/ka-ying-rising-at-the-royal-meeting-would-be-a-sight-to-behold-but-the-cards-are-massively-stacked-against-ascot-axw3L6Z1g0Zu/,racing_post,
"Shark Hanlon, Kia Joorabchian, Ka Ying Rising and more - five stories you might have missed during Royal Ascot",https://www.racingpost.com/news/britain/shark-hanlon-kia-joorabchian-ka-ying-rising-and-more-five-stories-you-might-have-missed-during-royal-ascot-aOKow0V8bdl6/,racing_post,
Brighton: Jack Dace conscious and taken to hospital as his mount suffers fatal injury in mid-race melee,https://www.racingpost.com/news/reports/jack-dace-conscious-and-heading-to-hospital-as-virtue-chastity-suffers-fatal-injury-in-mid-race-incident-abSda7G5O3LO/,racing_post,
'I like horses who could be ones for the big days' - Boman in clover after sourcing Ascot Stakes one-two,https://www.racingpost.com/bloodstock/news/i-like-horses-who-could-be-ones-for-the-big-days-boman-in-clover-after-sourcing-ascot-stakes-one-two-a5Kil3M2184h/,racing_post,
‘I'd say Dan Skelton is waking them all up’ - Peter Nolan hopeful of continued Anglo-Irish spending with top-class Derby draft,https://www.racingpost.com/bloodstock/news/id-say-dan-skelton-is-waking-them-all-up-peter-nolan-hopeful-of-continued-anglo-irish-spending-with-top-class-derby-draft-a4gA83Y8tU7p/,racing_post,
'That's where we need to look' - Ascot improvements already in the planning for 2027 after another 'vintage' royal meeting,https://www.racingpost.com/news/festivals/royal-ascot/thats-where-we-need-to-look-ascot-improvements-already-in-the-planning-for-2027-after-another-vintage-royal-meeting-aE3Jq1w7BiFF/,racing_post,
"Royal Ascot ground praised, a trainer whose future looks increasingly bright and a possible Saturday schedule switch",https://www.racingpost.com/news/features/regulars/royal-ascot-ground-praised-a-trainer-whose-future-looks-increasingly-bright-and-a-possible-saturday-schedule-switch-aIQTl2x7any4/,racing_post,
'He's got such a change of gear' - Clive Cox excited by his Norfolk winner's star potential,https://www.racingpost.com/news/britain/hes-got-such-a-change-of-gear-clive-cox-excited-by-his-norfolk-winners-star-potential-a3nZ09c3IF2F/,racing_post,
Fozzy Stack plotting Group 1 raid with Ascot winner as he reflects on his perfect two from two in royal meeting breakthrough,https://www.racingpost.com/news/ireland/fozzy-stack-has-group-1-prize-in-mind-as-he-reflects-on-perfect-two-from-two-in-royal-ascot-breakthrough-a8OOy3V82v7J/,racing_post,
Coronation Stakes: Ryan Moore gets it right despite all going wrong as Precise sweeps to victory at Royal Ascot,https://www.racingpost.com/news/reports/coronation-stakes-brilliant-precise-shows-her-class-under-ryan-moore-aIk1O6m12WZ0/,racing_post,
Commonwealth Cup: 'This is the best horse I've ever had' - Venetian Sun shines as the sprinting queen with a battling win,https://www.racingpost.com/news/reports/this-is-the-best-horse-ive-ever-had-venetian-sun-shines-as-the-sprinting-queen-with-a-battling-win-a2Hxg2q5QmnJ/,racing_post,
Prince of Wales's Stakes: 'Mind-blowing' Ombudsman leaves superstar rivals trailing to join the Gosden greats,https://www.racingpost.com/news/reports/prince-of-waless-stakes-classy-ombudsman-sparkles-in-royal-ascot-showdown-against-daryz-aAm3w9e7vBDd/,racing_post,
St James's Palace Stakes: Bow Echo edges thriller to maintain unbeaten record for relieved Billy Loughnane,https://www.racingpost.com/news/reports/bow-echo-wins-again-with-battling-success-in-st-jamess-palace-stakes-as7Ft5V7yX0R/,racing_post,
'Stand by your beds if Willie Mullins has this one ready to right the wrongs of last year's Ascot disappointment',https://www.racingpost.com/news/features/series/stand-by-your-beds-if-willie-mullins-has-this-one-ready-to-right-the-wrongs-of-last-years-ascot-disappointment-a14kh5T3cICQ/,racing_post,
Why almost everything you read about football statistics is nonsense - and what it says about the traps punters can fall into,https://www.racingpost.com/sport/40-years-of-expertise/why-almost-everything-you-read-about-football-statistics-is-nonsense-and-what-it-says-about-the-traps-punters-can-fall-into-ayyST3x9vEvp/,racing_post,
Spotting stars on the Newmarket gallops: what you’re looking out for when trying to find the next Frankel,https://www.racingpost.com/news/features/series/spotting-stars-on-the-newmarket-gallops-what-youre-looking-out-for-when-trying-to-find-the-next-frankel-ayA6t9e5al4Y/,racing_post,
‘The edge you’ve got is your own eyes’ - how one of jump racing’s top judges stays ahead of the machines,https://www.racingpost.com/news/features/series/the-edge-youve-got-is-your-own-eyes-how-one-of-jump-racings-top-judges-stays-ahead-of-the-machines-aA6oL7f2QbDT/,racing_post,
The future of form study: James Willoughby and Keith Melrose assess how the game will evolve for punters,https://www.racingpost.com/news/features/series/the-future-of-form-study-james-willoughby-and-keith-melrose-assess-how-the-game-will-evolve-for-punters-ayFlm2I0lkQO/,racing_post,
Catterick: 'She's caught me by surprise' - Listed race singled out for speedy juvenile Minzelle after maiden success,https://www.racingpost.com/news/reports/shes-caught-me-by-surprise-listed-race-singled-out-for-speedy-juvenile-minzelle-after-maiden-success-aD86R2w3YAQU/,racing_post,
Musselburgh: 'I'd have been annoyed with myself if I'd been beaten' - Only Dream Big claims second win in three days with last-gasp success,https://www.racingpost.com/news/reports/id-have-been-annoyed-with-myself-if-id-been-beaten-only-dream-big-claims-second-win-in-three-days-with-last-gasp-success-a1IsY8T4Abvn/,racing_post,
Pontefract: 'This will be a big year for her' - improving Coedana may have Group 1 target after Castle Stakes success,https://www.racingpost.com/news/reports/this-will-be-a-big-year-for-her-improving-coedana-may-have-group-1-target-after-castle-stakes-success-a65Ql4Y1KCkR/,racing_post,
Hexham: 'He's growing with confidence and today was foot-perfect' - Adam Nicol runner brings up fourth course-and-distance success,https://www.racingpost.com/news/reports/hes-growing-with-confidence-and-today-was-foot-perfect-adam-nicol-runner-brings-up-fourth-course-and-distance-success-at-hexham-aAI791J0VMUu/,racing_post,
Amo Racing’s expensive failings brought into sharp focus by others’ Royal Ascot success,https://www.racingpost.com/news/opinion/comment/amo-racings-expensive-failings-brought-into-sharp-focus-by-others-royal-ascot-success-aV8qk1v41szU/,racing_post,
"Team tactics may be within the rules, but please don't make it look so clumsy",https://www.racingpost.com/news/opinion/comment/team-tactics-may-be-within-the-rules-but-please-dont-make-it-look-so-clumsy-aqc7D7t5akV6/,racing_post,
Sir Keir Starmer resigns as prime minister with Andy Burnham 1-50 to succeed him,https://www.racingpost.com/news/britain/sir-keir-starmer-resigns-as-prime-minister-with-andy-burnham-1-25-to-succeed-him-az5Lu9c0qkBQ/,racing_post,
'I don't see any reason why not' - Wathnan Racing could turn to Royal Ascot winner in bid for first Classic success,https://www.racingpost.com/news/britain/wathnan-racing-could-turn-to-royal-ascot-winner-in-bid-for-first-classic-success-aJNnA4r0Qo1I/,racing_post,
Salisbury 'very proud' of Royal Ascot record after Orthodox and Almeraq shine on the biggest stage,https://www.racingpost.com/news/britain/salisbury-very-proud-of-royal-ascot-record-after-orthodox-and-almeraq-shine-on-the-biggest-stage-aNiU73a0RiQm/,racing_post,
Former Derby-winning jockey Emmet McNamara takes over as secretary of Irish Jockeys Association on interim basis,https://www.racingpost.com/news/ireland/former-derby-winning-jockey-emmet-mcnamara-takes-over-as-secretary-of-irish-jockeys-association-on-interim-basis-aonT67f5ioz5/,racing_post,
'It's very positive' - Curragh boss happy with take-up for new ticket packages ahead of Irish Derby weekend,https://www.racingpost.com/news/ireland/its-very-positive-curragh-boss-happy-with-take-up-of-new-ticket-packages-ahead-of-irish-derby-weekend-aEJnc9P5yjoD/,racing_post,
Heatwave travel concerns rule out top French mare Aventure from Thundering On clash at the Curragh,https://www.racingpost.com/news/international/france/heatwave-travel-concerns-rule-out-top-french-mare-aventure-from-thundering-on-clash-at-the-curragh-aMnf45E38Hjn/,racing_post,
'I regret those times hugely but you can't change the past' - how a tortured genius found a happier life in the most unusual places,https://www.racingpost.com/news/features/the-big-read/i-regret-those-times-hugely-but-you-cant-change-the-past-how-a-tortured-genius-found-a-happier-life-in-the-most-unusual-places-aMh7Z7k25sGJ/,racing_post,
'Last year was super frustrating but this is a different kettle of fish - he gives us a great chance',https://www.racingpost.com/news/features/interviews/last-year-was-super-frustrating-but-this-is-a-different-kettle-of-fish-he-gives-us-a-great-chance-a5BgF5b2O4c5/,racing_post,
"'We went down to 30 horses, nothing was going right and I felt I was wasting my life - but now I use that dark time as fuel'",https://www.racingpost.com/news/features/interviews/we-went-down-to-30-horses-nothing-was-going-right-and-i-felt-i-was-wasting-my-life-but-now-i-use-that-dark-time-as-fuel-aKgfJ2O4lIhS/,racing_post,
Bahrain to stage first Group 1 this year with marquee race's prize-money bolstered to $1.5 million,https://www.racingpost.com/news/international/bahrain-to-stage-first-group-1-this-year-with-marquee-races-prize-money-bolstered-to-1.5-million-anzvo9S3FPzm,racing_post,
Billionaire owner-breeder Frank Stronach found guilty on charges of sexual assault and indecent assault,https://www.racingpost.com/news/international/us/billionaire-owner-breeder-frank-stronach-found-guilty-on-charges-of-sexual-assault-and-indecent-assault-aVU863J9YzZe/,racing_post,
Ka Ying Rising 'target number one' for Royal Ascot next year with David Hayes camp making 'positive noises',https://www.racingpost.com/news/festivals/royal-ascot/ka-ying-rising-target-number-one-for-royal-ascot-next-year-with-david-hayes-camp-making-positive-noises-aK7XU3H98VoV/,racing_post,
'We don't exist as we are without betting' - but key racing figures are now discussing its place in the sport,https://www.racingpost.com/news/opinion/comment/we-dont-exist-as-we-are-without-betting-but-key-racing-figures-are-now-discussing-its-place-in-the-sport-a0pwz0E5V5mT/,racing_post,
Big punters have already been 'displaced' to the black market - the danger is that more may follow,https://www.racingpost.com/news/opinion/comment/big-punters-have-already-been-displaced-to-the-black-market-the-danger-is-that-more-may-follow-aTfsR1x2Et5B/,racing_post,
Government washes its hands of responsibility as uncertainty over affordability checks continues,https://www.racingpost.com/news/opinion/comment/government-washes-its-hands-of-responsibility-as-uncertainty-over-affordability-checks-continues-akddj7t9IN3g/,racing_post,
"Poker genius, visionary football chairman and pioneering data-led punter - the many (profitable) faces of Tony Bloom",https://www.racingpost.com/news/features/masters-of-betting/poker-genius-visionary-football-chairman-and-pioneering-data-led-punter-the-many-profitable-faces-of-tony-bloom-a0UWt2Y6DPmh/,racing_post,
"Introducing Masters of Betting, an unmissable series available now - read it all with 25% off RP+",https://www.racingpost.com/news/introducing-masters-of-betting-an-unmissable-series-next-week-in-the-racing-post-read-it-all-with-25-off-rp-aJKV17m1iNzx/,racing_post,
"'I was down £11,000 but you can't let that alter what you do' - meet one of the giants of on-course betting",https://www.racingpost.com/news/features/masters-of-betting/i-was-down-11000-but-you-cant-let-that-alter-what-you-do-meet-one-of-the-giants-of-on-course-betting-aXYs01f58AHh/,racing_post,
When science met punting: the godfather of modern-day betting and his golden rules that remain valid to this day,https://www.racingpost.com/news/features/masters-of-betting/when-science-met-punting-the-godfather-of-modern-day-betting-and-his-golden-rules-that-remain-valid-to-this-day-aO1b67N07bKR/,racing_post,
How a dodgy bank loan led to nearly 40 years as a pro punter - proving old-school methods still have their place,https://www.racingpost.com/news/features/masters-of-betting/how-a-dodgy-bank-loan-led-to-nearly-40-years-as-a-pro-punter-proving-old-school-methods-still-have-their-place-aKazg3g7sdy3/,racing_post,
Newnham seeks to add to late-season tally with Robot Lucky Star at Happy Valley,https://www.scmp.com/sport/racing/article/3357892/mark-newnham-seeks-add-late-season-tally-stable-transfer-robot-lucky-star-happy-valley,scmp_racing,2026-06-22 14:31
Beauty Joy proves age is just a number with back-to-back Premier Plate wins,https://www.scmp.com/sport/racing/article/3357838/beauty-joy-proves-age-just-number-back-back-premier-plate-wins-sha-tin,scmp_racing,2026-06-21 22:02
Another day in Paradise at Sha Tin for Zac Purton with Group Three Premier Cup victory,https://www.scmp.com/sport/racing/article/3357834/another-day-paradise-sha-tin-zac-purton-group-three-premier-cup-victory,scmp_racing,2026-06-21 21:39
Avdulla looks to continue late-season charge with Raging Blizzard in Premier Cup,https://www.scmp.com/sport/racing/article/3357782/brenton-avdulla-looks-continue-late-season-charge-raging-blizzard-premier-cup,scmp_racing,2026-06-20 18:49
Atzeni lines up on two smart chances in final Group Three features of the season,https://www.scmp.com/sport/racing/article/3357757/andrea-atzeni-lines-two-smart-chances-final-group-three-features-season,scmp_racing,2026-06-20 13:37
SCMP Best Bets: Brilliant Boy a Cool prospect for punters at Sha Tin,https://www.scmp.com/sport/racing/article/3357789/scmp-best-bets-brilliant-boy-cool-prospect-punters-sha-tin,scmp_racing,2026-06-20 21:38
"田泰安「捷足奔馳」「紫辰之星」 (Karis Teetan's ""Swift Runner"" and ""Star of Purple Dawn"")",https://www.stheadline.com/realtime-racing/3585778/田泰安捷足奔馳紫辰之星,singtao_racing,2026-06-22 10:50 (16小時前)
馬場浮世繪｜勞樑棟客串成績佳 (Racecourse Stories | Lo Leung-tung's Guest Stint Yields Excellent Results),https://www.stheadline.com/realtime-racing/3585722/馬場浮世繪勞樑棟客串成績佳,singtao_racing,2026-06-22 08:50 (18小時前)
沈集成重溫美夢贏馬賀壽 (Francis Lui Relives a Dream Winning Race to Celebrate His Birthday),https://www.stheadline.com/realtime-racing/3585692/沈集成重溫美夢贏馬賀壽,singtao_racing,2026-06-22 07:50 (19小時前)
"黃婉曼探望愛駒「觀眾之力」 (Icy Wong Visits Her Beloved Horse ""Audience Power"")",https://www.stheadline.com/realtime-racing/3585674/黃婉曼探望愛駒觀眾之力,singtao_racing,2026-06-22 07:50 (19小時前)
"馬場密探048｜「閃電小子」半冷食尾胡 (Racecourse Sleuth 048 | ""Lightning Boy"", a Semi-Outsider, Wins the Last Race)",https://www.stheadline.com/realtime-racing/3585441/馬場密探048閃電小子半冷食尾胡,singtao_racing,2026-06-23 02:50 (2026-06-21 21:52 HKT)
"馬場浮世繪│姚本輝師徒「極速」起孖 (Racecourse Stories | Ricky Yiu and His Apprentice Achieve a Double with ""Extreme Speed"")",https://www.stheadline.com/realtime-racing/3585427/馬場浮世繪姚本輝師徒極速起孖,singtao_racing,2026-06-23 02:50 (2026-06-21 21:40 HKT)
"馬場浮世繪│方仔坐穩榜首  雷神「順」便顯身價 (Racecourse Stories | Casper Fownes Firmly at the Top, ""God of Thunder"" Moreira Takes the Opportunity to Show His Class)",https://www.stheadline.com/realtime-racing/3585424/馬場浮世繪方仔坐穩榜首-雷神順便顯身價,singtao_racing,2026-06-23 02:50 (2026-06-21 21:35 HKT)
"馬場密探048｜「美麗同享」衛冕精英碟 (Racecourse Sleuth 048 | ""Beauty Joy"" Defends Premier Plate Title)",https://www.stheadline.com/realtime-racing/3585433/馬場密探048美麗同享衛冕精英碟,singtao_racing,2026-06-23 02:50 (2026-06-21 21:05 HKT)
"馬場密探048｜「千禧龍」爆大冷開齋 (Racecourse Sleuth 048 | ""Millennium Dragon"" Pulls Off a Big Upset to Get Its First Win)",https://www.stheadline.com/realtime-racing/3585428/馬場密探048千禧龍爆大冷開齋,singtao_racing,2026-06-23 02:50 (2026-06-21 20:55 HKT)
"馬場密探048｜「小鳥天堂」捧精英盃 (Racecourse Sleuth 048 | ""Bird Paradise"" Lifts the Premier Cup)",https://www.stheadline.com/realtime-racing/3585420/馬場密探048小鳥天堂捧精英盃,singtao_racing,2026-06-23 02:50 (2026-06-21 19:52 HKT)
"馬場密探048｜「金快飛飛」輕鬆連捷 (Racecourse Sleuth 048 | ""Golden Speed"" Easily Achieves Consecutive Wins)",https://www.stheadline.com/realtime-racing/3585417/馬場密探048金快飛飛輕鬆連捷,singtao_racing,2026-06-23 02:50 (2026-06-21 19:05 HKT)
"馬場密探048｜「逍遙騎士」後上取勝 (Racecourse Sleuth 048 | ""Carefree Knight"" Comes From Behind to Win)",https://www.stheadline.com/realtime-racing/3585412/馬場密探048逍遙騎士後上取勝,singtao_racing,2026-06-23 02:50 (2026-06-21 18:44 HKT)
"馬場密探048｜「超和平」在港第二捷 (Racecourse Sleuth 048 | ""Super Peace"" Achieves Second Win in Hong Kong)",https://www.stheadline.com/realtime-racing/3585404/馬場密探048超和平在港第二捷,singtao_racing,2026-06-23 02:50 (2026-06-21 18:41 HKT)
"馬場密探048｜「包裝明將」騎練齊起孖 (Racecourse Sleuth 048 | ""Packing Famous"" Gives Jockey and Trainer a Double)",https://www.stheadline.com/realtime-racing/3585395/馬場密探048包裝明將騎練齊起孖,singtao_racing,2026-06-23 02:50 (2026-06-21 17:30 HKT)
"馬場密探048｜「順善寶」順利取勝 (Racecourse Sleuth 048 | ""Good Fortune Treasure"" Wins Smoothly)",https://www.stheadline.com/realtime-racing/3585391/馬場密探048順善寶順利取勝,singtao_racing,2026-06-23 02:50 (2026-06-21 17:19 HKT)
"馬場密探048｜「極速神影」挫大熱極速開齋 (Racecourse Sleuth 048 | ""Supersonic Shadow"" Defeats the Favorite to Get Its First Win)",https://www.stheadline.com/realtime-racing/3585387/馬場密探048極速神影挫大熱極速開齋,singtao_racing,2026-06-23 02:50 (2026-06-21 16:52 HKT)
"何澤堯為「長勝隊長」補中 (Vincent Ho Redeems Himself with ""Winning Captain"")",https://www.stheadline.com/realtime-racing/3585344/何澤堯為長勝隊長補中,singtao_racing,2026-06-23 02:50 (2026-06-21 14:17 HKT)
"潘頓「價值傳承」故劍重逢 (Zac Purton and ""Value Legacy"" Reunite)",https://www.stheadline.com/realtime-racing/3585341/潘頓價值傳承故劍重逢,singtao_racing,2026-06-23 02:50 (2026-06-21 14:10 HKT)
馬場浮世繪｜拍賣馬昨日沙田試跑 (Racecourse Stories | Auction Horses Had Trial Runs at Sha Tin Yesterday),https://www.stheadline.com/realtime-racing/3585338/馬場浮世繪拍賣馬昨日沙田試跑,singtao_racing,2026-06-23 02:50 (2026-06-21 13:59 HKT)
"劉栢輝級際賽紅人 (Ben Liu, a Popular Figure in Graded Races)",https://www.stheadline.com/realtime-racing/3585335/劉栢輝級際賽紅人,singtao_racing,2026-06-23 02:50 (2026-06-21 13:43 HKT)
White Abarrio a 'Man in His Prime' Ahead of Foster,https://www.bloodhorse.com/horse-racing/articles/292679/white-abarrio-a-man-in-his-prime-ahead-of-foster,bloodhorse_news,"2026-06-23 19:09 (BySean CollinsToday, 7:09 PM)"
Saratoga to Hold Public Tribute for 17 Lost Horses,https://www.bloodhorse.com/horse-racing/articles/292677/saratoga-to-hold-public-tribute-for-17-lost-horses,bloodhorse_news,"2026-06-23 17:42 (Today, 5:42 PM)"
TRF Board Member Keating Launches Matching Gift Effort,https://www.bloodhorse.com/horse-racing/articles/292678/trf-board-member-keating-launches-matching-gift-effort,bloodhorse_news,"2026-06-23 17:42 (Today, 5:42 PM)"
Skippylongstocking Targeting Monmouth Cup,https://www.bloodhorse.com/horse-racing/articles/292675/skippylongstocking-targeting-monmouth-cup,bloodhorse_news,"2026-06-23 16:19 (BySean CollinsToday, 4:19 PM)"
"BH Monday: Joseph Talks White Abarrio, Stephen Foster",https://www.bloodhorse.com/horse-racing/articles/292676/bh-monday-joseph-talks-white-abarrio-stephen-foster,bloodhorse_news,"2026-06-23 16:15 (ByBloodHorse StaffToday, 4:15 PM)"
Longshots Made Ascot a Challenge for Bookmakers,https://www.bloodhorse.com/horse-racing/articles/292674/longshots-made-ascot-a-challenge-for-bookmakers,bloodhorse_news,"2026-06-23 15:56 (ByAndrew Dietz/Racing PostToday, 3:56 PM)"
Mr Mozart Well Represented at National Weanling Sale,https://www.bloodhorse.com/horse-racing/articles/292672/mr-mozart-well-represented-at-national-weanling-sale,bloodhorse_news,"2026-06-23 15:52 (ByANZ Bloodstock News StaffToday, 3:52 PM)"
AmWager Offers 0% Takeout on June 27 Woodbine Card,https://www.bloodhorse.com/horse-racing/articles/292671/amwager-offers-0-takeout-on-june-27-woodbine-card,bloodhorse_news,"2026-06-23 15:06 (Today, 3:06 PM)"
Ellis Park Season Begins July 2,https://www.bloodhorse.com/horse-racing/articles/292670/ellis-park-season-begins-july-2,bloodhorse_news,"2026-06-23 12:30 (Today, 12:30 PM)"
Japan Aims to Cure Ascot Woes in July's King George,https://www.bloodhorse.com/horse-racing/articles/292649/japan-aims-to-cure-ascot-woes-in-julys-king-george,bloodhorse_news,"2026-06-23 08:00 (ByNaohiro GodaToday, 8:00 AM)"
Stakes Recap: Ohio Derby & Chicago,https://www.bloodhorse.com/horse-racing/videos/292655/stakes-recap-ohio-derby-and-chicago,bloodhorse_news,"2026-06-22 19:05 (Yesterday, 7:05 PM)"
Second Stride Launches Horsemen's Challenge,https://www.bloodhorse.com/horse-racing/articles/292654/second-stride-launches-horsemens-challenge,bloodhorse_news,"2026-06-22 16:54 (Yesterday, 4:54 PM)"
"Trainers, Jockeys Share Aqueduct Memories",https://www.bloodhorse.com/horse-racing/articles/292653/trainers-jockeys-share-aqueduct-memories,bloodhorse_news,"2026-06-22 16:50 (Yesterday, 4:50 PM)"
