title,link,source,time
Widdup sends strong team south before chasing bigger riches at Randwick,https://www.smh.com.au/sport/racing/widdup-sends-strong-team-south-before-chasing-bigger-riches-at-randwick-20260223-p5o4rj.html,smh_racing,"February 23, 2026"
Plutarch to miss Kentucky Derby,https://news.google.com/rss/articles/CBMiY0FVX3lxTE1icXlWamFnaHp0LUthbUxDVmVaUVNOeGF0THNQelNKTVhhVkNONU5heGppaVR3SlBuVEJ1bmVVZzllRVJnMi1jLXlOUjR4WVBFcEttVkdkc2tEWmRHVWdNMEtsRQ?oc=5,drf_news,2026-02-25 20:04
Bradshaw back in Thoroughbred racing with Oaks propsect,https://news.google.com/rss/articles/CBMifEFVX3lxTE9nT1dZQkx1bC13cWZiWTB5NXM5a2xUYUxxdDNGeUNRSnZXSV9rLUg3SmY2MlN1MHlyeVRnQ0NlaFRVUG84TmRNNzBlMlNwNk9qUEl2cXFwMnlqM2FucVNnMUw3STlxeU1uZlBoa0dWd3FCbThBV1JuZTE2aGU?oc=5,drf_news,2026-02-26 14:52
"DRF's Horse Racing Playbook for Thursday, February 26, 2026",https://news.google.com/rss/articles/CBMigwFBVV95cUxQVHhhNUxVUkp1T3J6RXk5eDE3d0t4YXhCTGhpdFBFc21Zd21tN19zZ2U5ZmpCUzAzOTFZMG1NZ05rQk8wZjJ6b2h2TFBpcGh4X3A2RGh1T0h6V0h5bUU5TjduSDFKVGRmaXFkQkMyZ2IxRTZ0S0hDN0lJT2ZBdHBpRldtcw?oc=5,drf_news,2026-02-26 14:50
"Off just one start, Iron Honor favored to win Gotham",https://news.google.com/rss/articles/CBMieEFVX3lxTE83WFBvZ0prNml0UThERWxFX0dFdC15SndBTXFydXNhdXBCQk1xUTJqamRGZzNqdUxwU2M0cXFRNS1zdzNpUDFtbTJBNXl1MmxKZ192OENyaEFtQ2NJTWEtOGhMSmY5cnVXMTg3eDg2U25waDFlX2hYbw?oc=5,drf_news,2026-02-26 18:39
Leading jockey Hernandez suspended seven days,https://news.google.com/rss/articles/CBMiekFVX3lxTFBha3dJSXlqUm1yZzhoSHgwb3dhSW5HNkh5SGtOQVI3R0pzTFpOYjNTbVFVanVzRGNfZktIVlFUX0N6LUtxdVJ2YW13SkdBMkhkNEl4Q2g3Y2ZIOVIxSzgxVWY5NDRCTm80Q1V5WVlfWlhDWi0wUUM3N29R?oc=5,drf_news,2026-02-25 17:48
Buffalo: Season opener approaching on Wednesday,https://news.google.com/rss/articles/CBMid0FVX3lxTFAyWWRuYmhnWVFTZ3lXaEpkVXB2VmNmcVE2elFqel92emtrd1VKTUc3X3VBRHB0SU03VEtlcS1fREVUczdUcU40RDlhT01qenpFN1JCUDFZWU80UVF6S3hpajBFU2dMSUkzcExOSVNtS1cyak5Sd2xn?oc=5,drf_news,2026-02-26 22:08
Entries &amp; Live Odds (Entries & Live Odds),https://news.google.com/rss/articles/CBMieEFVX3lxTE9vUGZERUhEWEJhRmtBS2dKcGhmeG5FdDJmY3UxQW5Cbk94RURGUGZHREdhOXhzUGh2eDl4dlIxSVgxQmF1MlNUMHhvVndGVUttdzQxZlVsaC01SmR2ZkZSdkllajk0Q2RCM2tWMUhnZlZTeE5ObGxQYg?oc=5,drf_news,2026-02-27 01:16
Kentucky Derby: Hidden Force overcomes slow start to win points race,https://news.google.com/rss/articles/CBMikwFBVV95cUxORGxzMmFaM1FlcFNyTnJWUy1IdEM1dUhUVGdvVHJnaHNNbEJUalNKU2lOMTNWcVJQWkJ4R2dqc0E4eUdfNkZhQUFfV1JXS2hKRmJYTXJ2aEdxMFFpeU5DT2VEX0EwdTNYeVZYbUw2clppeUN6UlNtOS1hRWRnTUlobFVtTms2TjdSNFZWMHUyZ20zeVE?oc=5,drf_news,2026-02-25 22:38
"Monticello: Bruce Aldrich, Jr. wins 9,000th race",https://news.google.com/rss/articles/CBMieEFVX3lxTE84UzAtbnJ6WUtzRVVaUFVEZ0p5OXVsWUgyazQ3b2d2SWhFOGZobWJOdjUyR1dtdHFnX1VlbWU4cl9jX0w1S2ZJaWFmZnc5YV9QS19vYXQyMURuNFpIemxna0FXQ21GYUFaT2U0Q3g2M0NUNjZTNy03OQ?oc=5,drf_news,2026-02-25 20:36
"Kentucky Derby: Who's hot, who's not for Feb. 25, 2026",https://news.google.com/rss/articles/CBMiekFVX3lxTE9xSmJqLUxaMjZSM3lGZ203SFI1OGhTUFJjdHlUbXRxWklONFc4NEhqRlB0ZjBGY180OEJjZ3Y5dHl2MEdtUnlQT05lTDFaOWRscDhLSzViWERsZHliR2Yzb2N2LS1qRzl2WGZkV1RMYUhCa0JWSV9LWDNn?oc=5,drf_news,2026-02-25 23:46
Lovesick Blues to Dubai for Golden Shaheen,https://news.google.com/rss/articles/CBMibEFVX3lxTFBJU1Y3OTVOMXBUdm9ydUFPYnR2b0VnOUFvUTlYVjMwN0dSQUVfNW1KeFJqSXE3QjByVG83dzd0aXZ1TDk0RXhzSDBZcEJuOVlGMG1OcmNucUtjSWI4SjBVbjM3M3Ztd3ZPVWNLNA?oc=5,drf_news,2026-02-25 23:57
Asmussen hopes Razorback serves as Magnitude's Dubai stepping-stone,https://news.google.com/rss/articles/CBMikgFBVV95cUxNbDZKWDY1dzlIcWdaU0dzUGxCV3BKUlhwdVJvbDloVWpPRFpvellTTXBrUTNhT1FqakNFbHV4ODRsbkZyMExBVDdnWTJjRjJCa21tZzFMa0NlaUxrQjZXaXgxZ2NPcjNxUHFxUld1NEQyUkduV2RZdTM4U0FMU1ZXQnJlQlQ5eV8xZm5sMlNta3J2Zw?oc=5,drf_news,2026-02-26 14:52
Gulfstream Park: Fountain of Youth Day late pick five play,https://news.google.com/rss/articles/CBMihgFBVV95cUxQRTBtS2pTUzMzTkFkWXJ0WWp6ZTcyUmlpMU1aZDFaWEpqUUdLdm1nbDVxVzJ6SGJseEM1T0dqb0FuQ2NuamdBWkFCNjBBQ0EwTFQ0SC1kSWxvWnpuVVB5eU5rMDM4TXNCcWhfQ01qUXRlNmFnNENtbXRoeEo3RzIzZ2twbXJadw?oc=5,drf_news,2026-02-25 20:46
"Kentucky Derby 2026: After shocking BC scratch, Blackout Time starts back up in Rebel",https://news.google.com/rss/articles/CBMipgFBVV95cUxPUVRRWmdUNG9yS253VnYtZnVhX3FIZ1JORVJBMVV1NzlWQWNMZWFuOWNqTk1sbTBGWFNuLVpEb3BsRXZmMGs4YVA2c2hydTgxU3QtdmphblkwN081azJkVjVEZ2NpTWItVjdYV0dzUVV1V2U3cF9JcGQzejlWaUdEWVhvdWxYdlpXdVMxdGo0QmdBSDNCNXlqaVU2WnlzN0pTZzFGY2hn?oc=5,drf_news,2026-02-25 23:38
Dutrow pair figure despite imperfect distance,https://news.google.com/rss/articles/CBMiekFVX3lxTE1XRURleGQ5djhJUjVqamRJMGZ6N2pKNU9BUWdLYTdJQWUtUm5DT0ZfaVR0akhRUGE0M1VWUjB4cUlTSW5SUWVYTDVZT0ttUEdVMEQxOUlCbktMN0swZHRMMVh3WlBmNFI4R0FVWnlwUk9PMm91WE1nS2RB?oc=5,drf_news,2026-02-25 20:52
Australia: Autumn Glow likely to stay on roll in Verry Elleegant,https://news.google.com/rss/articles/CBMihgFBVV95cUxQOHZ2M2hheTlRcHJfXzExbkdUeHRVR0hTckV5cktwd1MxQjl4ODhJRFpYMFRJTHRUUk9xWE9NRkRqclRUeU9HRmJaQm5zV09YTElWLW9hWEdsc3MzUF9ldkFIZDRZNEloWk1oTG9JZjQyUGtoVEFIaHpEdElaV2QxSjNxVmZ0Zw?oc=5,drf_news,2026-02-25 20:46
Meadowlands: Bongiorno crew looks to continue Big M success on Saturday,https://news.google.com/rss/articles/CBMikwFBVV95cUxQZ084cHBYSGswOU1wX1cwUGNjdDBHTzNLMUtoU1VPM2JLdjVjR1p0akEtVTVBLUt4OGVreVBZUi1iUVNwUzJVNU0xN0ZWVFhub05HQ1Y3aFlzWDZIUkZkMW1nek9kNi1CcXlRaXh0TUl2cm5aMjFkS28tZkJyNGtLdUpLUVlpQUtRaU41RnNrbEgyNzQ?oc=5,drf_news,2026-02-27 03:34
Miami Valley: 'Gritty' Joelsyy Hanover exceeding expectations for Millner,https://news.google.com/rss/articles/CBMilgFBVV95cUxNdWtaNXVSeDRjQ3NYUlBzZGlWaG05ZXZSS2g2UW9YSUJtMVA5SF9YanRGcktKa1pBWTh5bW1DbWxPOTJZSWVHZEpPTGVlVVZpR0I4WjAtdUhGWUw2N3dHUmFUbUNlNXdTcDREYVZoSl9US1NyN1pEbTlzQU9LbndobWtvUXVMSDJlZWFwRUloR2ZSajRNTnc?oc=5,drf_news,2026-02-27 03:33
Thursday TimeformUS Highlight Horse: Mercilesanihilator should improve second off claim for Rice,https://news.google.com/rss/articles/CBMisgFBVV95cUxOOHR0UURmZTRHZ0RDRlc1WEg4LTFMb1JKQ0RjYzVPRzI0aFpvXzdaa29raXVqbzRuR2hSODgxaU1UTENGb0thYXoyNUxEZzkzTXI2RS0tSmp1UzhVQkhQQXI2eF9XS1NhQ0JxZkJrZG5mZFNIUjVlVVB3ZDgxX1lza3JmTWFEWFY2dV8xaFZZRUxkWEVDMjhreVlpbDZ2Q3ZjbkI4WXVwdmR1M0VrcE1YZ0Jn?oc=5,drf_news,2026-02-25 20:46
Acoustic Ave takes another shot at graded win in Tom Fool,https://news.google.com/rss/articles/CBMiggFBVV95cUxNclFuenM2bjBpMmhocVhZaTFNckY4b2JrSDlvanhJM1Q3a2l6eTJETTh2dURHMzFDb0hnSy0zb20yeEp1OUJkUUd6a2NzLWFkUnJGeUFZRGtjSk03M2dsd0pIX3dka3otS3VlNk5RSUF2U3RTb1FXeXRjTGQxZERkdVl3?oc=5,drf_news,2026-02-26 14:52
Meadowlands: Analysis for Friday 2/27,https://news.google.com/rss/articles/CBMiZ0FVX3lxTE5MNEZPX0pESjVqUThJeFJtTm1CZmhrMF81TFhLQ0NPNzlTanRXWGZQLURXQ2s3Umo3dWE5R0g5QmtQVHpFc3R0anNlVFpqaVlDMFpnLXZJVGM0cUl3SVpMRFd2R1l0akk?oc=5,drf_news,2026-02-25 22:38
"Clement, Shirreffs lead nominees on contemporary Hall of Fame ballot",https://news.google.com/rss/articles/CBMijwFBVV95cUxNM1gxSWh6VFNSTDI1dzMwdlNhWGdudnRHeWhUbHV0VEtiVUdVNWRRX25GTjlKX0VqZ0NWMFFTUmFMMzN4dVNTeGVvcVp3UVEyYUlCUXZtenQ4MnM0ZDZ2WUF0R0RXWGYxcnJRWlZ3YjUweElPNUhHNzc4QWNWa1lNcHU0NkphYmlSQWM5dEE2MA?oc=5,drf_news,2026-02-26 14:52
Kentucky Derby pedigree profile: Blackout Time,https://news.google.com/rss/articles/CBMiekFVX3lxTE1YOXBsSzlqMUt3V0NhOW00bnRWRnoxT0RSblRVc3UzaHZmRG5kOFBsODRzN2E2UFV6V2hpYkVXbm1uTE12Yll1QndEaExHSFQ3c2VlWmt5LVdvb3YtTkFmZjg4WENBU3JxclI0alVwSlU0WFdCYlp6QUJn?oc=5,drf_news,2026-02-26 08:11
Ferraris reunites with Dazzling Fit for Hong Kong Classic Cup assignment,https://news.google.com/rss/articles/CBMikgFBVV95cUxNQThjMXlKSUJGVDlYWllDVEdpUWVYZUw3T2pFSFFGSnJwVjFyRms5QWMwNW1HUGxFTmNPNTM0cFliY1gxY0lqZ1ViazFSYXFQOTFKakxpUmpISGJOcjdCUzdPVk41S2c3Q1duS0pDcWoxdWthMW4tdTlBLXQ2QXB3TTB6OXdTZ0VidnA3RUZ3STYzQQ?oc=5,drf_news,2026-02-26 14:52
"Literate, Devassa square off again in Wintergreen",https://news.google.com/rss/articles/CBMidEFVX3lxTE9HSmttLTNQN1lyd2NCTHo4SXRjQWtueWVLVjBCWnQ2RW1qd0owQTBYSnRDLUNKWDFKTjRYUWxJZXhFSDNfQks5UHNvWi02VGF5UzV6dlloeWFGYVhkYUZBOVF1cWFneGJoTFF5cm1QTXJtelFU?oc=5,drf_news,2026-02-26 14:52
McCready the value play over Touch of Fire in Black Gold,https://news.google.com/rss/articles/CBMie0FVX3lxTE9seTBweUVWWXdsYU1LaWlNOTk5UVVfN0NycmVKYi1ZRnVpbEk5X2FYVjBmbHVtSEVtMXZNVXBXWjZtdTh3Rm84enhXcVRPZDRSWEF6eGlzQnFIRnhTbnkwOTVNZF9abmRQZ2h3OGN1bE43ZE11bDZ0TGp6WQ?oc=5,drf_news,2026-02-26 14:52
Woodbine Mohawk Park: Analysis for Friday 2/27,https://news.google.com/rss/articles/CBMic0FVX3lxTE9NMjZHT3YzbExoWEpZNnZQQnpFWnUwa0gxZ3RzdHk4b2w4dGdXREtyaG1sY2FYZlBfZnVyaFo5SWd6WXR4TzI1enFIbWlzUE14WHJnOUJReVNnQTBreWZiSzlReWVabmxIVnYzRThCc01ZRFk?oc=5,drf_news,2026-02-25 21:02
"Jockey Club Gold Cup, Flower Bowl moved back to Belmont; Travers tops Spa stakes",https://news.google.com/rss/articles/CBMiogFBVV95cUxOVUJhbUhxTVZTVFJobURVNVZNR2tNZ1NLRzhNdVVvaVhPX0ZfcXhNWmNEbGRXb2NYempTTlhjRm1WV3dlWGowanpwNTJYTnBSanQ2eEROQm1SbGNVOExkWXdlUWtnY09ySGlKNFczb2xYeS12NTFnTS1KVVNqTlRCVHFYc0NMdFlpQ0x3UlprbVVlcUhwdjNWOWhzRHU5OTBWenc?oc=5,drf_news,2026-02-26 14:50
"Thought Process, Grand Slam Smile bolster division in Buena Vista",https://news.google.com/rss/articles/CBMijwFBVV95cUxNU1MyVXRlUzZsOG5wS2lnRHdkVlU0Y3JnNFBOc1cxcHA3S0pGS3RCc2NBNUFha2JMRkNxa3FTQktYSkUzODdDM05TLUhCd3h6N193RHIxVFc2RDJyTWdweXhhVm9ucWxPeFh0MGNOZTU0T0hYRXQ5aWlHeGNTS3BSNzB0bnllREpDNDRuNmRmUQ?oc=5,drf_news,2026-02-26 14:52
On Time Girl seeks third straight stakes win in Davona Dale,https://news.google.com/rss/articles/CBMihAFBVV95cUxNcFl3UV81aHBNMGpLa241TE04Q3duQm5MYnNENE9vOGk2VjUyU2JYTE5abEFYOHFYcDVNSXhnRDJMX0QtUFVqVnROYWVTeUN6M2ZqMWtQc09yYldQaW5SM09BVGE1QTRaeVlNWjJoS1NjdmlGOFRJcjhIaGt1RFh3YjJ1bGI?oc=5,drf_news,2026-02-26 14:52
"After decent Breeders' Cup, Argos makes 3-year-old debut in Colonel Liam",https://news.google.com/rss/articles/CBMilwFBVV95cUxQUHoyeDk0aEtkUGJjdlNBMHpvTHFSMno3anJ0YjJHR1VrSjV4QldNcU5ZbVZxN0ZuNGg0cERPLXhHaTRQZVFreXdBSUJlZnRCRmFBQ1A2X2xLNF9TeUFYRGp0QXppc0Y2Vm16T3Fxblk3cjB6d2hyM1UzTVJXelV1cms2elFMcTFQRndjd25sT2tjSS1TZGQ4?oc=5,drf_news,2026-02-26 14:52
Knightsbridge towers over rivals in Gulfstream Park Mile,https://news.google.com/rss/articles/CBMihAFBVV95cUxNdGtSYURSZU5lVG8ydk85NUZIbGVqdTduZnp2M1pHdk5KZl9hdkN6Z1pMY0VsQXlVRzdmNTZDN0hSUG1rY0RpVE5xN3RXbXpqQUlvSzEzM3VvQnJaMzZSLTZDSXdwczRIQ0t3VmpJOHdmZURhSWV5SGpEN2k2TWEycVVIRnI?oc=5,drf_news,2026-02-26 21:10
Yonkers: Analysis for Friday 2/27,https://news.google.com/rss/articles/CBMiYkFVX3lxTE1ES0VGNEx0SGdNTlYtTDJHZ2o0Qk1Ra0s3cjVJR1FPYVNQV3g3Y0ZPd3NCbnVSQUhuUTI4MzRaTWE4bFBQR3dDNGl0TFFqWjRWMjN6ZnJ5TjVURE1kTF9qVmpB?oc=5,drf_news,2026-02-25 20:46
"Yonkers: Carryovers, $20K guaranteed pools in early Pick 4, Pick 5 Friday",https://news.google.com/rss/articles/CBMilgFBVV95cUxOeGhQVE1HWUFwZHlwd3dydWRJdlNqOFlMWlpYTEJ6RDRYcC1sZm00cHZkZ0d2cmFZQ2Z3Y3BTdm5qU3AyczJleG9oYzJ4SXdUcFRrN1J3Y3lSVDJnbDNKM1JOZ0lJQmlVeUI3YTRKODczYzdiU0xFVTVLYjFQQzBiRldTazR2czJDRWVBSWh0QmVCVnVZa2c?oc=5,drf_news,2026-02-27 03:48
Wolfie's Dynaghost makes his return in Canadian Turf,https://news.google.com/rss/articles/CBMifkFVX3lxTE9oNG9sbzhDa0p0aTlrWk91UUFPajc5WmkxUjgtN1BLWDNaX2hGNEVQcnlHLXpWTXFhdkhEbXVWM2E5R01BWnlDeVNwXzVPWEM4anZXZTJhUWdfVkJyOGZUWlZFcDNhYzhFeC1hNGJKcFd6Vkd0bmhaSUpqWUtOQQ?oc=5,drf_news,2026-02-26 14:52
"Fountain of Youth long on talent, short on proven two-turn ability",https://news.google.com/rss/articles/CBMiiAFBVV95cUxQWUFSRFZ0WDkzN1BwM1d6RXRidkFwZURWejJDRTFVbnRkSnNpanI0M1Nzb0dla041ZG5wNEVieTBuQi1lY1ZFVjNkZ3padm84MjdjcmtjaXJzNmJlWllQUG1lX25EdWkwUzRmbUdYLVJ1dVFSN0hKb1JNT1FOSHk3ZzFmX2xoanRF?oc=5,drf_news,2026-02-26 14:50
Small Busher field maintains competitive feel,https://news.google.com/rss/articles/CBMiekFVX3lxTE5XdVhIaWU4OUpVYVF5MHA2NnhpaUxweHR1b1VKVnA0M0VNVFcxRDdGTXpNRzZVa3Q5UGdWSk9IcnIyYVlrY3VKcWlIWkhzdVVDNE91ZE1fZzN2d2tJUzktdEZLemhET3ZFU3o4SHFVTjBfUlhfYkF1MEZR?oc=5,drf_news,2026-02-26 18:03
"Weekend GamePlan: Picks for Fountain of Youth, The Very One, Black Gold",https://news.google.com/rss/articles/CBMiigFBVV95cUxPOHY5a0dvYlBXUFhZMkJLWUdzSFZYV3dSSjBlWEZva3V5eE9QTmtNSHUyYXE1S1ZfZG1vaHZZTzBnQzFOOXU4M0hreHBSZUpjNWIwS0lBcG5aVFhZZ1YwZ29TZGUxZUtLY2cxSUgzMGRDOTFqWGdaVEJsUHZlU1pQeF95S1pfeHdoZmc?oc=5,drf_news,2026-02-26 14:50
World Pool: Double The Stakes Action,https://news.google.com/rss/articles/CBMiZ0FVX3lxTFBtbzdKelVDZC05ODhEZ2RFaEd1cHJ6SW9jMHkzaFE3R2xUeWVuMkNsUERSOWxXM1RKek5oVE5ZR3dfZk9ESkJBZk42MF9ZS1V5eXNCdmxfaGY5NXNRSXZaakcwZDZqb2s?oc=5,drf_news,2026-02-26 14:52
CHRB rejects proposed county fair meets in Northern California,https://news.google.com/rss/articles/CBMijAFBVV95cUxOWUVldzZINWhxZ3dPMy14ZTlKR1VGVFE0dl9DakF3aV9GLWEwY1IxWU14TF9ydFY1bkpneWtqaTMzLVRsYWJVR25neTJtVnRHWmhCMDVPM09DRF9Gd2dWSC14alhGazUteWc4bGpkd3FnelBvSDJMd0lRSms3cHM4RUd3VXB3amlSZ3EzcA?oc=5,drf_news,2026-02-26 23:43
"Maker has Zverev, Anegada to land another Mac Diarmida win",https://news.google.com/rss/articles/CBMihgFBVV95cUxPUEZneGZCd0NXQlRnaGpTeHJqdXRqRy15Nk9oQ29vOUd6TXZLR2EzYVhDc3Eta3BDTUU4ampBYnJQU2RFM2VKeEtNMlBOYjdLV0NybWsyYkdDV3R6MllNeTdBRFlhMVZhb0dZcnhla3JubHhkTERsRmpZMzJ1WVM1T0RxaE05QQ?oc=5,drf_news,2026-02-26 19:31
HISA issues advisory on hind-end injuries,https://news.google.com/rss/articles/CBMicEFVX3lxTE8zeXpxQmlGZGFKMFY1ZnAwSFBIZEZWWDZHZzVpV2JrSVo0b08zNWdnMFpYSWhyNjdBUVU4ekpfd0wxYWpja2NRS3pSV2ZjRXJyTGFIRTZac2JqcUs3WnU4cnhvUE1hN1MzdkVnRGtPNnc?oc=5,drf_news,2026-02-26 19:21
Mo relaxed ahead of breakthrough Group 1 ride aboard Winning Wing in Citi Hong Kong Gold Cup,https://news.google.com/rss/articles/CBMisAFBVV95cUxNVUo0UzJPazVzYkNQaFZGX0RrUkllTm5FdlNNeE5SV3V1alJ6V0tURWNhMmdyZXctNjlWTEF2Sjk5NmtRb09hOWVodmJtbVZfcjhNWl9QZjRXTUpQVWVtZmh6Qms4NjRtVmYzOW4xV3hsVWl4WF9WU3FwSVlHVHNpajFkbl96UGMtbkNOU1UxUFFLZ0NvSzQ2bHBGdW9aT0hBV0N4RklhXzQyNGNUZUNkUw?oc=5,drf_news,2026-02-26 16:55
Friday TimeformUS Highlight Horse: Baby Sassicaia better than last result,https://news.google.com/rss/articles/CBMilwFBVV95cUxPc2thZTN4b0ExY3ZELWZTenhpYWNDS0dCV0dUdzBCRTJXelFaZHB0cm5xZ3duNDBaMmg0eDZxNUNFV051cHk5RGlHbDZVVmktb1duSEljV0FuUTl6Ui1GbHJWRVZoSUtSaGlqYVRyYUdjUnp5MXUwV0R6MG0xa0N3OGFrYkIySFlNcDdzeWRrVHVDSTh4TWZB?oc=5,drf_news,2026-02-26 23:07
"Luke Middlebrook's Hong Kong Selections and Analysis for Saturday, February 28, 2026",https://news.google.com/rss/articles/CBMipAFBVV95cUxNWTZwSjZlYkVVNHVjMGF4LU9LNDdvOGRSZUtmXzRIbGFEaDdCaVo5Y2tPVXltalFic2w1clFSUDMxLS1nS2tMd3FSRjBXLTk4aWU5dUZ4dVNTeTQtcUdEV2lCbTdMXzdYbGRWTmlhcGVxS3FxSldTUHozdWxHUHA2cDFXRkdwNl9WbUY0eTU3bUFpUGtsb1E2Y3N0ZVAtR0dVdmpQYQ?oc=5,drf_news,2026-02-26 23:03
"Quinté+ du vendredi 27 février à Vincennes : Jazzman et la coalition Abrivard (Quinté+ for Friday, February 27 at Vincennes: Jazzman and the Abrivard coalition)",https://www.equidia.fr/articles/quinte/template-article-quinte-du-vendredi-27-f%C3%A9vrier,equidia_racing,Publié il y a 15 heures
"Les pronostics des experts pour la réunion 1 à PARIS-VINCENNES ce vendredi 27 février (Expert predictions for Meeting 1 at Paris-Vincennes this Friday, February 27)",https://www.equidia.fr/articles/pour-preparer-vos-paris/les-pronostics-des-experts-pour-la-reunion-1-a-paris-vincennes-ce-vendredi-27-fevrier,equidia_racing,Publié il y a 11 heures
"Quinté Express : Analyse du Quinté+ du vendredi 27 février (Quinté Express: Analysis of the Quinté+ for Friday, February 27)",https://www.equidia.fr/articles/pour-preparer-vos-paris/quinte-express-analyse-du-quinte-du-vendredi-27-fevrier,equidia_racing,Publié il y a 11 heures
"Les repérés en piste pour le vendredi 27 février (Horses to watch for Friday, February 27)",https://www.equidia.fr/articles/pour-preparer-vos-paris/les-reperes-en-piste-pour-le-vendredi-27-fevrier,equidia_racing,Publié il y a 11 heures
"Les 5 pénos du vendredi 27 février (The 5 picks for Friday, February 27)",https://www.equidia.fr/articles/pour-preparer-vos-paris/les-5-penos-du-vendredi-27-fevrier,equidia_racing,Publié il y a 12 heures
"Faites le papier du Quinté+ de ce vendredi 27 février (Study the form for the Quinté+ this Friday, February 27)",https://www.equidia.fr/articles/pour-preparer-vos-paris/faites-le-papier-du-quinte-de-ce-vendredi-27-fevrier,equidia_racing,Publié il y a 12 heures
"Les 3 tuyaux du Quinté+ du vendredi 27 février à Vincennes (The 3 hot tips for the Quinté+ on Friday, February 27 at Vincennes)",https://www.equidia.fr/articles/pour-preparer-vos-paris/les-3-tuyaux-du-quinte-du-vendredi-27-fevrier-a-vincennes,equidia_racing,Publié il y a 13 heures
"Arrivée et rapports du Quinté+ du jeudi 26 février : Premier Quinté+ pour Alan Gendrot (Results and dividends for the Quinté+ on Thursday, February 26: First Quinté+ win for Alan Gendrot)",https://www.equidia.fr/articles/retour-sur-les-courses/arrivee-et-rapports-du-quinte-du-jeudi-26-fevrier-premier-quinte-pour-alan-gendrot,equidia_racing,Publié il y a 14 heures
"Arrivée et rapports du Quinté+ du mercredi 25 février : Jobspost fait le boulot (Results and dividends for the Quinté+ on Wednesday, February 25: Jobspost gets the job done)",https://www.equidia.fr/articles/retour-sur-les-courses/arrivee-et-rapports-du-quinte-du-mercredi-25-fevrier-jobspost-fait-le-boulot,equidia_racing,Publié hier
"Karambar, la base solide du Quinté+ du vendredi 27 février à Vincennes (Karambar, the solid banker for the Quinté+ on Friday, February 27 at Vincennes)",https://www.equidia.fr/articles/actualite/karambar-la-base-solide-du-quinte-du-vendredi-27-fevrier-a-vincennes,equidia_racing,Publié il y a 7 heures
Equidia lance une plateforme 100% streaming : Equidia + (Equidia launches a 100% streaming platform: Equidia+),https://www.equidia.fr/articles/actualite/equidia-lance-une-plateforme-100-streaming-equidia,equidia_racing,Publié il y a 12 heures
"Les 4 infos incontournables de la R1 ce jeudi 26 février à Cagnes-sur-Mer (The 4 essential tips for Meeting 1 this Thursday, February 26 at Cagnes-sur-Mer)",https://www.equidia.fr/articles/actualite/les-4-infos-incontournables-de-la-r1-ce-jeudi-26-fevrier-a-cagnes-sur-mer,equidia_racing,Publié il y a 19 heures
"Kompany Vincent, l’outsider séduisant du Quinté+ du jeudi 26 février à Cagnes-sur-mer (Kompany Vincent, the appealing outsider for the Quinté+ on Thursday, February 26 at Cagnes-sur-Mer)",https://www.equidia.fr/articles/actualite/kompany-vincent-loutsider-seduisant-du-quinte-du-jeudi-26-fevrier-a-cagnes-sur-mer,equidia_racing,Publié il y a 20 heures
"Quinté+ du vendredi 27 février : Analyse et décryptage de la course de réf (Quinté+ for Friday, February 27: Analysis and breakdown of the reference race)",https://www.equidia.fr/articles/pour-preparer-vos-paris/quinte-du-vendredi-27-fevrier-analyse-et-decryptage-de-la-course-de-ref,equidia_racing,Publié il y a 14 heures
"Le Quinté+ du vendredi 27 février vu par les statistiques (The Quinté+ for Friday, February 27 seen through statistics)",https://www.equidia.fr/articles/pour-preparer-vos-paris/le-quinte-du-vendredi-27-fevrier-vu-par-les-statistiques,equidia_racing,Publié il y a 15 heures
"Les trois belles cotes de ce jeudi 26  février (The three best odds for this Thursday, February 26)",https://www.equidia.fr/articles/pour-preparer-vos-paris/les-trois-belles-cotes-de-ce-jeudi-26-fevrier,equidia_racing,Publié il y a 18 heures
"L'analyse des cotes du Quinté+ du jeudi 26 février (Odds analysis for the Quinté+ on Thursday, February 26)",https://www.equidia.fr/articles/pour-preparer-vos-paris/lanalyse-des-cotes-du-quinte-du-jeudi-26-fevrier,equidia_racing,Publié il y a 18 heures
"Equidia met le feu au Quinté+ du jeudi 26 février à Cagnes-sur-Mer (Equidia heats up the Quinté+ on Thursday, February 26 at Cagnes-sur-Mer)",https://www.equidia.fr/articles/pour-preparer-vos-paris/equidia-met-le-feu-au-quinte-du-jeudi-26-fevrier-a-cagnes-sur-mer,equidia_racing,Publié il y a 21 heures
"Les Notes des partants du Quinté+ de ce jeudi 26 février (Notes on the Quinté+ starters for this Thursday, February 26)",https://www.equidia.fr/articles/pour-preparer-vos-paris/les-notes-des-partants-du-quinte-de-ce-jeudi-26-fevrier,equidia_racing,Publié il y a 21 heures
"Le pro du jour - Marc Sassier : ""Je déplace Kanto Avis avec de grandes ambitions !"" (Pro of the day - Marc Sassier: ""I'm bringing Kanto Avis with great ambitions!"")",https://www.equidia.fr/articles/actualite/le-pro-du-jour-marc-sassier-je-deplace-kanto-avis-avec-de-grandes-ambitions,equidia_racing,Publié il y a 22 heures
