title,link,source,time
Kieren Fallon: 'Constitution River would have won the Derby - but Aidan O'Brien will win it anyway',https://www.racingpost.com/news/festivals/derby-festival/kieren-fallon-constitution-river-would-have-won-the-derby-but-aidan-will-win-it-anyway-aPuYo6J2RdPM/,racing_post,
'Stand by your beds if Willie Mullins has this one ready to right the wrongs of last year's Ascot disappointment',https://www.racingpost.com/news/features/series/stand-by-your-beds-if-willie-mullins-has-this-one-ready-to-right-the-wrongs-of-last-years-ascot-disappointment-a14kh5T3cICQ/,racing_post,
How Aidan O'Brien is threatening to outperform his greatest seasons,https://www.racingpost.com/news/festivals/derby-festival/how-aidan-obrien-is-threatening-to-outperform-his-greatest-seasons-aUicg9x02Zxc/,racing_post,
Newbury: 'I backed her as well and got 8-1!' - Richard Hannon-trained filly lands huge gamble on her debut,https://www.racingpost.com/news/reports/i-backed-her-as-well-and-got-8-1-richard-hannon-trained-filly-lands-huge-gamble-on-her-debut-a0QfJ5I7jHxH/,racing_post,
Joseph O'Brien gives Oaks green light to classy filly as he sends 'two legitimate contenders' to Epsom Classics,https://www.racingpost.com/news/festivals/derby-festival/joseph-obrien-gives-oaks-green-light-to-classy-filly-as-he-sends-two-legitimate-contenders-to-epsom-classics-ahwZV4S1XYGl/,racing_post,
Benvenuto Cellini tops seven-strong Derby team for Ballydoyle as 17 go forward for Epsom,https://www.racingpost.com/news/festivals/derby-festival/benvenuto-cellini-tops-seven-strong-derby-team-for-ballydoyle-as-17-go-forward-for-epsom-aOpPS4x85kJk/,racing_post,
Group 1-winning trainer James Ferguson to give up licence after receiving 'an offer I simply could not refuse',https://www.racingpost.com/news/britain/group-1-winning-trainer-james-ferguson-to-give-up-licence-after-seven-years-aq10o8M7xgfG/,racing_post,
Henry de Bromhead retires Captain Guinness - but hopes to send another fan favourite to Royal Ascot,https://www.racingpost.com/news/ireland/henry-de-bromhead-retires-captain-guinness-but-hopes-to-send-another-fan-favourite-to-royal-ascot-aJ36i1k8jdCc/,racing_post,
WATCH: Constitution River lights up Paris | The Front Page,https://www.racingpost.com/video/the-front-page/watch-constitution-river-lights-up-paris-the-front-page-av14k7N12Vam/,racing_post,
Gowran Park: 'Definitely a nice horse' - Sean Levey and Richard Hannon team up to plunder lucrative Gowran Classic,https://www.racingpost.com/news/reports/hes-definitely-a-nice-horse-levey-and-hannon-team-up-to-plunder-lucrative-gowran-classic-with-bunyola-bay-anyrL7F4O812/,racing_post,
"Lingfield: George Scott's £880,000 breeze-up buy handed Coventry Stakes aim after easy win under Ryan Moore",https://www.racingpost.com/news/reports/george-scotts-880000-breeze-up-buy-handed-coventry-stakes-aim-after-easy-win-under-ryan-moore-aZ8Pe9b9Oh6s/,racing_post,
Listowel: jumping proves crucial for Noel Meade's Jesse Evans as Shark Hanlon cops fine for 'verbally abusing' clerk,https://www.racingpost.com/news/reports/jumping-proves-crucial-for-noel-meades-jesse-evans-as-shark-hanlon-cops-fine-for-verbally-abusing-listowel-clerk-a5XDD1S7EfZL/,racing_post,
"Coolmore not only breed the best horses, they’re the best thinkers too - why Constitution River's win was a tactical masterclass",https://www.racingpost.com/news/betting-insight/prix-du-jockey-club-analysis-coolmore-not-only-breed-the-best-horses-theyre-the-best-thinkers-as-well-aR6Ns8i6IPXN/,racing_post,
An exceptional colt who defied belief or workmanlike? Constitution River divides opinion,https://www.racingpost.com/news/betting-insight/an-exceptional-colt-who-defied-belief-or-workmanlike-constitution-river-divides-opinion-aC0kX7X62Mqi/,racing_post,
Coolmore ran their best colt at Chantilly - which tells you everything about how this year’s Derby will be run,https://www.racingpost.com/news/opinion/comment/coolmore-ran-their-best-colt-at-chantilly-which-tells-you-everything-about-how-this-years-derby-will-be-run-aR18F8a5KKy0/,racing_post,
Time to take a view about who wins the Derby - can anyone beat a rampant Aidan O'Brien after his Chantilly success?,https://www.racingpost.com/news/the-lookahead/time-to-take-a-view-about-who-wins-the-derby-can-anyone-beat-aidan-obrien-rampant-after-chantilly-success-aSwH37O6FqQW/,racing_post,
‘It was heartbreaking. That should have been our day’ - Dancing Brave and the Derby wounds that never healed,https://www.racingpost.com/news/features/it-was-heartbreaking.-that-should-have-been-our-day-dancing-brave-and-the-derby-wounds-that-never-healed-aubV77l9nMPD,racing_post,
Robbie Wilders is sure the handicapper has got this Wolverhampton runner all wrong - plus two others to back on Tuesday,https://www.racingpost.com/horse-racing-tips/premium-tips/top-tipsters/robbie-wilders-is-sure-the-handicapper-has-got-this-wolverhampton-runner-all-wrong-plus-two-others-to-back-on-tuesday-ak76a4o4kxSI/,racing_post,
Robbie Wilders' play of the day at Wolverhampton,https://www.racingpost.com/horse-racing-tips/play-of-the-day/robbie-wilders-play-of-the-day-at-wolverhampton-a07o74z0sy9x/,racing_post,
"Free horseracing tips for Tuesday, June 2 at Newcastle, Pontefract, Southwell and Wolverhampton",https://www.racingpost.com/horse-racing-tips/todays-top-tips/free-horseracing-tips-for-tuesday-june-2-at-newcastle-pontefract-southwell-and-wolverhampton-aDsNB9I5RhKe/,racing_post,
"Wolverhampton Placepot picks: Robbie Wilders' selections for the £50,000 guaranteed pool",https://www.racingpost.com/horse-racing-tips/tote-betting/wolverhampton-placepot-picks-robbie-wilders-selections-for-the-50000-guaranteed-pool-aZj5k3r3XRvz/,racing_post,
'I think he's a Group 1 horse' - Karl Burke warns punters not to discount his improving colt in Coronation Cup cracker,https://www.racingpost.com/news/festivals/derby-festival/i-think-hes-a-group-1-horse-karl-burke-warns-punters-not-to-discount-his-improving-colt-in-coronation-cup-cracker-aOoxC8t9SAp1/,racing_post,
'I think he'll take a big step forward' - Hector Crouch dreaming of Epsom glory with live Derby hope,https://www.racingpost.com/news/festivals/derby-festival/i-think-hell-take-a-big-step-forward-hector-crouch-hoping-for-big-derby-run-from-bay-of-brilliance-aTRGN7M4r5Lp/,racing_post,
Big punters have already been 'displaced' to the black market - the danger is that more may follow,https://www.racingpost.com/news/opinion/comment/big-punters-have-already-been-displaced-to-the-black-market-the-danger-is-that-more-may-follow-aTfsR1x2Et5B/,racing_post,
Kieran O'Neill to miss Derby day and Royal Ascot after receiving 28-day suspension for whip rule breaches,https://www.racingpost.com/news/britain/kieran-oneill-to-miss-derby-day-and-royal-ascot-after-receiving-28-day-suspension-for-whip-rule-breaches-afle49N0MddB/,racing_post,
Amelia Earhart backed for Oaks glory over Ballydoyle stablemate Precise - but shape of market could hinge on Ryan Moore decision,https://www.racingpost.com/news/festivals/derby-festival/amelia-earhart-backed-for-oaks-glory-over-ballydoyle-stablemate-precise-but-shape-of-market-could-hinge-on-ryan-moore-decision-akgde3z5kSza/,racing_post,
The weekend racing in Britain was weak - we need Saturdays to be better,https://www.racingpost.com/news/the-front-runner/the-weekend-racing-in-britain-was-weak-we-need-saturdays-to-be-better-aUaMV1n46uQy/,racing_post,
'He's strengthened up a good bit and the main aim will be to get him to the Breeders’ Cup',https://www.racingpost.com/news/features/stable-tours/hes-strengthened-up-a-good-bit-and-the-main-aim-will-be-to-get-him-to-the-breeders-cup-adEEg1F0p1KM/,racing_post,
'He's had a pretty extraordinary time and produced a big effort at the Breeders' Cup - you'd hope he's up to winning a Group 1',https://www.racingpost.com/news/features/stable-tours/hes-had-a-pretty-extraordinary-time-and-produced-a-big-effort-at-the-breeders-cup-youd-hope-hes-up-to-winning-a-group-1-a8sp35i5gkZ9/,racing_post,
'She’ll come forward a lot and winning a Group 1 is the aim this season’,https://www.racingpost.com/news/features/stable-tours/she-has-a-big-pedigree-and-was-impressive-in-her-maiden.-if-the-curragh-goes-well-then-the-irish-guineas-would-be-an-obvious-next-step-a4XKJ5f9buWl,racing_post,
"'That's given us the right to be more audacious and she'll probably go for the 1,000 Guineas'",https://www.racingpost.com/news/features/stable-tours/thats-given-us-the-right-to-be-more-audacious-and-shell-probably-go-for-the-1000-guineas-aTgTl8f3DVLw/,racing_post,
"'I did something so stupid, so ridiculous, so embarrassing that they couldn't possibly broadcast it - Chris Tarrant must have thought I was a prize idiot'",https://www.racingpost.com/news/features/series/i-did-something-so-stupid-so-ridiculous-so-embarrassing-that-they-couldnt-possibly-broadcast-it-chris-tarrant-must-have-thought-i-was-a-prize-idiot-aU8Rf7T0F13p/,racing_post,
Meet the Racing Post's first ever Newmarket correspondent - who used it as the launchpad for an astonishing career,https://www.racingpost.com/news/features/series/meet-the-racing-posts-first-ever-newmarket-correspondent-who-used-it-as-the-launchpad-for-an-astonishing-career-adp3N5B3jWaZ/,racing_post,
"'I had to sit in my office because I had tears in my eyes' - the most unforgettable stories in Racing Post history, as chosen by the editors",https://www.racingpost.com/news/features/series/i-had-to-sit-in-my-office-because-i-had-tears-in-my-eyes-the-most-unforgettable-stories-in-racing-post-history-as-chosen-by-the-editors-aJjSG1m9M86w/,racing_post,
'This was the start of a revolution' - the extraordinary inside story of the Racing Post's birth,https://www.racingpost.com/news/features/series/this-was-the-start-of-a-revolution-the-extraordinary-inside-story-of-the-racing-posts-birth-asQ7f6Z1aiL0/,racing_post,
WATCH: What keeps the Racing Post number one? Inside 40 years of horseracing expertise,https://www.racingpost.com/news/features/series/watch-what-keeps-the-racing-post-number-one-inside-40-years-of-horseracing-expertise-aKViL8I2Adjo/,racing_post,
Want to make sure your horse becomes a superstar? Name them after a ski resort,https://www.racingpost.com/news/opinion/comment/want-to-make-sure-your-horse-becomes-a-superstar-name-them-after-a-ski-resort-ayvN48k3wZR8/,racing_post,
The Derby needs you! The King and Queen are actively backing our greatest race - now it’s on the rest of us to do the same,https://www.racingpost.com/news/opinion/comment/the-derby-needs-you-the-king-and-queen-are-actively-backing-our-greatest-race-now-its-on-the-rest-of-us-to-do-the-same-aU8bK2F6N6qw/,racing_post,
Goodwood to run a race in memory of Tommie Jakes on Friday's all-apprentice card,https://www.racingpost.com/news/britain/goodwood-to-run-a-race-in-memory-of-tommie-jakes-on-fridays-all-apprentice-card-aZXqZ2G1HCtw/,racing_post,
'I’m super excited for the future' - full-circle moment as former Nicky Henderson assistant to set up training base in Lambourn,https://www.racingpost.com/news/features/regulars/im-super-excited-for-the-future-full-circle-moment-as-former-nicky-henderson-assistant-to-set-up-training-base-in-lambourn-aZXyr9S7TusP/,racing_post,
'I'm lucky the likes of them came before me' - Siobhan Rutledge joins a unique band of trailblazers,https://www.racingpost.com/news/ireland/im-lucky-the-likes-of-them-came-before-me-siobhan-rutledge-reflects-on-joining-trailblazing-female-flat-riders-after-riding-out-her-claim-aOfmu4O7viT2/,racing_post,
'It's just frightening the way it's going' - rising trainer joins chorus of discontent at pre-race vet checks in Ireland,https://www.racingpost.com/news/ireland/its-just-frightening-the-way-its-going-rising-trainer-joins-chorus-of-discontent-at-pre-race-vet-checks-in-ireland-adAXu1Y3sqtw/,racing_post,
'People think I say things to boost up horses. I don't. Ever. I only say what I think at the time. Maybe I'm a bit of a dreamer',https://www.racingpost.com/news/features/the-big-read/people-think-i-say-things-to-boost-up-horses.-i-dont.-ever.-i-only-say-what-i-think-at-the-time.-maybe-im-a-bit-of-a-dreamer-aW2zx7I51kAo,racing_post,
'Donald Trump with taste' - meet the president's boyhood pal who combines fine art with fine horses and now owns the Derby favourite,https://www.racingpost.com/news/features/interviews/donald-trump-with-taste-meet-the-presidents-boyhood-pal-who-combines-fine-art-with-fine-horses-and-now-owns-the-derby-favourite-ap4Oo3Z3v8q1/,racing_post,
'You can't be more sorry than I am' - remorseful jockey's return to the winner's enclosure after a coma and a prison sentence,https://www.racingpost.com/news/features/interviews/you-cant-be-more-sorry-than-i-am-remorseful-jockeys-return-to-the-winners-enclosure-after-a-coma-and-a-prison-sentence-auQIa8d6gz6V/,racing_post,
"Charlotte Jones: 'Five winners in a row and I don't pick up an outside ride - if I was a boy, would that be different?'",https://www.racingpost.com/news/features/interviews/charlotte-jones-five-winners-in-a-row-and-i-dont-pick-up-an-outside-ride-if-i-was-a-boy-would-that-be-different-a3YmM0j0TSQj/,racing_post,
Prix du Jockey Club: 'He could do whatever you asked him to do' - Ryan Moore hails Constitution River as Aidan O'Brien saddles amazing 1-2-3,https://www.racingpost.com/news/reports/constitution-river-overcomes-wide-draw-to-lead-home-amazing-ballydoyle-clean-sweep-in-prix-du-jockey-club-aOW716J7gknm/,racing_post,
"Chantilly: 'I know he's a champion, he can quicken very strongly' - Goliath back on song and ready to take aim at Royal Ascot",https://www.racingpost.com/news/reports/i-know-hes-a-champion-he-can-quicken-very-strongly-goliath-back-on-song-and-ready-to-take-aim-at-royal-ascot-awC0v8k864hO/,racing_post,
"'It’s all been worthwhile' - Zac Purton celebrates becoming the first jockey to ride 2,000 winners in Hong Kong",https://www.racingpost.com/news/international/hong-kong/its-all-been-worthwhile-zac-purton-celebrates-becoming-the-first-jockey-to-ride-2000-winners-in-hong-kong-aVBki8S2rbJQ/,racing_post,
Government washes its hands of responsibility as uncertainty over affordability checks continues,https://www.racingpost.com/news/opinion/comment/government-washes-its-hands-of-responsibility-as-uncertainty-over-affordability-checks-continues-akddj7t9IN3g/,racing_post,
Frustration as regulator struggles to get a grip on ballooning black market and social media advertising,https://www.racingpost.com/news/opinion/comment/new-research-highlights-the-scale-of-the-challenge-facing-new-illegal-gambling-taskforce-aNhcN4l09YYc/,racing_post,
"Chaos, compromise or change? Ascot has gone rogue once more - now racing faces its reckoning",https://www.racingpost.com/news/opinion/comment/chaos-compromise-or-change-ascot-has-gone-rogue-once-more-now-racing-faces-its-reckoning-a5eGI2F3ZR89/,racing_post,
"Poker genius, visionary football chairman and pioneering data-led punter - the many (profitable) faces of Tony Bloom",https://www.racingpost.com/news/features/masters-of-betting/poker-genius-visionary-football-chairman-and-pioneering-data-led-punter-the-many-profitable-faces-of-tony-bloom-a0UWt2Y6DPmh/,racing_post,
"Introducing Masters of Betting, an unmissable series available now - read it all with 25% off RP+",https://www.racingpost.com/news/introducing-masters-of-betting-an-unmissable-series-next-week-in-the-racing-post-read-it-all-with-25-off-rp-aJKV17m1iNzx/,racing_post,
"'I was down £11,000 but you can't let that alter what you do' - meet one of the giants of on-course betting",https://www.racingpost.com/news/features/masters-of-betting/i-was-down-11000-but-you-cant-let-that-alter-what-you-do-meet-one-of-the-giants-of-on-course-betting-aXYs01f58AHh/,racing_post,
When science met punting: the godfather of modern-day betting and his golden rules that remain valid to this day,https://www.racingpost.com/news/features/masters-of-betting/when-science-met-punting-the-godfather-of-modern-day-betting-and-his-golden-rules-that-remain-valid-to-this-day-aO1b67N07bKR/,racing_post,
How a dodgy bank loan led to nearly 40 years as a pro punter - proving old-school methods still have their place,https://www.racingpost.com/news/features/masters-of-betting/how-a-dodgy-bank-loan-led-to-nearly-40-years-as-a-pro-punter-proving-old-school-methods-still-have-their-place-aKazg3g7sdy3/,racing_post,
Newnham’s Eagle aims to continue Golden run on seven-day backup at Valley,https://www.scmp.com/sport/racing/article/3355524/mark-newnhams-eagle-aims-continue-golden-run-seven-day-backup-happy-valley,scmp_racing,2026-06-01 14:28
Light Years Charm gives Eustace landmark Group Three victory in Hong Kong,https://www.scmp.com/sport/racing/article/3355469/light-years-charm-provides-david-eustace-landmark-group-three-victory-hong-kong,scmp_racing,2026-05-31 19:26
Fownes draws two clear in championship race as trio of debutants strike,https://www.scmp.com/sport/racing/article/3355471/caspar-fownes-draws-two-clear-championship-race-trio-debutants-strike-sha-tin,scmp_racing,2026-05-31 19:53
Patch Of Stars shines bright to continue meteoric rise in Sha Tin Vase for Man,https://www.scmp.com/sport/racing/article/3355465/patch-stars-shines-bright-continue-meteoric-rise-sha-tin-vase-manfred-man,scmp_racing,2026-05-31 18:53
Hayes looks to continue sprint division domination with Sha Tin Vase duo,https://www.scmp.com/sport/racing/article/3355414/david-hayes-looks-continue-sprint-division-domination-sha-tin-vase-duo,scmp_racing,2026-05-30 18:10
Ovation bids to complete stunning comeback from injury with Lion Rock victory,https://www.scmp.com/sport/racing/article/3355398/winning-ovation-bids-complete-stunning-comeback-injury-lion-rock-trophy-victory,scmp_racing,2026-05-30 13:20
"Power Couple Zac and Nicole Purton on Hong Kong life, legacy and Ka Ying Rising",https://www.scmp.com/sport/racing/article/3355349/zac-and-nicole-purton-racings-power-couple-hong-kong-life-legacy-and-ka-ying-rising,scmp_racing,2026-05-30 08:00
SCMP Best Bets: Blizzard can storm to victory for punters at Sha Tin,https://www.scmp.com/sport/racing/article/3355426/scmp-best-bets-blizzard-can-storm-victory-punters-sha-tin,scmp_racing,2026-05-30 21:45
馬場浮世繪｜麥晴欣首勝一級賽 (Racing Post Sketchbook | Michelle Payne's first Group 1 win),https://www.stheadline.com/realtime-racing/3578530/馬場浮世繪麥晴欣首勝一級賽,singtao_racing,2026-06-01 13:35 (14小時前)
"馬場浮世繪｜「歌利巨人」先戰夏域錦標 再挑戰英皇錦標 (Racing Post Sketchbook | Goliath to first race in Hardwicke Stakes, then challenge the King George Stakes)",https://www.stheadline.com/realtime-racing/3578528/馬場浮世繪歌利巨人先戰夏域錦標-再挑戰英皇錦標,singtao_racing,2026-06-01 13:35 (14小時前)
"2000捷里程碑  | 潘頓19載達壯舉 累計袋逾億獎金 (2000 Win Milestone | Zac Purton achieves feat in 19 years, accumulating over 100 million in prize money)",https://www.stheadline.com/realtime-racing/3578029/2000捷里程碑-潘頓19載達壯舉-累計袋逾億獎金,singtao_racing,2026-06-01 10:35 (17小時前)
艾兆禮「獵寶勤」「天下寵兒」 (Andrea Atzeni's Huntercombe and Universal Favourite),https://www.stheadline.com/realtime-racing/3578442/艾兆禮獵寶勤天下寵兒,singtao_racing,2026-06-01 09:35 (18小時前)
"學有成   夢馳騁　馬會招募新一代賽事見習學員 (Achieve success, gallop your dreams: Jockey Club recruits new generation of racing trainees)",https://www.stheadline.com/realtime-racing/3578416/學有成-夢馳騁馬會招募新一代賽事見習學員-,singtao_racing,2026-06-01 08:35 (19小時前)
呂健威親自為一駒打表 (Frankie Lor personally clocks a horse),https://www.stheadline.com/realtime-racing/3578407/呂健威親自為一駒打表,singtao_racing,2026-06-01 07:35 (20小時前)
晨光追擊│「佐治傳奇」神態活躍 (Morning Pursuit | George Legend looks lively),https://www.stheadline.com/realtime-racing/3578376/晨光追擊佐治傳奇神態活躍,singtao_racing,2026-06-01 07:35 (20小時前)
潘頓分享2000W美麗海報 (Zac Purton shares beautiful 2000-win poster),https://www.stheadline.com/realtime-racing/3578387/潘頓分享2000W美麗海報,singtao_racing,2026-06-01 07:35 (20小時前)
田泰安周三贏馬賀壽 (Karis Teetan wins race on Wednesday to celebrate birthday),https://www.stheadline.com/realtime-racing/3577995/田泰安周三贏馬賀壽,singtao_racing,2026-06-02 03:35 (2026-05-31 19:15 HKT)
周俊樂周三唔騎未來外父馬？ (Jerry Chau not riding future father-in-law's horse on Wednesday?),https://www.stheadline.com/realtime-racing/3577994/周俊樂周三唔騎未來外父馬,singtao_racing,2026-06-02 03:35 (2026-05-31 19:00 HKT)
馬場浮世繪│伍鵬志「友瑩」捧盃 (Racing Post Sketchbook | Pierre Ng's You Ying lifts the trophy),https://www.stheadline.com/realtime-racing/3578110/馬場浮世繪伍鵬志友瑩捧盃,singtao_racing,2026-06-02 03:35 (2026-05-31 18:52 HKT)
馬場密探048｜「嘉應奇兵」騎練齊起孖 (Racing Spy 048 | Ka Ying Rising's jockey and trainer both score a double),https://www.stheadline.com/realtime-racing/3578107/馬場密探048嘉應奇兵騎練齊起孖,singtao_racing,2026-06-02 03:35 (2026-05-31 18:50 HKT)
馬場浮世繪│方嘉柏起孖續居榜首 (Racing Post Sketchbook | Caspar Fownes scores a double and remains at the top),https://www.stheadline.com/realtime-racing/3578109/馬場浮世繪方嘉柏起孖續居榜首,singtao_racing,2026-06-02 03:35 (2026-05-31 18:47 HKT)
馬場密探048｜「共享富裕」方廄起孖 (Racing Spy 048 | Sharing Plenty gives Fownes' stable a double),https://www.stheadline.com/realtime-racing/3578103/馬場密探048共享富裕方廄起孖,singtao_racing,2026-06-02 03:35 (2026-05-31 18:30 HKT)
馬場密探048｜「錶之星河」大熱捧銀瓶 (Racing Spy 048 | Hot favourite Galaxy Witness wins the Silver Plate),https://www.stheadline.com/realtime-racing/3578094/馬場密探048錶之星河大熱捧銀瓶,singtao_racing,2026-06-02 03:35 (2026-05-31 18:02 HKT)
馬場密探048｜「喜悅歡欣」初出爆大冷 (Racing Spy 048 | Joyful Joyful causes a huge upset on debut),https://www.stheadline.com/realtime-racing/3578091/馬場密探048喜悅歡欣初出爆大冷,singtao_racing,2026-06-02 03:35 (2026-05-31 17:44 HKT)
馬場密探048｜「光年魅力」爆大冷奪標 (Racing Spy 048 | Light Years Charm causes a huge upset to win the prize),https://www.stheadline.com/realtime-racing/3578081/馬場密探048光年魅力爆大冷奪標,singtao_racing,2026-06-02 03:35 (2026-05-31 16:53 HKT)
馬場密探048｜「雙贏」後上爆半冷 (Racing Spy 048 | Double Win comes from behind to cause a moderate upset),https://www.stheadline.com/realtime-racing/3578074/馬場密探048雙贏後上爆半冷,singtao_racing,2026-06-02 03:35 (2026-05-31 16:21 HKT)
馬場密探048｜「友瑩仁」捧客家盃 (Racing Spy 048 | Able Friend wins the Hakka Cup),https://www.stheadline.com/realtime-racing/3578064/馬場密探048友瑩仁捧客家盃,singtao_racing,2026-06-02 03:35 (2026-05-31 15:49 HKT)
馬場密探048｜「鋁神」轉廄後首捷 (Racing Spy 048 | Aluminium God wins first race after stable transfer),https://www.stheadline.com/realtime-racing/3578050/馬場密探048鋁神轉廄後首捷,singtao_racing,2026-06-02 03:35 (2026-05-31 15:01 HKT)
Renegade (2-1) Favored in Field of 9 for Belmont Stakes,https://www.bloodhorse.com/horse-racing/articles/292191/renegade-2-1-favored-in-field-of-9-for-belmont-stakes,bloodhorse_news,"2026-06-02 19:45 (ByBob EhaltToday, 7:45 PM)"
"After Major Injury, Conner Shifts from Jockey to Agent",https://www.bloodhorse.com/horse-racing/articles/292168/after-major-injury-conner-shifts-from-jockey-to-agent,bloodhorse_news,"2026-06-02 19:10 (BySean CollinsToday, 7:10 PM)"
Bottas Makes Season Debut in Pennine Ridge Stakes,https://www.bloodhorse.com/horse-racing/articles/292186/bottas-makes-season-debut-in-pennine-ridge-stakes,bloodhorse_news,"2026-06-02 18:16 (ByOlivia NewmanToday, 6:16 PM)"
Connect Sold to Seyda Ercan in Turkey,https://www.bloodhorse.com/horse-racing/articles/292189/connect-sold-to-seyda-ercan-in-turkey,bloodhorse_news,"2026-06-02 18:09 (ByEric MitchellToday, 6:09 PM)"
"BH Monday: Belmont Preview, Durkin on Release of Memoir",https://www.bloodhorse.com/horse-racing/articles/292188/bh-monday-belmont-preview-durkin-on-release-of-memoir,bloodhorse_news,"2026-06-02 17:33 (ByBloodHorse StaffToday, 5:33 PM)"
TAA Launches Annual Calendar Photo Contest,https://www.bloodhorse.com/horse-racing/articles/292187/taa-launches-annual-calendar-photo-contest,bloodhorse_news,"2026-06-02 16:08 (Today, 4:08 PM)"
Journalism Seeks Stud Value Boost with Met Mile Win,https://www.bloodhorse.com/horse-racing/articles/292185/journalism-seeks-stud-value-boost-with-met-mile-win,bloodhorse_news,"2026-06-02 14:29 (BySean CollinsToday, 2:29 PM)"
Lope de Vega Colt Tops Opening Day of Gold Coast Sale,https://www.bloodhorse.com/horse-racing/articles/292184/lope-de-vega-colt-tops-opening-day-of-gold-coast-sale,bloodhorse_news,"2026-06-02 13:56 (ByPaul Symes/ANZ Bloodstock NewsToday, 1:56 PM)"
Ocala Breeders' Sales June Auction Adds 72 Supplements,https://www.bloodhorse.com/horse-racing/articles/292183/ocala-breeders-sales-june-auction-adds-72-supplements,bloodhorse_news,"2026-06-02 12:59 (Today, 12:59 PM)"
Mooney Named Aga Khan Studs' Bloodstock Executive,https://www.bloodhorse.com/horse-racing/articles/292182/mooney-named-aga-khan-studs-bloodstock-executive,bloodhorse_news,"2026-06-02 10:44 (Today, 10:44 AM)"
Health Zone: Neurological,http://cs.bloodhorse.com/files/folders/trade-zone/entry650720.aspx,bloodhorse_news,"2026-06-02 10:00 (ByAmanda DuckworthToday, 10:00 AM)"
TOBA June Member of the Month,https://www.bloodhorse.com/horse-racing/articles/291826/toba-june-member-of-the-month,bloodhorse_news,"2026-06-02 09:00 (ByCarly SilverToday, 9:00 AM)"
