title,link,source,time
On the Rise: Charlotte Clement de Bona,https://www.bloodhorse.com/horse-racing/articles/292110/on-the-rise-charlotte-clement-de-bona,bloodhorse_news,"2026-06-02 08:00 (ByKaren M. JohnsonToday, 8:00 AM)"
Stronghold an Image of Strength in Triple Bend,https://www.bloodhorse.com/horse-racing/articles/292176/stronghold-an-image-of-strength-in-triple-bend,bloodhorse_news,"2026-06-01 20:37 (BySean CollinsYesterday, 8:37 PM)"
Lion Lake Listed as Clear Favorite in Wonder Again,https://www.bloodhorse.com/horse-racing/articles/292175/lion-lake-listed-as-clear-favorite-in-wonder-again,bloodhorse_news,"2026-06-01 19:42 (BySean CollinsYesterday, 7:42 PM)"
Eccentric's Late Push Wins Gran Premio Hipico Falabella,https://www.bloodhorse.com/horse-racing/articles/292174/eccentrics-late-push-wins-gran-premio-hipico-falabella,bloodhorse_news,"2026-06-01 19:15 (Yesterday, 7:15 PM)"
Constitution River Leads Brilliant 1-2-3 for O'Brien,https://www.bloodhorse.com/horse-racing/articles/292172/constitution-river-leads-brilliant-1-2-3-for-obrien,bloodhorse_news,"2026-06-01 19:00 (ByScott Burton/Racing PostYesterday, 7:00 PM)"
Ron Glatt Gets First Win in More Than Quarter Century,https://www.bloodhorse.com/horse-racing/articles/292173/ron-glatt-gets-first-win-in-more-than-quarter-century,bloodhorse_news,"2026-06-01 18:51 (Yesterday, 6:51 PM)"
"Purton First Jockey to 2,000 Hong Kong Wins",https://www.bloodhorse.com/horse-racing/articles/292171/purton-first-jockey-to-2-000-hong-kong-wins,bloodhorse_news,"2026-06-01 18:19 (ByLiam Headd/Racing PostYesterday, 6:19 PM)"
Magic Millions Readies for National Yearling Sale,https://www.bloodhorse.com/horse-racing/articles/292170/magic-millions-readies-for-national-yearling-sale,bloodhorse_news,"2026-06-01 17:46 (ByANZ Bloodstock News StaffYesterday, 5:46 PM)"
"Ocelli Skips Belmont, Targets Ohio Derby",https://www.bloodhorse.com/horse-racing/articles/292169/ocelli-skips-belmont-targets-ohio-derby,bloodhorse_news,"2026-06-01 17:40 (BySean CollinsYesterday, 5:40 PM)"
"Racing Still Family Affair for Pulito, Phipps Siblings",https://www.bloodhorse.com/horse-racing/articles/292123/racing-still-family-affair-for-pulito-phipps-siblings,bloodhorse_news,"2026-06-01 16:45 (ByBob EhaltYesterday, 4:45 PM)"
Croix du Nord Tops Takarazuka Kinen Fan Poll,https://www.bloodhorse.com/horse-racing/articles/292167/croix-du-nord-tops-takarazuka-kinen-fan-poll,bloodhorse_news,"2026-06-01 15:28 (ByNaohiro GodaYesterday, 3:28 PM)"
Headley Grange Rewards Owners With Kingsford-Smith Win,https://www.bloodhorse.com/horse-racing/articles/292145/headley-grange-rewards-owners-with-kingsford-smith-win,bloodhorse_news,"2026-06-01 14:52 (ByTrevor Marshallsea/ANZ Bloodstock NewsYesterday, 2:52 PM)"
Lovcen Wins Japanese Derby With Change of Tactics,https://www.bloodhorse.com/horse-racing/articles/292166/lovcen-wins-japanese-derby-with-change-of-tactics,bloodhorse_news,"2026-06-01 13:08 (ByBob KieckheferYesterday, 1:08 PM)"
"Om N Joy Wheels Back in a Week, Takes Santa Margarita",https://www.bloodhorse.com/horse-racing/articles/292144/om-n-joy-wheels-back-in-a-week-takes-santa-margarita,bloodhorse_news,"2026-06-02 03:35 (ByTracy GantzSaturday, 9:28 PM)"
"Original Sin Gets Jump on Rivals, Grabs Blame Stakes",https://www.bloodhorse.com/horse-racing/articles/292142/original-sin-gets-jump-on-rivals-grabs-blame-stakes,bloodhorse_news,"2026-06-02 03:35 (ByByron KingSaturday, 7:27 PM)"
"Walsh, Gaffalione on Original Sin's Victory in Blame",https://www.bloodhorse.com/horse-racing/videos/292143/walsh-gaffalione-on-original-sins-victory-in-blame,bloodhorse_news,"2026-06-02 03:35 (ByJessica LicausiSaturday, 6:24 PM)"
Cornucopian Turns Aside Roll On Big Joe in Aristides,https://www.bloodhorse.com/horse-racing/articles/292140/cornucopian-turns-aside-roll-on-big-joe-in-aristides,bloodhorse_news,"2026-06-02 03:35 (ByLizzy MaddenSaturday, 5:51 PM)"
"Goldolphin's Maycocks Bay, Deloraine Double at Woodbine",https://www.bloodhorse.com/horse-racing/articles/292138/goldolphins-maycocks-bay-deloraine-double-at-woodbine,bloodhorse_news,"2026-06-02 03:35 (ByByron KingandSean CollinsSaturday, 5:49 PM)"
Cox Discusses Sweet Treasure's Mint Julep Win,https://www.bloodhorse.com/horse-racing/videos/292141/cox-discusses-sweet-treasures-mint-julep-win,bloodhorse_news,"2026-06-02 03:35 (ByJessica LicausiSaturday, 5:30 PM)"
"Nearly Scratched, Splendora Stays In to Win Shawnee",https://www.bloodhorse.com/horse-racing/articles/292139/nearly-scratched-splendora-stays-in-to-win-shawnee,bloodhorse_news,"2026-06-02 03:35 (BySean CollinsSaturday, 4:56 PM)"
Golden Tempo Records Final Belmont Breeze at Keeneland,https://www.bloodhorse.com/horse-racing/articles/292134/golden-tempo-records-final-belmont-breeze-at-keeneland,bloodhorse_news,"2026-06-02 03:35 (BySean CollinsSaturday, 2:37 PM)"
Ortiz Believes Golden Tempo Getting Stronger Mentally,https://www.bloodhorse.com/horse-racing/videos/292136/ortiz-believes-golden-tempo-getting-stronger-mentally,bloodhorse_news,"2026-06-02 03:35 (BySean CollinsSaturday, 1:58 PM)"
Wathnan Buys Group 2 Winner Godspeed,https://www.bloodhorse.com/horse-racing/articles/292135/wathnan-buys-group-2-winner-godspeed,bloodhorse_news,"2026-06-02 03:35 (ByLydia Symonds/Racing PostSaturday, 1:40 PM)"
"Sense, New Ability Were Keys to Hollywood Gold Cup",https://www.bloodhorse.com/horse-racing/articles/292121/sense-new-ability-were-keys-to-hollywood-gold-cup,bloodhorse_news,"2026-06-02 03:35 (ByJay HovdeyFriday, 10:00 PM)"
Alpyland Runs Away With Penn Mile,https://www.bloodhorse.com/horse-racing/articles/292122/alpyland-runs-away-with-penn-mile,bloodhorse_news,"2026-06-02 03:35 (ByLizzy MaddenFriday, 8:48 PM)"
NYRA Seeing Reduced Volatility in Late Odds Changes,https://www.bloodhorse.com/horse-racing/articles/292119/nyra-seeing-reduced-volatility-in-late-odds-changes,bloodhorse_news,"2026-06-02 03:35 (ByFrank AngstFriday, 4:55 PM)"
$79K Carryover in Late Pick 5 May 30 at Churchill Downs,https://www.bloodhorse.com/horse-racing/articles/292120/79k-carryover-in-late-pick-5-may-30-at-churchill-downs,bloodhorse_news,"2026-06-02 03:35 (Friday, 4:37 PM)"
Noche Sublime Faces Males Again in Falabella,https://www.bloodhorse.com/horse-racing/articles/292118/noche-sublime-faces-males-again-in-falabella,bloodhorse_news,"2026-06-02 03:35 (Friday, 4:19 PM)"
Constitution River Draws Wide for Prix du Jockey Club,https://www.bloodhorse.com/horse-racing/articles/292117/constitution-river-draws-wide-for-prix-du-jockey-club,bloodhorse_news,"2026-06-02 03:35 (ByScott Burton/Racing PostFriday, 3:04 PM)"
Prime Aurora First Winner for Mind Control,https://www.bloodhorse.com/horse-racing/articles/292116/prime-aurora-first-winner-for-mind-control,bloodhorse_news,"2026-06-02 03:35 (ByLizzy MaddenFriday, 2:34 PM)"
Lovcen Ticks Boxes in Japanese Derby,https://www.bloodhorse.com/horse-racing/articles/292115/lovcen-ticks-boxes-in-japanese-derby,bloodhorse_news,"2026-06-02 03:35 (ByBob KieckheferFriday, 12:52 PM)"
Iowa HBPA: New Law Strengthens Thoroughbred Industry,https://www.bloodhorse.com/horse-racing/articles/292112/iowa-hbpa-new-law-strengthens-thoroughbred-industry,bloodhorse_news,"2026-06-02 03:35 (Friday, 11:14 AM)"
Morgan Shares Vision With FTBOA for Florida Industry,https://www.bloodhorse.com/horse-racing/articles/292113/morgan-shares-vision-with-ftboa-for-florida-industry,bloodhorse_news,"2026-06-02 03:35 (Friday, 10:59 AM)"
Belmont Stakes by the Numbers,https://www.bloodhorse.com/horse-racing/articles/292111/belmont-stakes-by-the-numbers,bloodhorse_news,"2026-06-02 03:35 (ByMike Curry/America's Best RacingFriday, 10:33 AM)"
More Selective Grading Could Benefit Triple Crown Races,https://www.bloodhorse.com/horse-racing/articles/292108/more-selective-grading-could-benefit-triple-crown-races,bloodhorse_news,"2026-06-02 03:35 (ByFrank AngstFriday, 8:00 AM)"
Epic Reign First Winner for Freshman Sire Epicenter,https://www.bloodhorse.com/horse-racing/articles/292109/epic-reign-first-winner-for-freshman-sire-epicenter,bloodhorse_news,"2026-06-02 03:35 (ByNicole StaffordThursday, 6:43 PM)"
Belmont Stakes May See a Powershift,https://www.bloodhorse.com/horse-racing/articles/292107/belmont-stakes-may-see-a-powershift,bloodhorse_news,"2026-06-02 03:35 (ByByron KingThursday, 4:47 PM)"
Ombudsman Determined in Brigadier Gerard Victory,https://www.bloodhorse.com/horse-racing/articles/292106/ombudsman-determined-in-brigadier-gerard-victory,bloodhorse_news,"2026-06-02 03:35 (ByMatt Rennie/Racing PostThursday, 3:51 PM)"
All Job Listings,https://thestraight.com.au,the_straight,2026-05-31 04:30
Lope De Vega colt tops the charts on opening day,https://www.anzbloodstocknews.com/lope-de-vega-colt-tops-the-charts-on-opening-day/,anz_bloodstock,"June 2, 2026"
Stradbroke to follow for Regal Award after Fred Best success,https://www.anzbloodstocknews.com/stradbroke-to-follow-for-regal-award-after-fred-best-success/,anz_bloodstock,"May 31, 2026"
Headley Grange hits the big time with Kingsford-Smith victory,https://www.anzbloodstocknews.com/headley-grange-hits-the-big-time-with-kingsford-smith-victory/,anz_bloodstock,"May 31, 2026"
JJ Atkins next on the agenda for Berzelius following rousing Sires’ Produce win,https://www.anzbloodstocknews.com/jj-atkins-next-on-the-agenda-for-berzelius-following-rousing-sires-produce-win/,anz_bloodstock,"May 31, 2026"
Waller’s Providence provides landmark winners for McDonald and Wootton Bassett in classy Derby display,https://www.anzbloodstocknews.com/wallers-providence-provides-landmark-winners-for-mcdonald-and-wootton-bassett-in-classy-derby-display/,anz_bloodstock,"May 31, 2026"
Solid Kiwi filly bidding for Gold in Queensland Derby,https://www.anzbloodstocknews.com/solid-kiwi-filly-bidding-for-gold-in-queensland-derby/,anz_bloodstock,"May 29, 2026"
Magic Millions Gold Coast National Yearling Sale: Five things we learned on day 1,https://www.ttrausnz.com.au/edition/2026-06-02/magic-millions-gold-coast-national-yearling-sale-five-things-we-learned-on-day-1,ttr_ausnz,2026-06-02
"From a $12 bet in 1971 to one of the best syndication companies in Australasia, New Zealand’s Sir David Ellis has been appointed Knight Companion of the New Zealand Order of Merit in the 2026 King's Birthday Honours. On a day of celebration, Sir David took time to reflect with TTR on a lifetime of achievements.",https://www.ttrausnz.com.au/edition/2026-06-02/take-a-bow-sir-david-ellis,ttr_ausnz,2026-06-02
"At the Magic Millions Gold Coast National Yearling Sale, TTR uncovered another outstanding value buy, and on Monday, it was Pitman Racing who went home with an absolute steal when paying $90,000 for a son of Snitzel.",https://www.ttrausnz.com.au/edition/2026-06-02/value-buy-pitman-secures-a-son-of-snitzel-for-less-than-six-figures,ttr_ausnz,2026-06-02
"Zac Purton’s 2000th victory started a day where All Too Hard celebrated a double and a new stakes winner with Patch Of Stars winning the G3 Sha Tin Vase on Sunday. Light Years Charm gave David Eustace his first group win in the G3 Lion Rock Trophy, and Caspar Fownes had a double to put him on top of the tight trainer’s battle.",https://www.ttrausnz.com.au/edition/2026-06-02/hong-kong-patch-of-stars-leads-all-too-hard-double,ttr_ausnz,2026-06-02
"Three Group 1s in three countries took place over the weekend, and it was the Ballydoyle troops all the way at Chantilly, with two sons of Wootton Bassett running the quinella in the G1 Prix du Jockey Club. In Japan, Lovcen added another string to his bow in the G1 Japanese Derby, and in South Africa, Star Major delivered a maiden Group 1 for trainer James Crawford.",https://www.ttrausnz.com.au/edition/2026-06-02/international-news-ballydoyle-trifecta-in-prix-du-jockey-club-sizzler,ttr_ausnz,2026-06-02
"The Magic Millions Gold Coast National Yearling Sale, the final yearling sale on the Australian calendar, will take place on Monday and Tuesday of this week. Managing Director Barry Bowditch highlights the opportunities on offer at all four corners of the catalogue, including the final chance to access next season's Magic Millions Race Series.",https://www.ttrausnz.com.au/edition/2026-06-01/opportunity-knocks-magic-millions-looks-to-wrap-up-solid-season-with-national-sale,ttr_ausnz,2026-06-02
"Lot 872 at the Magic Millions Gold Coast National Yearling Sale is not only unique in that she is the only I Am Invincible offspring in the catalogue, but in the wonderful family her dam Loveyamadly has cultivated. United Syndications' Peter Creighton talks to TTR about the journey the mare has taken her ownership on.",https://www.ttrausnz.com.au/edition/2026-06-01/the-filly-peter-creighton-wishes-he-could-keep,ttr_ausnz,2026-06-02
"One of the more savvy purchases from Saturday's racing was Savagery Vibe, newly crowned winner of the Listed Helen Coughlan Stakes at Eagle Farm. Bloodstock agent Cameron Cooke backed his eye when buying the mare, who has raked in over $300,000 in prize money, for $22,500 on Inglis Digital two years ago.",https://www.ttrausnz.com.au/edition/2026-06-01/buy-of-the-weekend-cookes-digital-punt-pays-off-in-savage-style,ttr_ausnz,2026-06-02
"Providence’s win in the G1 Queensland Derby gave Wootton Bassett his first Group 1 from his Southern Hemisphere foals. It was the 16th Group 1 for jockey James McDonald this season, equalling the record set by Malcolm Johnston. Zoustar, Ole Kirk, and Brutal added new stakes winners, while Exosphere’s Headley Grange took out the G1 Kingsford-Smith Cup in a thrilling finish.",https://www.ttrausnz.com.au/edition/2026-05-31/saturday-summary-wootton-bassett-adds-a-new-classic-winner,ttr_ausnz,2026-06-02
Juvenile Summary: Extreme Choice’s Berzelius wins Sires’ Produce,https://www.ttrausnz.com.au/edition/2026-05-31/juvenile-summary-extreme-choices-berzelius-wins-sires-produce,ttr_ausnz,2026-06-02
From the NRL to the Court of Appeal: a big week for Racing NSW,https://www.ttrausnz.com.au/edition/2026-05-30/from-the-nrl-to-the-court-of-appeal-a-big-week-for-racing-nsw,ttr_ausnz,2026-06-02
Touching moments as trainer aims to continue hot run,https://www.smh.com.au/sport/racing/touching-moments-as-trainer-aims-to-continue-hot-run-20260601-p602xh.html,smh_racing,"June 1, 2026"
Tips and race-by-race guide for Kembla Grange on Tuesday,https://www.smh.com.au/sport/racing/tips-and-race-by-race-guide-for-kembla-grange-on-tuesday-20260601-p602sq.html,smh_racing,"June 1, 2026"
Lane lines up strong team for trip to ‘Randwick of the West’,https://www.smh.com.au/sport/racing/lane-sends-strong-team-to-randwick-of-the-west-20260531-p602g3.html,smh_racing,"May 31, 2026"
Tips and race-by-race guide for Warren on Monday,https://www.smh.com.au/sport/racing/tips-and-race-by-race-guide-for-warren-on-monday-20260531-p602fj.html,smh_racing,"May 31, 2026"
In-form Bullock eyes lucky seven at Scone on Sunday,https://www.smh.com.au/sport/racing/in-form-bullock-eyes-lucky-seven-at-scone-on-sunday-20260530-p6026m.html,smh_racing,"May 30, 2026"
Race-by-race tips and previews for Scone on Sunday,https://www.smh.com.au/sport/racing/race-by-race-tips-and-previews-for-scone-on-sunday-20260530-p6026l.html,smh_racing,"May 30, 2026"
Portland ends frustrating run in Australia to open up spring potential,https://www.smh.com.au/sport/racing/portland-ends-frustrating-run-in-australia-to-open-up-spring-potential-20260530-p60260.html,smh_racing,Trainer Matt Smith was looking to handicap races in the spring with import Portland after he made the most of a lucky run to take out the Lord Mayors Cup at Rosehill.
J-Mac hopes for fair chance with Fangirl in hunt for group 1 record,https://www.smh.com.au/sport/racing/j-mac-hopes-for-fair-chance-with-fangirl-in-hunt-for-group-1-record-20260529-p601wn.html,smh_racing,"May 29, 2026"
Tips and race-by-race guide for Rosehill on Saturday,https://www.smh.com.au/sport/racing/tips-and-race-by-race-guide-for-rosehill-on-saturday-20260528-p601l2.html,smh_racing,"May 29, 2026"
Race-by-race tips and previews for Friday’s Goulburn meeting,https://www.smh.com.au/sport/racing/race-by-race-tips-and-previews-for-friday-s-goulburn-meeting-20260528-p601o7.html,smh_racing,"May 28, 2026"
Smith eyes wet track for positive finish with Portland after sick beat,https://www.smh.com.au/sport/racing/smith-eyes-wet-track-for-positive-finish-with-portland-after-sick-beat-20260528-p601o4.html,smh_racing,"May 28, 2026"
"Belmont Stakes 2026: Brown running three horses, each for a different reason",https://www.drf.com,drf_news,2026-06-01 15:17
Gawler meeting transferred to Strathalbyn,https://www.racenet.com.au/news/south-australian-race-meeting-at-gawler-transferred-to-strathalbyn-20260602,racenet_news,2026-06-01 03:35
British trainer to shut stable after 'offer I couldn't refuse',https://www.racenet.com.au/news/british-trainer-james-ferguson-to-shut-stable-after-receiving-an-offer-i-couldnt-refuse-20260602,racenet_news,2026-06-02 03:35
Tips and rated prices for Kembla and Moree: $6.50 value bet,https://www.racenet.com.au/news/tips-and-rated-prices-for-kembla-and-moree-650-value-bet-20260601,racenet_news,2026-06-01 03:35
Group 1 Queensland Oaks field: Solid Gold backs up,https://www.racenet.com.au/news/final-field-and-barrier-draw-for-the-group-1-queensland-oaks-at-eagle-farm-20260601,racenet_news,2026-06-01 03:35
Stradbroke shock: Top contender Jimmysstar out of Group 1,https://www.racenet.com.au/news/stradbroke-shock-top-contender-jimmysstar-out-of-group-1-20260601,racenet_news,2026-06-02 03:35
Moonee Valley harness dream is officially over,https://www.racenet.com.au/news/harness-racing-wont-return-to-moonee-valley-as-part-of-redevelopment-20260601,racenet_news,2026-06-02 03:35
Hippo goes hungry in bid to taste more Group 1 glory,https://www.racenet.com.au/news/slow-and-steady-wins-the-race-for-adam-hyeronimus-as-he-works-to-ride-headley-grange-at-55kg-in-the-2026-stradbroke-handicap-20260601,racenet_news,2026-06-02 03:35
A father's last horse: Laing legacy continues at Flemington,https://www.racenet.com.au/news/el-soleado-returns-to-flemington-to-honour-late-trainer-robbie-laings-memory-20260601,racenet_news,2026-06-02 03:34
No Tragedies beaten this time at Kembla,https://www.racenet.com.au/news/kembla-grange-tuesday-preview-no-tragedies-beaten-this-time-for-gary-portellitrained-filly-20260601,racenet_news,2026-06-01 03:35
Sweeneys eye milestone at Moree,https://www.dailytelegraph.com.au,daily_telegraph,2026-06-01 07:27
"Quinté+ du mardi 2 juin : Tamyz, ça coule de source (Quinté+ for Tuesday, June 2: Tamyz, it's a sure thing)",https://www.equidia.fr/articles/quinte/quinte-du-mardi-2-juin-tamyz-ca-coule-de-source,equidia_racing,Publié il y a 15 heures
"Le conseil de jeu de Maxime Bourrat pour le Pick 5 de ce mardi 2 juin à Saint-Cloud (R1C8 - 18h08) (Maxime Bourrat's betting advice for the Pick 5 on Tuesday, June 2 at Saint-Cloud (R1C8 - 6:08 PM))",https://www.equidia.fr/articles/pour-preparer-vos-paris/le-conseil-de-jeu-de-maxime-bourrat-pour-le-pick-5-de-ce-mardi-2-juin-a-saint-cloud-r1c8-18h08,equidia_racing,Publié il y a 7 heures
"Les repérés en piste pour le mardi 2 juin (The identified horses on the track for Tuesday, June 2)",https://www.equidia.fr/articles/pour-preparer-vos-paris/les-reperes-en-piste-pour-le-mardi-2-juin,equidia_racing,Publié il y a 12 heures
"Les 5 pénos du mardi 2 juin (The 5 Picks for Tuesday, June 2)",https://www.equidia.fr/articles/pour-preparer-vos-paris/les-5-penos-du-mardi-2-juin,equidia_racing,Publié il y a 12 heures
"Faites le papier du Quinté+ de ce mardi 2 juin (Study the form for Tuesday, June 2's Quinté+)",https://www.equidia.fr/articles/pour-preparer-vos-paris/faites-le-papier-du-quinte-de-ce-mardi-2-juin,equidia_racing,Publié il y a 13 heures
"Les pronostics des experts pour la réunion 1 à SAINT-CLOUD ce mardi 2 juin (Expert predictions for Meeting 1 at SAINT-CLOUD this Tuesday, June 2)",https://www.equidia.fr/articles/pour-preparer-vos-paris/les-pronostics-des-experts-pour-la-reunion-1-a-saint-cloud-ce-mardi-2-juin,equidia_racing,Publié il y a 13 heures
"Les 3 tuyaux du Quinté+ de ce mardi 1er juin à Saint-Cloud (The 3 hot tips for Quinté+ this Tuesday, June 1st at Saint-Cloud)",https://www.equidia.fr/articles/pour-preparer-vos-paris/les-3-tuyaux-du-quinte-de-ce-mardi-1er-juin-a-saint-cloud,equidia_racing,Publié il y a 13 heures
"Arrivée et rapports du Quinté+ du lundi 1er juin : Imperator d'Em s'impose d'entrée de jeu pour son nouvel entraînement (Quinté+ arrival and dividends for Monday, June 1st: Imperator d'Em wins on his debut for his new trainer)",https://www.equidia.fr/articles/retour-sur-les-courses/template-article-post-quinte-du-lundi-01-juin,equidia_racing,Publié il y a 15 heures
"Daniel Redén sur Allegiant : ""Elle est incroyable ! Aujourd'hui, c'est un rêve qui se réalise !"" (Daniel Redén on Allegiant: ""She is incredible! Today, a dream comes true!"")",https://www.equidia.fr/articles/retour-sur-les-courses/daniel-reden-sur-allegiant-elle-est-incroyable-aujourdhui-cest-un-reve-qui-se-realise,equidia_racing,Publié hier
"Tamyz, la base solide du Quinté+ du mardi 2 juin (Tamyz, the solid favorite for Tuesday, June 2's Quinté+)",https://www.equidia.fr/articles/actualite/tamyz-la-base-solide-du-quinte-du-mardi-2-juin,equidia_racing,Publié il y a 8 heures
"3 pros analysent leurs chances dans le Quinté+ de ce lundi 1er juin à Vichy (3 pros analyze their chances in Monday, June 1st's Quinté+ at Vichy)",https://www.equidia.fr/articles/actualite/3-pros-analysent-leurs-chances-dans-le-quinte-de-ce-lundi-1er-juin-a-vichy,equidia_racing,Publié il y a 23 heures
"Indian Pacific, la base solide du Quinté+ du lundi 1er juin (Indian Pacific, the solid favorite for Monday, June 1st's Quinté+)",https://www.equidia.fr/articles/actualite/indian-pacific-la-base-solide-du-quinte-du-lundi-1er-juin,equidia_racing,Publié hier
"Agenda de la semaine (1er au 7 juin) : retour de Calandagan à Epsom, direction Laval pour le Grand National du Trot et un gros samedi à Vincennes avec le Chambon P (Weekly agenda (June 1st to 7th): Calandagan's return to Epsom, heading to Laval for the Grand National du Trot and a big Saturday at Vincennes with the Chambon P)",https://www.equidia.fr/articles/actualite/agenda-de-la-semaine-1er-au-7-juin-retour-de-calandagan-a-epsom-direction-laval-pour-le-grand-national-du-trot-et-un-gros-samedi-a-vincennes-avec-le-chambon-p,equidia_racing,Publié hier
"Track Test Quinté du mardi 2 juin : Hungry Heart, ""flashé"" à haute vitesse à La Cépière (Quinté Track Test for Tuesday, June 2: Hungry Heart, timed at high speed at La Cépière)",https://www.equidia.fr/articles/pour-preparer-vos-paris/track-test-quinte-du-mardi-2-juin-hungry-heart-flashe-a-haute-vitesse-a-la-cepiere,equidia_racing,Publié il y a 15 heures
"Le Quinté+ du mardi 2 juin vu par les statistiques (Tuesday, June 2's Quinté+ seen by statistics)",https://www.equidia.fr/articles/pour-preparer-vos-paris/le-quinte-du-mardi-2-juin-vu-par-les-statistiques,equidia_racing,Publié il y a 15 heures
"Les trois belles cotes de ce lundi 1er juin (The three good odds for this Monday, June 1st)",https://www.equidia.fr/articles/pour-preparer-vos-paris/les-trois-belles-cotes-de-ce-lundi-1er-juin,equidia_racing,Publié il y a 18 heures
"L'analyse des cotes du Quinté+ du lundi 1er Juin (Odds analysis for Monday, June 1st's Quinté+)",https://www.equidia.fr/articles/pour-preparer-vos-paris/lanalyse-des-cotes-du-quinte-du-lundi-1er-juin,equidia_racing,Publié il y a 19 heures
"Les 4 infos incontournables de la R1 à Vichy ce lundi 1er juin (The 4 essential insights for R1 at Vichy this Monday, June 1st)",https://www.equidia.fr/articles/pour-preparer-vos-paris/les-4-infos-incontournables-de-la-r1-a-vichy-ce-lundi-1er-juin,equidia_racing,Publié il y a 20 heures
"Goldy Smile, l'outsider séduisant du Quinté+ du lundi 1er juin (Goldy Smile, the attractive outsider for Monday, June 1st's Quinté+)",https://www.equidia.fr/articles/pour-preparer-vos-paris/goldy-smile-loutsider-seduisant-du-quinte-du-lundi-1er-juin,equidia_racing,Publié il y a 20 heures
"Equidia met le feu au Quinté+ du lundi 1er juin à Vichy (Equidia creates buzz for Monday, June 1st's Quinté+ at Vichy)",https://www.equidia.fr/articles/pour-preparer-vos-paris/equidia-met-le-feu-au-quinte-du-lundi-1er-juin-a-vichy,equidia_racing,Publié il y a 21 heures
