title,link,time,source
Trainer stunned at betting drift for Tatt's Tiara hope,https://www.racenet.com.au/news/overlooked-and-underestimated-rob-heathcotetrained-aboundings-shot-at-group-1-glory-in-2026-tattersalles-tiara-at-eagle-farm-20260626,2026-06-26 01:56,racenet_news
'We will show them who was here first!': Apprentices duel resumes,https://www.racenet.com.au/news/we-will-show-them-who-was-here-first-apprentices-duel-resumes-at-caulfield-20260626,2026-06-25 02:56,racenet_news
"Group 1 Tatt's Tiara runner-by-runner form analysis, tips",https://www.racenet.com.au/news/jett-hattons-runnerbyrunner-analysis-for-the-2026-group-1-tattersalls-tiara-20260624,2026-06-25 02:56,racenet_news
"Tamworth, Canberra Acton tips, rated prices: $11 value bet",https://www.racenet.com.au/news/greg-polsons-best-bets-racebyrace-tips-and-rated-prices-for-tamworth-canberra-acton-on-friday-june-26-2026-20260625,2026-06-25 02:56,racenet_news
Banned driver wins legal fight against Harness Racing NSW,https://www.dailytelegraph.com.au,2026-06-24 20:28,daily_telegraph
"Quinté+ du vendredi 26 juin à Enghien : Florida Bi évolue en retard de gains (Quinté+ for Friday, June 26, at Enghien: Florida Bi overdue for a win)",https://www.equidia.fr/articles/quinte/template-article-quinte-du-vendredi-26-juin,Publié il y a 8 heures,equidia_racing
"Les pronostics des experts pour la réunion 1 à ENGHIEN ce vendredi 26 juin (Expert tips for Meeting 1 at Enghien this Friday, June 26)",https://www.equidia.fr/articles/pour-preparer-vos-paris/les-pronostics-des-experts-pour-la-reunion-1-a-enghien-ce-vendredi-26-juin,Publié il y a 6 heures,equidia_racing
Vendredi à Enghien - Prix Guillaume de Bellaigue (Gr. 3) : Analyse et conseil de jeu (Friday at Enghien - Prix Guillaume de Bellaigue (Group 3): Analysis and Betting Advice),https://www.equidia.fr/articles/pour-preparer-vos-paris/vendredi-a-enghien-prix-guillaume-de-bellaigue-gr-3-analyse-et-conseil-de-jeu,Publié il y a 9 heures,equidia_racing
"Quinté+ du vendredi 26 juin à Enghien : Analyse et décryptage de la course de réf (Quinté+ for Friday, June 26, at Enghien: Analysis and Breakdown of the Feature Race)",https://www.equidia.fr/articles/pour-preparer-vos-paris/quinte-du-vendredi-26-juin-a-enghien-analyse-et-decryptage-de-la-course-de-ref,Publié il y a 10 heures,equidia_racing
"Le Quinté+ du vendredi 26 juin vu par les statistiques (The Quinté+ for Friday, June 26: A Statistical Outlook)",https://www.equidia.fr/articles/pour-preparer-vos-paris/le-quinte-du-vendredi-26-juin-vu-par-les-statistiques,Publié il y a 10 heures,equidia_racing
"Quinté Express : Analyse du Quinté+ du vendredi 26 juin (Quinté Express: Analysis of the Quinté+ for Friday, June 26)",https://www.equidia.fr/articles/pour-preparer-vos-paris/quinte-express-analyse-du-quinte-du-vendredi-26-juin,Publié il y a 10 heures,equidia_racing
"Les repérés en piste pour le vendredi 26 juin (Horses to Watch for Friday, June 26)",https://www.equidia.fr/articles/pour-preparer-vos-paris/les-reperes-en-piste-pour-le-vendredi-26-juin,Publié il y a 11 heures,equidia_racing
Arrivée et rapports du Quinté+ : L'As de Saint Jean a mis le feu (Quinté+ Result and Payouts: L'As de Saint Jean Lit Up the Track),https://www.equidia.fr/articles/retour-sur-les-courses/arrivee-et-rapports-du-quinte-las-de-saint-jean-a-mis-le-feu,Publié il y a 7 heures,equidia_racing
"Arrivée et rapports du Quinté+ du mercredi 24 juin : Insert Boy par le plus court des chemins (Quinté+ Result and Payouts for Wednesday, June 24: Insert Boy Won by the Shortest Path)",https://www.equidia.fr/articles/retour-sur-les-courses/arrivee-et-rapports-du-quinte-du-mercredi-24-juin-insert-boy-par-le-plus-court-des-chemins,Publié hier,equidia_racing
"Florida Bi, la base solide du Quinté+ du vendredi 26 juin (Florida Bi, the Solid Banker for the Quinté+ on Friday, June 26)",https://www.equidia.fr/articles/actualite/florida-bi-la-base-solide-du-quinte-du-vendredi-26-juin,Publié il y a 7 heures,equidia_racing
"Réunion 1 de La Teste-de-Buch annulée : le Quinté+ de ce jeudi 25 juin est délocalisé à Laval (La Teste-de-Buch Meeting 1 Cancelled: This Thursday, June 25 Quinté+ Moved to Laval)",https://www.equidia.fr/articles/actualite/reunion-1-de-la-teste-de-buch-annulee-le-quinte-de-ce-jeudi-25-juin-est-delocalise-a-laval,Publié il y a 20 heures,equidia_racing
France Galop ouvre la voie aux hongres dans le Qatar Prix de l’Arc de Triomphe (France Galop Paves the Way for Geldings in the Qatar Prix de l’Arc de Triomphe),https://www.equidia.fr/articles/actualite/france-galop-ouvre-la-voie-aux-hongres-dans-le-qatar-prix-de-larc-de-triomphe,Publié hier,equidia_racing
"Entrainement et canicule, l’adaptabilité est de mise à Chantilly (Training in the Heatwave: Adaptability is Key at Chantilly)",https://www.equidia.fr/articles/actualite/entrainement-et-canicule-ladaptabilite-est-de-mise-a-chantilly,Publié hier,equidia_racing
"Les 5 pénos du vendredi 26 juin (The 5 Top Picks for Friday, June 26)",https://www.equidia.fr/articles/pour-preparer-vos-paris/les-5-penos-du-vendredi-26-juin,Publié il y a 11 heures,equidia_racing
"Faites le papier du Quinté+ de ce vendredi 26 juin (Study the Form for this Friday, June 26 Quinté+)",https://www.equidia.fr/articles/pour-preparer-vos-paris/faites-le-papier-du-quinte-de-ce-vendredi-26-juin,Publié il y a 12 heures,equidia_racing
"Les 3 tuyaux du Quinté+ de ce vendredi 26 juin à Enghien (The 3 Hot Tips for this Friday, June 26 Quinté+ at Enghien)",https://www.equidia.fr/articles/pour-preparer-vos-paris/les-3-tuyaux-du-quinte-de-ce-vendredi-26-juin-a-enghien,Publié il y a 12 heures,equidia_racing
"L'analyse des cotes du Quinté+ du jeudi 25 juin (Odds Analysis for the Quinté+ on Thursday, June 25)",https://www.equidia.fr/articles/pour-preparer-vos-paris/lanalyse-des-cotes-du-quinte-du-jeudi-25-juin,Publié il y a 15 heures,equidia_racing
"Les 3 tuyaux du Quinté+ de ce jeudi 25 juin à Laval (The 3 Hot Tips for this Thursday, June 25 Quinté+ at Laval)",https://www.equidia.fr/articles/pour-preparer-vos-paris/les-3-tuyaux-du-quinte-de-ce-jeudi-25-juin-a-laval,Publié il y a 16 heures,equidia_racing
"Les trois belles cotes du jeudi 25 juin (The Three Best Value Bets for Thursday, June 25)",https://www.equidia.fr/articles/pour-preparer-vos-paris/les-trois-belles-cotes-du-jeudi-25-juin,Publié il y a 18 heures,equidia_racing
