title,link,source,time
'It took us a long time to rebuild' - Gordon Elliott says he has best string in nearly a decade as he readies powerful festival squad,https://www.racingpost.com/news/ireland/it-took-us-a-long-time-to-rebuild-gordon-elliott-says-he-has-best-string-in-nearly-a-decade-as-he-readies-powerful-festival-squad-ahoKJ9B8z5Cc/,racing_post,
'She looks out of the top drawer' - Tom Segal has a 10-1 selection in the mares' races at Cheltenham,https://www.racingpost.com/horse-racing-tips/premium-tips/ante-post-tips/she-looks-out-of-the-top-drawer-tom-segal-has-a-10-1-selection-in-the-mares-races-at-cheltenham-aU4Yr0M9PfsG/,racing_post,
WATCH: Johnny Dineen has a 20-1 Cheltenham tip as he and David Jennings continue the festival countdown,https://www.racingpost.com/video/upping-the-ante/watch-johnny-dineen-and-david-jennings-answer-the-big-questions-with-just-a-month-to-go-until-cheltenham-and-johnny-has-a-20-1-tip-for-the-handicaps-a3LK92K8PW0u/,racing_post,
From the Grand National to 500km across Patagonia - Gold Cup-winning rider to take on challenge dubbed 'ultimate test of horse and jockey',https://www.racingpost.com/news/britain/from-the-grand-national-to-500km-across-patagonia-gold-cup-winning-rider-to-take-on-challenge-dubbed-ultimate-test-of-horse-and-jockey-at0af6V2fs04/,racing_post,
Dragons' Den: start-ups offer glimpse of the future for British racing at London event,https://www.racingpost.com/news/britain/dragons-den-start-ups-offer-glimpse-of-the-future-for-british-racing-at-london-event-aGNx98K3bqlO/,racing_post,
'She's got bags of speed and she's very talented - hopefully we can have her in tip-top shape at Cheltenham',https://www.racingpost.com/news/features/stable-tours/shes-got-bags-of-speed-and-shes-very-talented-hopefully-we-can-have-her-in-tip-top-shape-at-cheltenham-argqm3v0jgdJ/,racing_post,
Entries for the Mares' Chase and Mares' Novices' Hurdle are made - plus find out who has been scratched from the festival Grade 1s,https://www.racingpost.com/news/festivals/cheltenham-festival/entries-for-the-mares-chase-and-mares-novices-hurdle-are-made-plus-find-out-who-has-been-scratched-from-the-festival-grade-1s-alW5x5I5OFjM/,racing_post,
'Illegal wagering is rampant' - Hong Kong Jockey Club chief in stark warning over 'exponential' black market growth,https://www.racingpost.com/news/international/illegal-wagering-is-rampant-hong-kong-jockey-club-chief-in-stark-warning-over-exponential-black-market-growth-aLSkq0i1isbX/,racing_post,
"The Asian Racing Conference in Riyadh: what is it, why is it important, and what are the key people saying?",https://www.racingpost.com/news/international/the-asian-racing-conference-in-riyadh-what-is-it-why-should-i-care-and-what-are-the-key-people-saying-aq6PP4W67jhF/,racing_post,
'This is a fine opportunity and can fuel Cheltenham ambitions' - Harry Wilson bids to follow up a 9-1 winner with four ante-post fancies,https://www.racingpost.com/horse-racing-tips/premium-tips/weekend-focus-harry-wilson/this-is-a-fine-opportunity-and-can-fuel-cheltenham-ambitions-harry-wilson-bids-to-follow-up-a-9-1-winner-with-four-ante-post-fancies-agmrY1q4j2dk/,racing_post,
Old v New: what the data really says about the two Cheltenham courses (and why it matters to punters),https://www.racingpost.com/news/features/the-form-hacker/old-v-new-what-the-data-really-says-about-the-two-cheltenham-courses-and-why-it-matters-to-punters-aFQqP1q3cldr/,racing_post,
Six horses ahead of their new ratings - including a final-flight faller who can gain compensation,https://www.racingpost.com/news/betting-insight/six-horses-who-are-ahead-of-their-new-ratings-including-one-who-should-be-well-up-to-scoring-off-her-mark-aoZHf0Y6lr5J/,racing_post,
Confessions of a semi-pro punter: what I’ve learned from 15 years of betting for (most of) my living,https://www.racingpost.com/news/opinion/ross-brierley/confessions-of-a-semi-pro-punter-what-ive-learned-from-15-years-of-betting-for-most-of-my-living-aHe9N4A4tTHx/,racing_post,
"3.51 Wetherby: festival favourite No Drama This End's form is tested - plus Dan Skelton unleashes €520,000 purchase for powerful new owner",https://www.racingpost.com/news/raceday-intel/festival-favourite-no-drama-this-ends-form-is-tested-plus-dan-skelton-unleashes-520000-purchase-for-powerful-new-owner-aG2Kc3v2pQpN/,racing_post,
'This might just be her day' - Graeme Rodway has two selections for Wednesday's action,https://www.racingpost.com/horse-racing-tips/premium-tips/top-tipsters/this-might-just-be-her-day-graeme-rodway-has-two-selections-for-wednesdays-action-aTVXs5T5D8Sw/,racing_post,
'A follow-up success looks firmly within reach' - Denis Harney with two tips at Dundalk on Wednesday,https://www.racingpost.com/horse-racing-tips/premium-tips/view-from-ireland/a-follow-up-success-looks-firmly-within-reach-denis-harney-with-two-tips-at-dundalk-on-wednesday-a9ghZ6M64tSA/,racing_post,
"Free horseracing tips for Wednesday, February 11 at Hereford, Southwell and Wetherby",https://www.racingpost.com/horse-racing-tips/todays-top-tips/free-horseracing-tips-for-wednesday-february-11-at-hereford-southwell-and-wetherby-aBD153e00cbz/,racing_post,
'It's our biggest and strongest Cheltenham team by a country mile - and I wouldn't swap this horse for anything',https://www.racingpost.com/news/features/stable-tours/its-our-biggest-and-strongest-cheltenham-team-by-a-country-mile-and-i-wouldnt-swap-this-horse-for-anything-al13f9L3Cdcl/,racing_post,
'He's rapid and we haven't had too many quicker than him at Cullentra over the years - it'll take a fair horse to beat him',https://www.racingpost.com/news/features/stable-tours/hes-rapid-and-we-havent-had-too-many-quicker-than-him-at-cullentra-over-the-years-itll-take-a-fair-horse-to-beat-him-aKVZf6y253zp/,racing_post,
Cheltenham Stable Tours return - and now is the perfect time to join Racing Post+ with 35% off for A WHOLE YEAR,https://www.racingpost.com/news/cheltenham-stable-tours-return-and-now-is-the-perfect-time-to-join-racing-post-with-35-off-for-a-whole-year-a1tp92H7rjPM/,racing_post,
"'They said I wasn't in enough pain' - shock as top jockey kept riding with a fractured back, and even nailed a winner",https://www.racingpost.com/news/britain/they-said-i-wasnt-in-enough-pain-shock-as-top-jockey-kept-riding-with-a-fractured-back-and-even-nailed-a-winner-aqn8K1b77xH8/,racing_post,
"Wetherby’s Wednesday meeting faces another raceday inspection, Clonmel to inspect ahead of Thursday's card",https://www.racingpost.com/news/britain/wetherbys-wednesday-meeting-faces-another-raceday-inspection-clonmel-to-inspect-ahead-of-thursdays-card-ag1hg3Z4leGR/,racing_post,
'We've got to roll the dice' - Grand National hopes on the line for Myretown with big weekend decision looming,https://www.racingpost.com/news/britain/weve-got-to-roll-the-dice-grand-national-hopes-on-the-line-for-myretown-with-big-weekend-decision-looming-a7UAE5h7Nfk5/,racing_post,
WATCH: The Constitution Hill dilemma,https://www.racingpost.com/video/the-front-page/watch-the-constitution-hill-dilemma-aXHlC0O9s0nE/,racing_post,
Who are the main contenders for the Supreme - and could a dark horse emerge before Cheltenham?,https://www.racingpost.com/news/festivals/cheltenham-festival/four-weeks-to-the-supreme-assessing-the-main-contenders-for-the-cheltenham-festival-opener-ad9b34H1tjmr/,racing_post,
'Whoever Paul Townend rides for Willie Mullins will go off single figures' - Paul Kealy picks out a Supreme contender,https://www.racingpost.com/video/in-the-know/whoever-paul-townend-rides-for-willie-mullins-will-go-off-single-figures-paul-kealy-picks-out-a-supreme-contender-aXANF5U5vDsE/,racing_post,
Ranked: who takes top spot on our list of the best chasers?,https://www.racingpost.com/news/festivals/cheltenham-festival/ranked-who-takes-top-spot-on-our-list-of-the-best-chasers-aOga91l3QLOf/,racing_post,
Limerick: 'I was waiting for them to come to me but they never did' - Jack Gilligan breaks 325-day drought on 25-1 front-runner,https://www.racingpost.com/news/reports/i-was-waiting-for-them-to-come-to-me-but-they-never-did-jack-gilligan-breaks-325-day-drought-on-25-1-front-runner-aI4Nj8e190dk/,racing_post,
Ayr: 'We’ll be heading to Cheltenham' - Apache Tribe halved to 25-1 for the Albert Bartlett after commanding hurdles debut,https://www.racingpost.com/news/reports/well-be-heading-to-cheltenham-apache-tribe-halved-to-25-1-for-the-albert-bartlett-after-commanding-hurdles-debut-aVMCU7c6hDLK/,racing_post,
Lingfield: Elements Of Fire hot stuff for Hollie Doyle and Hambleton Racing,https://www.racingpost.com/news/reports/im-lucky-as-ive-only-been-in-this-syndicate-for-two-weeks-elements-of-fire-strikes-under-hollie-doyle-on-first-run-for-new-owners-aiJur4Q2vARS/,racing_post,
"Wolverhampton: 'It’s been a long, frustrating road' - jockey Greg Fairley out of the wilderness with first winner since a 12-year ban",https://www.racingpost.com/news/reports/its-been-a-long-frustrating-road-jockey-greg-fairley-out-of-the-wilderness-with-first-winner-since-a-12-year-ban-aD6Q76f1Zf7w/,racing_post,
Irish Thoroughbred Industry Employee Awards deadline looming on Friday with nominations encouraged,https://www.racingpost.com/news/ireland/irish-thoroughbred-industry-employee-awards-deadline-looming-on-friday-with-nominations-encouraged-aO3Ha6E6lfzW/,racing_post,
Kopek Des Bordes 'squealing' after explosive schooling session - and owner predicts Lulamba might struggle to keep up in Arkle showdown,https://www.racingpost.com/news/ireland/kopek-des-bordes-squealing-after-explosive-schooling-session-and-owner-predicts-lulamba-might-struggle-to-keep-up-in-arkle-showdown-a7v5D2P4nLHt/,racing_post,
IHRB insists Redwood Queen investigation was 'thorough' despite it declining to avail of BHA assistance,https://www.racingpost.com/news/ireland/ihrb-insists-redwood-queen-investigation-was-thorough-despite-it-declining-to-avail-of-bha-assistance-aIz3C4M2jnlr/,racing_post,
Volunteer workforce must not be taken for granted as flooding fails to stop five meetings going ahead,https://www.racingpost.com/news/opinion/comment/volunteer-workforce-must-not-be-taken-for-granted-as-flooding-fails-to-stop-five-meetings-going-ahead-aBi5I8g06twB/,racing_post,
Volunteer workforce must not be taken for granted as flooding fails to stop five meetings going aheadVolunteer workforce must not be taken for granted as flooding fails to stop five meetings going ahead,https://www.racingpost.com/news/opinion/comment/volunteer-workforce-must-not-be-taken-for-granted-as-flooding-fails-to-stop-five-meetings-going-ahead-aBi5I8g06twB/,racing_post,
"As a key figure departs, can the success story of British Champions Day be a template for more bold change in racing?",https://www.racingpost.com/news/opinion/comment/as-a-key-figure-departs-can-the-success-story-of-british-champions-day-be-a-template-for-more-bold-change-in-racing-amPPk8x6kPsd/,racing_post,
"Frankie Dettori, a Covid bombshell and the most fraught silence I've known in four decades in journalism",https://www.racingpost.com/news/opinion/comment/frankie-dettori-a-covid-bombshell-and-the-most-fraught-silence-ive-known-in-four-decades-in-journalism-aozih4z8eQct/,racing_post,
'I've made a million mistakes' - Frankie Dettori recalls the highs and lows of his extraordinary career in a straight-talking interview,https://www.racingpost.com/news/features/the-big-read/ive-made-a-million-mistakes-frankie-dettori-recalls-the-highs-and-lows-of-his-extraordinary-career-in-a-straight-talking-interview-ayv1j6z0Ygat/,racing_post,
"Q&A: 'There’s a churn of trainers moving, dying, retiring, going skint. It’s a very hard game to get established in, and you need luck'",https://www.racingpost.com/news/features/interviews/theres-a-churn-of-trainers-moving-dying-retiring-going-skint.-its-a-very-hard-game-to-get-established-in-and-you-need-luck-aZHF71k1gyFY,racing_post,
'Everything came to a head and we needed to survive - but now the future looks very rosy',https://www.racingpost.com/news/features/interviews/everything-came-to-a-head-and-we-needed-to-survive-but-now-the-future-looks-very-rosy-aRmUh5D8UNqy/,racing_post,
"‘I thought I’d never replicate the buzz of riding a winner at Cheltenham, but this is way better’ - meet the finance high-flyer who conquered racing",https://www.racingpost.com/news/features/the-big-read/i-thought-id-never-replicate-the-buzz-of-riding-a-winner-at-cheltenham-but-this-is-way-better-meet-the-finance-high-flyer-who-conquered-racing-a6Nb03a7mc8X/,racing_post,
"Poker genius, visionary football chairman and pioneering data-led punter - the many (profitable) faces of Tony Bloom",https://www.racingpost.com/news/features/masters-of-betting/poker-genius-visionary-football-chairman-and-pioneering-data-led-punter-the-many-profitable-faces-of-tony-bloom-a0UWt2Y6DPmh/,racing_post,
"Introducing Masters of Betting, an unmissable series available now - read it all with 25% off RP+",https://www.racingpost.com/news/introducing-masters-of-betting-an-unmissable-series-next-week-in-the-racing-post-read-it-all-with-25-off-rp-aJKV17m1iNzx/,racing_post,
"'I was down £11,000 but you can't let that alter what you do' - meet one of the giants of on-course betting",https://www.racingpost.com/news/features/masters-of-betting/i-was-down-11000-but-you-cant-let-that-alter-what-you-do-meet-one-of-the-giants-of-on-course-betting-aXYs01f58AHh/,racing_post,
When science met punting: the godfather of modern-day betting and his golden rules that remain valid to this day,https://www.racingpost.com/news/features/masters-of-betting/when-science-met-punting-the-godfather-of-modern-day-betting-and-his-golden-rules-that-remain-valid-to-this-day-aO1b67N07bKR/,racing_post,
How a dodgy bank loan led to nearly 40 years as a pro punter - proving old-school methods still have their place,https://www.racingpost.com/news/features/masters-of-betting/how-a-dodgy-bank-loan-led-to-nearly-40-years-as-a-pro-punter-proving-old-school-methods-still-have-their-place-aKazg3g7sdy3/,racing_post,
Foot abscess rules John and Thady Gosden's rising Juddmonte star out of $2.5m contest on Saudi Cup card,https://www.racingpost.com/news/international/foot-abscess-rules-john-and-thady-gosdens-rising-juddmonte-star-out-of-2.5m-saudi-cup-apSk59g6JqGJ,racing_post,
Trainer Thomas Levesque guides Iroise De La Noe to an 11-1 success in the Prix de France,https://www.racingpost.com/news/international/focus-on-france/trainer-thomas-levesque-guides-iroise-de-la-noe-to-an-11-1-success-in-the-prix-de-france-agveP6C4IKiT/,racing_post,
Abu Dhabi: Strauss strings along his rivals as he leads Japan to Gold Cup glory over British and Irish challengers,https://www.racingpost.com/news/reports/strauss-strings-along-his-rivals-as-he-leads-japan-to-abu-dhabi-gold-cup-glory-over-british-and-irish-challengers-a8zss1j8wmcR/,racing_post,
Marco Botti hands Pierre-Charles Boudot a return to top table with Group 1 ride on Giavelotto,https://www.racingpost.com/news/international/marco-botti-hands-pierre-charles-boudot-a-return-to-top-table-with-group-1-ride-on-giavelotto-arC892w3BsRI/,racing_post,
Shock Coral Cup decision shows bookmakers are drawing a line - now racing waits nervously to see where it will fall,https://www.racingpost.com/news/opinion/comment/shock-coral-cup-decision-shows-bookmakers-are-drawing-a-line-now-racing-waits-nervously-to-see-where-it-will-fall-atEFm7l6luaT/,racing_post,
Government funding to tackle illegal gambling looks insufficient as evidence of black market growth mounts up,https://www.racingpost.com/news/opinion/comment/government-funding-to-tackle-illegal-gambling-looks-insufficient-as-evidence-of-black-market-growth-mounts-up-apqc93X3NVYT/,racing_post,
Political climate is increasingly harsh for bookmakers - and that may drive need for racing and betting to rebuild bridges,https://www.racingpost.com/news/opinion/comment/political-climate-is-increasingly-harsh-for-bookmakers-and-that-may-drive-need-for-racing-and-betting-to-rebuild-bridges-aJECc8J03sBI/,racing_post,
Ka Ying Rising wins trial ‘as you’d expect’ as Hayes looks to continue good run,https://www.scmp.com/sport/racing/article/3343002/ka-ying-rising-wins-barrier-trial-youd-expect-david-hayes-looks-continue-hot-streak,scmp_racing,2026-02-10 11:33
"Purton sticks with Sagacious Life, while Improvement settles in well in Saudi",https://www.scmp.com/sport/racing/article/3342928/zac-purton-sticks-sagacious-life-classic-cup-while-self-improvement-settles-well-saudi-arabia,scmp_racing,2026-02-09 17:30
Newnham fancies Valley duo in bid to extend trainers’ championship lead,https://www.scmp.com/sport/racing/article/3342894/mark-newnham-fancies-happy-valley-pair-bid-extend-trainers-championship-lead,scmp_racing,2026-02-09 14:34
Numbers counting down to Classic Cup and Derby after all-the-way Group Three win,https://www.scmp.com/sport/racing/article/3342835/numbers-counting-down-classic-cup-and-derby-after-all-way-group-three-romp-sha-tin,scmp_racing,2026-02-08 18:44
SCMP Best Bets: Tourbillon Golfer a hole in one at Happy Valley,https://www.scmp.com/sport/racing/article/3343099/scmp-best-bets-tourbillon-golfer-hole-one-happy-valley,scmp_racing,2026-02-10 22:00
Atzeni bags treble as Flow Water Flow boosts faint HK Derby hopes,https://www.scmp.com/sport/racing/article/3342836/andrea-atzeni-bags-treble-flow-water-flow-boosts-faint-hong-kong-derby-hopes,scmp_racing,2026-02-08 19:12
Lucky Ranger a smart one for Newnham as title fight with Hayes heats up,https://www.scmp.com/sport/racing/article/3342840/lucky-ranger-smart-one-mark-newnham-title-fight-david-hayes-heats,scmp_racing,2026-02-08 19:45
Whyte hopes Violet Star can enter Classic Series reckoning with Sha Tin win,https://www.scmp.com/sport/racing/article/3342780/douglas-whyte-hopes-violet-star-can-enter-classic-series-reckoning-sha-tin-win,scmp_racing,2026-02-07 21:02
Crawford fancies weight swing and return to Sha Tin for Encountered in G3 Vase,https://www.scmp.com/sport/racing/article/3342775/brett-crawford-fancies-weight-swing-and-return-sha-tin-encountered-centenary-vase,scmp_racing,2026-02-07 19:40
贏跑破天荒直播沙特盃,https://www.stheadline.com/realtime-racing/3543625/贏跑破天荒直播沙特盃,singtao_racing,2026-02-10 12:26 (17小時前)
梁家俊為「辣」系吳家建功,https://www.stheadline.com/realtime-racing/3543604/梁家俊為辣系吳家建功,singtao_racing,2026-02-10 11:26 (18小時前)
獨家猛料│「飛揚騅」馬主養馬運佳,https://www.stheadline.com/realtime-racing/3543601/獨家猛料飛揚騅馬主養馬運佳,singtao_racing,2026-02-10 11:26 (18小時前)
廖康銘「勁沙塵」「電源之駒」,https://www.stheadline.com/realtime-racing/3543488/廖康銘勁沙塵電源之駒,singtao_racing,2026-02-10 09:26 (20小時前)
潘頓晨課派曲奇禮盒,https://www.stheadline.com/realtime-racing/3543517/潘頓晨課派曲奇禮盒,singtao_racing,2026-02-10 07:26 (22小時前)
張敬山行善 葉楚航支持,https://www.stheadline.com/realtime-racing/3543513/張敬山行善-葉楚航支持,singtao_racing,2026-02-10 07:26 (22小時前)
第四十一屆亞洲賽馬會議 在沙特阿拉伯維雅德隆重揭幕,https://www.stheadline.com/realtime-racing/3543509/第四十一屆亞洲賽馬會議-在沙特阿拉伯維雅德隆重揭幕,singtao_racing,2026-02-10 06:26 (23小時前)
馬場浮世繪｜第四十一屆亞洲賽馬會議今展開 應家柏連任賽馬聯盟主席,https://www.stheadline.com/realtime-racing/3543505/馬場浮世繪第四十一屆亞洲賽馬會議今展開-應家柏連任賽馬聯盟主席,singtao_racing,2026-02-10 06:26 (23小時前)
艾兆禮「福星小子」「天火同德」,https://www.stheadline.com/realtime-racing/3543256/艾兆禮福星小子天火同德,singtao_racing,2026-02-11 05:26 (2026-02-09 18:04 HKT)
馬場浮世繪｜「青春永駐」沙特盃備受看好,https://www.stheadline.com/realtime-racing/3543228/馬場浮世繪青春永駐沙特盃備受看好,singtao_racing,2026-02-11 05:26 (2026-02-09 17:12 HKT)
「數字天文」勇奪百週年紀念銀瓶  劍指四歲馬經典賽事系列,https://www.stheadline.com/realtime-racing/3543021/數字天文勇奪百週年紀念銀瓶-劍指四歲馬經典賽事系列,singtao_racing,2026-02-11 05:26 (2026-02-09 00:08 HKT)
譚校長愛駒初配紀仁安,https://www.stheadline.com/realtime-racing/3542878/譚校長愛駒初配紀仁安,singtao_racing,2026-02-11 05:26 (2026-02-08 19:15 HKT)
李嘉欣愛駒由大潘變小潘,https://www.stheadline.com/realtime-racing/3542877/李嘉欣愛駒由大潘變小潘,singtao_racing,2026-02-11 05:26 (2026-02-08 19:00 HKT)
馬場密探048｜「細水長流」艾兆禮中三元,https://www.stheadline.com/realtime-racing/3542949/馬場密探048細水長流艾兆禮中三元,singtao_racing,2026-02-11 05:26 (2026-02-08 18:18 HKT)
馬場浮世繪│希斯「榮利雙收」,https://www.stheadline.com/realtime-racing/3542947/馬場浮世繪希斯榮利雙收,singtao_racing,2026-02-11 05:26 (2026-02-08 18:09 HKT)
馬場密探048｜「會當凌」再下一城,https://www.stheadline.com/realtime-racing/3542943/馬場密探048會當凌再下一城,singtao_racing,2026-02-11 05:26 (2026-02-08 17:52 HKT)
馬場浮世繪│加眼罩後「全神貫注」,https://www.stheadline.com/realtime-racing/3542924/馬場浮世繪加眼罩後全神貫注,singtao_racing,2026-02-11 05:26 (2026-02-08 17:50 HKT)
馬場密探048｜「錶之極光」今季第三捷,https://www.stheadline.com/realtime-racing/3542937/馬場密探048錶之極光今季第三捷,singtao_racing,2026-02-11 05:26 (2026-02-08 17:30 HKT)
馬場密探048｜「數字天文」大熱捧銀瓶,https://www.stheadline.com/realtime-racing/3542925/馬場密探048數字天文大熱捧銀瓶,singtao_racing,2026-02-11 05:26 (2026-02-08 17:16 HKT)
馬場密探048｜「閃耀天河」後上補中,https://www.stheadline.com/realtime-racing/3542920/馬場密探048閃耀天河後上補中,singtao_racing,2026-02-11 05:26 (2026-02-08 16:26 HKT)
〝個性派〟バビットは京都記念がラストラン 浜田調教師「とにかく無事に。応援よろしくお願いします」,https://news.google.com/rss/articles/CBMiVEFVX3lxTE5QYkFLSWc4dVVpdVFWWHVDaTNSclhDMkE4VHktSG4zcHJINF9LS0VDSGR5Y1VWeF8xNHZXUzZlNWpsVFlVeVN1Mk1XNTA1WHdvLTZUZA?oc=5,tospo_keiba,2026-02-11 01:01
国枝調教師に〝ダメ出し〟してきた馬がいた！「非常に強烈でした」藤沢和雄元調教師と対談イベント,https://news.google.com/rss/articles/CBMiVEFVX3lxTE1vZFVtNC04cWJSYTlzX0dJT3ZpQXJ4YlFWSUZqdEdWRXlUZy1lNXFZWXVyZDd2QWJwYVROYkdaSkF2NG5SdXQ3VkJXNDh3eEZZajFraw?oc=5,tospo_keiba,2026-02-11 03:22
【東京新聞杯】ウォーターリヒトは直線の不利で連覇ならず3着 高杉吏麒「大きな接触もあった影響が…」,https://news.google.com/rss/articles/CBMiVEFVX3lxTE9kNUozYjFiUzR5OUZLc1NMMWwwbFIyNlVITWp4V2w4QWQtNVpPWVVROGNWVlp1YzdwMlB3MXRQSFR2ZHBEd2Q4MWdvYzFaQVF5NHJMWg?oc=5,tospo_keiba,2026-02-10 08:39
【サウジC】フォーエバーヤングは3年連続のサウジ遠征で「馬自身が競馬が近いことを分かっている」,https://news.google.com/rss/articles/CBMiVEFVX3lxTE04VzY2U2hLdzBvV1MzSXY3YnBOM2diLUY5T3pqWGl2dHRIR0tJS1pnZUdlTUhIMUtNdUlCQjRMdm9icElKQ0EtT0l3UG9xTndNWjV3aw?oc=5,tospo_keiba,2026-02-10 09:48
【東京新聞杯】トロヴァトーレが見せた進化にルメールも驚き！「僕が乗った中で初めての反応」,https://news.google.com/rss/articles/CBMiVEFVX3lxTFBIUzV6MG9LMHZ2Rmo3eEtPN3Rpc1ZCeW8zTTlYdkdMU0QzOE5yQU02cEhESnJQNE5hTGpjLUxnbG9vWnY5bUYzeGlpenFVc01sbEdoUg?oc=5,tospo_keiba,2026-02-10 09:05
【ネオムターフC追い切り】ヤマニンブークリエがあえて気温上昇の時間帯に調教を行った「理由」,https://news.google.com/rss/articles/CBMiVEFVX3lxTE9uT0VnRGJJWEhiaDdOcnVfRHhrSm9QeWlrQTlyQURHa0hRT0oweTF4N2NuM29aM0tVUlg1WTBrQ1RJZEVMSURFb2NpZHF5M1N3dU12cg?oc=5,tospo_keiba,2026-02-10 10:21
【東京新聞杯・1番人気なぜ負けた】エルトンバローズは13着 津村明秀「申し訳ないです」の理由,https://news.google.com/rss/articles/CBMiVEFVX3lxTE1DZG1oZFA3TElIZ05KeXdGdS1mT29LVFFUOU9KZDJaV0FaVGUyZWIydWhiLXA3bkRwUnB0U0pTYk10WFdaQ2RCeWptN3hWUDZfNjA3eQ?oc=5,tospo_keiba,2026-02-10 08:48
【きさらぎ賞結果＆コメント】ゾロアストロ待望の重賞初V ハマーハンセン「波に乗るといい脚を…」,https://news.google.com/rss/articles/CBMiVEFVX3lxTE53QXFWSVBuQnYxdHlvNHllZlhKNUVGakg5dk12a0ZmNUdNTnRjdDNRQ25fa1R0QVRWUEU5ZVhkUDZFTHh4ZldRTTJmWE5qMVhfWUtXcA?oc=5,tospo_keiba,2026-02-10 08:22
1番人気ステラデルークスが5馬身差V 母の産駒では10頭目のJRA勝利【3歳新馬・東京4R】,https://news.google.com/rss/articles/CBMiVEFVX3lxTE5MazZhbUJ5RDNNMGQ1cnluUGY1ZmhqNUZaMFdMYlR5TlBpYUU5aDFwZldVSXVZT3ozWDZfM2MzWXpXTURpUEN3czgzdkpleXIyVUJjaA?oc=5,tospo_keiba,2026-02-10 03:27
【共同通信杯・耳より】巻き返し図るリアライズシリウス「1度使われたこの中間は動きが違います」,https://news.google.com/rss/articles/CBMiVEFVX3lxTFBPM1dhREYxZklnR0VnVDRrNTR3RjRsQ0F1RlBPRTB0OWhyQmdqaGJRdVJDQW9ZNGRBUjF1X0hEM1EwdXZuMGlncENjcW4wb0N0YVBwYw?oc=5,tospo_keiba,2026-02-10 11:00
【京都記念展望】天皇賞馬ヘデントールが復帰戦で菊花賞2着馬対決へ 昨年の覇者＆上がり馬も注目,https://news.google.com/rss/articles/CBMiVEFVX3lxTE9LbFdnekRWT0xmajNFYWtKRTliZ0pWN1hWdGFsbXZiRFNzZlNBaldIeXBOcV9VWjQ3czYzZGZ3MUE5U1I2Rk1EaGFDSjhxMzlxQjlKcA?oc=5,tospo_keiba,2026-02-10 09:55
【ネオムターフC追い切り】連覇狙うシンエンペラーは単走追い「時季なのか気候なのか、ずっといいですね」,https://news.google.com/rss/articles/CBMiVEFVX3lxTE1HOXpLNmdnd19wX2hTWnA0dkxPZHBZRkpVZ3RweS1IZ2dtV2J6eWJET3NId2ltbUdzc3hWS2FmZ3ZEZUlqTDNXUUpfU2tRenJqM1kwYw?oc=5,tospo_keiba,2026-02-10 10:47
