title,link,source,time
"Black market bookies took bets from accounts registered in names of top jockeys . . . and Constitution Hill, expose reveals",https://www.racingpost.com/news/britain/black-market-bookies-took-bets-from-accounts-registered-in-names-of-top-jockeys-.-.-.-and-constitution-hill-expose-reveals-ayu3f7Y8CqSn,racing_post,
Chelmsford future in major doubt and Good Friday card cancelled after course loses licence to host fixtures,https://www.racingpost.com/news/britain/chelmsford-fixtures-cancelled-throwing-racecourses-future-into-huge-doubt-awMZR9i3VAK3/,racing_post,
'It's all systems go for the Guineas and it's very exciting - he's undoubtedly the best colt we've trained',https://www.racingpost.com/news/features/stable-tours/its-all-systems-go-for-the-guineas-and-its-very-exciting-hes-undoubtedly-the-best-colt-weve-trained-aaWqA9l5foF9/,racing_post,
'It's absolutely disgraceful' - trainers and jockeys slam late decision to cancel Chelmsford's fixtures after track loses licence,https://www.racingpost.com/news/britain/its-absolutely-disgraceful-trainers-and-jockeys-slam-late-decision-to-cancel-chelmsfords-fixtures-after-track-loses-licence-a4Y3q3w7EipW/,racing_post,
Chelmsford City: rollercoaster ride for the Essex track which started life as Great Leighs,https://www.racingpost.com/news/britain/chelmsford-city-rollercoaster-ride-for-the-essex-track-which-started-life-as-great-leighs-aa51D5g75SvP/,racing_post,
All races from Cheltenham's April meetings to be rescheduled and run at original prize-money levels after backlash from trainers,https://www.racingpost.com/news/britain/all-races-from-cheltenhams-april-meetings-to-be-rescheduled-and-run-at-original-prize-money-levels-after-backlash-from-trainers-a8LYo3l4udv4/,racing_post,
Colin Keane in Newmarket for the first time this year as top rider links up with Juddmonte stars Field Of Gold and Publish,https://www.racingpost.com/news/britain/colin-keane-in-newmarket-for-the-first-time-this-year-as-top-rider-links-up-with-juddmonte-stars-field-of-gold-and-publish-aLwAk2e00321/,racing_post,
'We're living every syndicate member's dream' - Cheltenham Festival hero and bargain buy to bid for Grand National glory,https://www.racingpost.com/news/festivals/grand-national-festival/were-living-every-syndicate-members-dream-cheltenham-festival-hero-and-bargain-buy-to-bid-for-grand-national-glory-aMaZT1v73nw1/,racing_post,
Jonjo O'Neill among trainers excited about potential return of racing at Towcester,https://www.racingpost.com/news/britain/jonjo-oneill-among-trainers-excited-about-potential-return-of-racing-at-towcester-aOxl54F0266T/,racing_post,
Willie Mullins might have waved the white flag in Britain - but his familiar surge means it's game on in two Irish title races,https://www.racingpost.com/news/opinion/comment/willie-mullins-might-have-waved-the-white-flag-in-britain-but-his-familiar-surge-means-its-game-on-in-two-irish-title-races-amSIU3y1mafz/,racing_post,
The three steps to punting profit - and why it’s the last and most straightforward step where most people slip up,https://www.racingpost.com/news/opinion/comment/the-three-steps-to-punting-profit-and-why-its-the-last-and-most-straightforward-step-where-most-people-slip-up-aEPgR2b4mgMk/,racing_post,
I'm expecting more success for Britain in the Irish Grand National - plus why it's far too early to give up on Albert Einstein,https://www.racingpost.com/news/opinion/comment/im-expecting-more-success-for-britain-in-the-irish-grand-national-plus-why-its-far-too-early-to-give-up-on-albert-einstein-ar0NA9Q0ZZLB/,racing_post,
'It will be a surprise if he doesn't turn out to be incredibly well handicapped' - Paul Kealy with five weekend tips,https://www.racingpost.com/news/opinion/comment/it-will-be-a-surprise-if-he-doesnt-turn-out-to-be-incredibly-well-handicapped-paul-kealy-with-five-weekend-tips-aOzND3i3qRxD/,racing_post,
3.32 Chepstow: Classy Moore chaser sets standard as Cheltenham runners clash in highly competitive handicap,https://www.racingpost.com/news/raceday-intel/classy-moore-chaser-sets-standard-as-cheltenham-runners-clash-in-highly-competitive-chepstow-handicap-aoo7R5M9SJNP/,racing_post,
'We should see what he's really capable of' - Paul Kealy with two Thursday picks,https://www.racingpost.com/horse-racing-tips/premium-tips/we-should-see-what-hes-really-capable-of-paul-kealy-with-two-thursday-picks-a1NBd4A5e9fY/,racing_post,
Paul Kealy's play of the day at Chepstow,https://www.racingpost.com/horse-racing-tips/play-of-the-day/paul-kealys-play-of-the-day-at-chepstow-aMiwD9g8hMDn/,racing_post,
"Free horseracing tips for Thursday, April 2 at Chepstow, Kelso and Southwell",https://www.racingpost.com/horse-racing-tips/todays-top-tips/free-horseracing-tips-for-thursday-april-2-at-chepstow-kelso-and-southwell-aB9w71C1D7TO/,racing_post,
"Constitution Hill, Billy Loughnane and Yorkshire Glory - the season that put the 'all' in all-weather",https://www.racingpost.com/news/opinion/comment/constitution-hill-billy-loughnane-and-yorkshire-glory-the-season-that-put-the-all-in-all-weather-aLv373y332wu/,racing_post,
'I couldn't be happier with him' - The Real Whacker pleasing in Grand National build-up with replacement jockey secured,https://www.racingpost.com/news/festivals/grand-national-festival/i-couldnt-be-happier-with-him-the-real-whacker-pleasing-in-grand-national-build-up-with-replacement-jockey-secured-aLMnj0Q4Riwx/,racing_post,
Australian racing governing bodies step in to offer relief packages as fuel crisis from Middle East war bites,https://www.racingpost.com/news/international/australian-racing-governing-bodies-step-in-to-offer-relief-packages-as-fuel-crisis-from-middle-east-war-bites-aLF3l7c5vhPs/,racing_post,
The fresh factor: which horses skipped the Cheltenham Festival in favour of Aintree's Grand National meeting?,https://www.racingpost.com/news/festivals/grand-national-festival/the-fresh-factor-which-horses-skipped-the-cheltenham-festival-in-favour-of-aintrees-grand-national-meeting-aNB7U0R7Q0qJ/,racing_post,
Wincanton: Broomfields Cave registers second successive course win on return to the West Country,https://www.racingpost.com/news/reports/broomfields-cave-registers-second-successive-course-win-on-return-to-the-west-country-a0ehd5f1WOH3/,racing_post,
Southwell: 'It's not something a stable jockey does very often' - Sean Bowen and Olly Murphy hit a century of winners for the season with a treble,https://www.racingpost.com/news/reports/its-not-something-a-stable-jockey-does-very-often-sean-bowen-and-olly-murphy-hit-a-century-of-winners-for-the-season-with-a-treble-a6VCN6o50j5K/,racing_post,
'It was well into a five-figure payout' - DragonBet take biggest hit since online launch after multiples including Dan Skelton four-timer land,https://www.racingpost.com/news/reports/the-payout-would-be-in-five-figures-paddy-power-fearing-multiples-on-dan-skelton-quartet-after-first-two-horses-win-at-bangor-axzGL0Y4DmsZ/,racing_post,
Sedgefield: Course specialist Clean Getaway delivers for trainer and owner Phil Kirby,https://www.racingpost.com/news/reports/course-specialist-clean-getaway-delivers-for-trainer-and-owner-phil-kirby-aWelh4e3RJtW/,racing_post,
William Hill set to close around 200 betting shops as parent company acts following tax increases in budget,https://www.racingpost.com/news/britain/william-hill-set-to-close-around-200-betting-shops-as-parent-company-acts-following-tax-increases-in-budget-aOrTi5C5nc0A/,racing_post,
"How betting tax rises have hit home - and what the future impact may be for racing, the betting industry and punters",https://www.racingpost.com/news/britain/how-betting-tax-rises-have-hit-home-and-what-the-future-impact-may-be-for-racing-the-betting-industry-and-punters-aqChB4s0S7D6/,racing_post,
New campaign to highlight impact of affordability checks on punters and the sport set to launch,https://www.racingpost.com/news/britain/british-racing-to-launch-new-campaign-highlighting-impact-of-affordability-checks-to-punters-and-the-sport-am6cJ7D5XFTy/,racing_post,
Cheltenham determined to 'work with annual members' to ensure fair treatment in the wake of fixture losses,https://www.racingpost.com/news/britain/cheltenham-determined-to-work-with-annual-members-to-ensure-fair-treatment-in-the-wake-of-fixture-losses-aat6Z7H7y0sP/,racing_post,
'We're hoping to attract a new sort of customer' - free entry at the Curragh on Good Friday as history is made in Ireland,https://www.racingpost.com/news/ireland/were-hoping-to-attract-a-new-sort-of-customer-free-entry-at-the-curragh-on-good-friday-as-history-is-made-in-ireland-aW5iF8A9Hos3/,racing_post,
"Aidan O'Brien reveals plan to supplement Gstaad and Albert Einstein for 2,000 Guineas after both colts are mistakenly scratched",https://www.racingpost.com/news/festivals/guineas-festival/2000-guineas-market-in-turmoil-after-top-aidan-obrien-colts-gstaad-and-albert-einstein-mistakenly-scratched-from-race-a4j1w7O76BXV/,racing_post,
Ladbrokes to close 39 betting shops in Ireland with more than 200 jobs at risk,https://www.racingpost.com/news/ireland/ladbrokes-to-close-39-betting-shops-in-ireland-with-more-than-200-jobs-at-risk-alPTr0d1pwO6/,racing_post,
Patrick Mullins keen on Closutton's team for Irish Grand National weekend - including an 'overpriced' Grade 1 contender,https://www.racingpost.com/news/ireland/patrick-mullins-keen-on-closuttons-team-for-irish-grand-national-weekend-including-an-overpriced-grade-1-contender-aMKIq2J8692H/,racing_post,
Former pointers look set to play a big part in this year's Irish Grand National - and one rider has the inside line on the race,https://www.racingpost.com/news/opinion/comment/former-pointers-look-set-to-play-a-big-part-in-this-years-irish-grand-national-and-one-rider-has-the-inside-line-on-the-race-agm0M4Q8ZfAD/,racing_post,
"'It was quite a night, sambucas all round - not everyone gets the magnitude of a Cheltenham winner, you have to bring them in on that tide of emotion'",https://www.racingpost.com/news/features/the-big-read/it-was-quite-a-night-sambucas-all-round-not-everyone-gets-the-magnitude-of-a-cheltenham-winner-and-its-a-tide-of-emotion-aQI3x6A3URF2/,racing_post,
Meet the millionaire owner who quietly conquered Royal Ascot - but thinks racing must now hear some hard truths,https://www.racingpost.com/news/features/interviews/meet-the-millionaire-owner-who-quietly-conquered-royal-ascot-but-thinks-racing-must-now-hear-some-hard-truths-aDkzN9d1baQr/,racing_post,
"'There I was, looking like a spare part again in the McManus colours - but it was the standout moment of my career'",https://www.racingpost.com/news/features/interviews/there-i-was-looking-like-a-spare-part-again-in-the-mcmanus-colours-but-it-was-definitely-the-standout-moment-of-my-career-axPfJ0Q3sE1O/,racing_post,
"'It was my worst injury, my head probably wouldn't have taken another knock - but three months later I was a Cheltenham Festival winner again'",https://www.racingpost.com/news/features/interviews/it-was-my-worst-injury-my-head-probably-wouldnt-have-taken-another-knock-but-three-months-later-i-was-a-cheltenham-festival-winner-again-ar5Fg3a4PhDV/,racing_post,
"Poker genius, visionary football chairman and pioneering data-led punter - the many (profitable) faces of Tony Bloom",https://www.racingpost.com/news/features/masters-of-betting/poker-genius-visionary-football-chairman-and-pioneering-data-led-punter-the-many-profitable-faces-of-tony-bloom-a0UWt2Y6DPmh/,racing_post,
"Introducing Masters of Betting, an unmissable series available now - read it all with 25% off RP+",https://www.racingpost.com/news/introducing-masters-of-betting-an-unmissable-series-next-week-in-the-racing-post-read-it-all-with-25-off-rp-aJKV17m1iNzx/,racing_post,
"'I was down £11,000 but you can't let that alter what you do' - meet one of the giants of on-course betting",https://www.racingpost.com/news/features/masters-of-betting/i-was-down-11000-but-you-cant-let-that-alter-what-you-do-meet-one-of-the-giants-of-on-course-betting-aXYs01f58AHh/,racing_post,
When science met punting: the godfather of modern-day betting and his golden rules that remain valid to this day,https://www.racingpost.com/news/features/masters-of-betting/when-science-met-punting-the-godfather-of-modern-day-betting-and-his-golden-rules-that-remain-valid-to-this-day-aO1b67N07bKR/,racing_post,
How a dodgy bank loan led to nearly 40 years as a pro punter - proving old-school methods still have their place,https://www.racingpost.com/news/features/masters-of-betting/how-a-dodgy-bank-loan-led-to-nearly-40-years-as-a-pro-punter-proving-old-school-methods-still-have-their-place-aKazg3g7sdy3/,racing_post,
Calandagan's victory bodes well for one of racing's most enduring superpowers,https://www.racingpost.com/news/opinion/comment/calandagans-victory-bodes-well-for-one-of-racings-most-enduring-superpowers-aFOAf0a6D6qc/,racing_post,
'All systems go' for Bahrain's valuable King's Cup meeting on Friday after a long delay due to Gulf region conflict,https://www.racingpost.com/news/international/bahrain/all-systems-go-for-bahrains-valuable-kings-cup-meeting-on-friday-after-a-long-delay-due-to-gulf-region-conflict-aee2Z8I8p3t4/,racing_post,
Simon and Ed Crisford earn nearly £3 million on amazing Dubai World Cup night - with sights now set on Classic glory,https://www.racingpost.com/news/britain/simon-and-ed-crisford-earn-nearly-3-million-on-amazing-dubai-world-cup-night-and-sights-are-now-set-on-classic-glory-axdRb5w6voeQ/,racing_post,
Grade 1 double for Into Mischief as Commandment and Renegade land big-race victories,https://www.racingpost.com/bloodstock/news/international/grade-1-double-for-into-mischief-as-commandment-and-renegade-land-big-race-victories-a6iQJ8b38IMH/,racing_post,
Why a little knowledge could be a dangerous thing as new threat looms for British racing,https://www.racingpost.com/news/opinion/comment/why-a-little-knowledge-could-be-a-dangerous-thing-as-new-threat-looms-for-british-racing-aHSZi2V6k08T/,racing_post,
There is a constant clamour for fixture list reform - and this bold proposal from trainers should not be ignored,https://www.racingpost.com/news/opinion/comment/there-is-a-constant-clamour-for-fixture-list-reform-and-this-proposal-from-trainers-should-not-be-ignored-aenIa0P5X1so/,racing_post,
The daunting task and overflowing in-tray facing Brant Dunshea as he takes on the BHA hotseat,https://www.racingpost.com/news/opinion/comment/the-daunting-task-and-overflowing-in-tray-facing-brant-dunshea-as-he-takes-on-the-bha-hotseat-asXgc2I76Ked/,racing_post,
"'We want to see it thrive, not just survive' - BGC chief Grainne Hurst on the thawing relations between betting and racing",https://www.racingpost.com/news/opinion/comment/we-want-to-see-it-thrive-not-just-survive-bgc-chief-grainne-hurst-on-the-thawing-relations-between-betting-and-racing-a12wP7Y9H2Xk/,racing_post,
Yuen ‘really excited’ for Hong Kong debut as she gears up for five rides,https://www.scmp.com/sport/racing/article/3348530/apprentice-nichola-yuen-really-excited-hong-kong-debut-she-gears-five-rides,scmp_racing,2026-03-31 17:09
"The HK Racing Postscript: who’s hot, who’s not and the best of March",https://www.scmp.com/sport/racing/article/3348388/hong-kong-racing-postscript-whos-hot-whos-not-and-best-march,scmp_racing,2026-03-30 19:00
Chung seeks Group Two Chairman’s Trophy glory aboard ‘best horse I’ve ridden so far’,https://www.scmp.com/sport/racing/article/3348387/angus-chung-seeks-group-two-chairmans-trophy-glory-aboard-best-horse-ive-ridden-so-far,scmp_racing,2026-03-30 16:28
Andrea Atzeni and Francis Lui enjoy doubles as Satono Reve stamps Champions Day ticket in Japan,https://www.scmp.com/sport/racing/article/3348312/andrea-atzeni-and-francis-lui-enjoy-doubles-satono-reve-stamps-champions-day-ticket-japan,scmp_racing,2026-03-29 20:09
Boom three-year-old Salon S lights up the Sha Tin turf again to extend unbeaten streak to four,https://www.scmp.com/sport/racing/article/3348305/boom-three-year-old-salon-s-lights-sha-tin-turf-again-extend-unbeaten-streak-four,scmp_racing,2026-03-29 19:26
SCMP Best Bets: Speedy Smartie can live up to his name at Sha Tin,https://www.scmp.com/sport/racing/article/3348572/scmp-best-bets-speedy-smartie-can-live-his-name-sha-tin,scmp_racing,2026-03-31 21:20
Mark Newnham maintains super form with Sha Tin treble to reclaim trainers’ championship lead,https://www.scmp.com/sport/racing/article/3348302/mark-newnham-maintains-super-form-sha-tin-treble-reclaim-trainers-championship-lead,scmp_racing,2026-03-29 18:53
"馬場密探048｜「將睿」游廄食尾胡起孖 (Racing Insider 048 | ""Invincible Sage"" delivers a stable double with a late win.)",https://www.stheadline.com/realtime-racing/3558630/馬場密探048將睿游廄食尾胡起孖,singtao_racing,2026-04-01 15:58 (10小時前)
"馬場密探048｜「樂勝天下」大熱取勝 (Racing Insider 048 | ""Victory Supreme"" wins as hot favourite.)",https://www.stheadline.com/realtime-racing/3558627/馬場密探048樂勝天下大熱取勝,singtao_racing,2026-04-01 15:58 (10小時前)
"馬場浮世繪│哥哥逝世23周年  馬場「風繼續吹」 (Racetrack Vignettes | 23rd Anniversary of Leslie Cheung's Death, ""The Wind Blows On"" at the Racetrack.)",https://www.stheadline.com/realtime-racing/3558623/馬場浮世繪哥哥逝世23周年-馬場風繼續吹,singtao_racing,2026-04-01 15:58 (10小時前)
馬場浮世繪│艾兆禮四月續弗「爆」 (Racetrack Vignettes | Andrea Atzeni's Explosive Form Continues in April.),https://www.stheadline.com/realtime-racing/3558615/馬場浮世繪艾兆禮四月續弗爆,singtao_racing,2026-04-01 14:58 (11小時前)
"馬場密探048｜「八駿福昇」告東尼1600W (Racing Insider 048 | ""Eight Virtues Rising"" wins 1600m for Tony Cruz.)",https://www.stheadline.com/realtime-racing/3558616/馬場密探048八駿福昇告東尼1600W,singtao_racing,2026-04-01 14:58 (11小時前)
"馬場密探048｜「贏得自然」葉廄起孖 (Racing Insider 048 | ""Winning Naturally"" delivers a double for Yip's stable.)",https://www.stheadline.com/realtime-racing/3558608/馬場密探048贏得自然葉廄起孖,singtao_racing,2026-04-01 14:58 (11小時前)
"馬場密探048｜「開心宇宙」後上險勝 (Racing Insider 048 | ""Happy Universe"" snatches a narrow victory from behind.)",https://www.stheadline.com/realtime-racing/3558602/馬場密探048開心宇宙後上險勝,singtao_racing,2026-04-01 13:58 (12小時前)
"馬場密探048｜女小將即贏  袁幸堯締「傳奇」 (Racing Insider 048 | Young Female Jockey Yuan Xingyao Creates an Instant Winning ""Legend"".)",https://www.stheadline.com/realtime-racing/3558594/馬場密探048女小將即贏-袁幸堯締傳奇,singtao_racing,2026-04-01 13:58 (12小時前)
"馬場密探048｜「風繼續吹」後上取勝 (Racing Insider 048 | ""The Wind Blows On"" wins from behind.)",https://www.stheadline.com/realtime-racing/3558587/馬場密探048風繼續吹後上取勝,singtao_racing,2026-04-01 12:58 (13小時前)
"馬場密探048｜「光輝歲月」泥地開齋 (Racing Insider 048 | ""Glorious Years"" breaks maiden on dirt.)",https://www.stheadline.com/realtime-racing/3558579/馬場密探048光輝歲月泥地開齋,singtao_racing,2026-04-01 11:58 (14小時前)
"馬場密探048｜「爆熱」打開在港勝門 (Racing Insider 048 | ""Explosive Heat"" opens winning account in Hong Kong.)",https://www.stheadline.com/realtime-racing/3558571/馬場密探048爆熱打開在港勝門,singtao_racing,2026-04-01 11:58 (14小時前)
"馬場浮世繪｜南非三級賽盟主「加利斯」 運港由韋達訓練 (Racetrack Vignettes | South African Grade 3 Champion ""Gallis"" Shipped to Hong Kong for Training with Douglas Whyte.)",https://www.stheadline.com/realtime-racing/3558558/馬場浮世繪南非三級賽盟主加利斯-運港由韋達訓練,singtao_racing,2026-04-01 10:58 (15小時前)
"「嘉應高昇」潘頓下周一強勢出擊 (""Ka Ying Go Sing"" and Zac Purton to Make Strong Bid Next Monday.)",https://www.stheadline.com/realtime-racing/3558532/嘉應高昇潘頓下周一強勢出擊,singtao_racing,2026-04-01 09:58 (16小時前)
"周俊樂夥「遨遊氣泡」爭佳績 (Jerry Chau Partners ""Voyage Bubble"" to Compete for Success.)",https://www.stheadline.com/realtime-racing/3558524/周俊樂夥遨遊氣泡爭佳績,singtao_racing,2026-04-01 09:58 (16小時前)
程俊華當選為仁愛堂主席 (Ching Chun Wa Elected Chairman of Yan Oi Tong.),https://www.stheadline.com/realtime-racing/3558518/程俊華當選為仁愛堂主席,singtao_racing,2026-04-01 08:58 (17小時前)
"馬場浮世繪｜「同工之妙」先戰女皇盃 不排除進軍英皇錦標 (Racetrack Vignettes | ""Nimble Love"" to First Contest Queen Elizabeth II Cup, King George Stakes Not Ruled Out.)",https://www.stheadline.com/realtime-racing/3558512/馬場浮世繪同工之妙先戰女皇盃-不排除進軍英皇錦標,singtao_racing,2026-04-01 08:58 (17小時前)
"波仔至醒靈活玩│「疾風財子」泥地啱跑 (Ball Boy's Top Tips | ""Windy Tycoon"" Suitable for Dirt Track.)",https://www.stheadline.com/realtime-racing/3558218/波仔至醒靈活玩疾風財子泥地啱跑,singtao_racing,2026-04-02 01:58 (2026-04-01 02:00 HKT)
"廖事如神│「偵探傳奇」明鏡高袁 (Liao's God-like Foresight | ""Detective Legend"": Clear Prospects with Yuan.)",https://www.stheadline.com/realtime-racing/3558190/廖事如神偵探傳奇明鏡高袁,singtao_racing,2026-04-02 01:58 (2026-04-01 02:00 HKT)
"班德禮「幻影旋風」「友愛心得」 (Lyle Hewitson with ""Phantom Whirlwind"" and ""Friendly Heart"".)",https://www.stheadline.com/realtime-racing/3558224/班德禮幻影旋風友愛心得,singtao_racing,2026-04-02 01:58 (2026-03-31 18:08 HKT)
獨家猛料│方嘉柏為鄭鍾華補中 (Exclusive Scoop | Caspar Fownes Makes Amends for Cheng Chung Wa.),https://www.stheadline.com/realtime-racing/3558129/獨家猛料方嘉柏為鄭鍾華補中,singtao_racing,2026-04-02 01:58 (2026-03-31 13:45 HKT)
東スポ杯2歳S覇者パントルナイーフは皐月賞参戦へ【次走報】 (Sports Nippon Hai 2-year-old S winner Pantalunaïf to enter Satsuki Sho [Next Race Report].),https://news.google.com/rss/articles/CBMiVEFVX3lxTFBBT3UzU3EyQ1JzTFJxM0Rjdmh6U1VkeUVXM2VQV25uYUh2aWNyUEstQjFTVWxCTTFIZUE4bXlaV284RXl4NWZ4dHJVYXNDZ1JaSTVzQw?oc=5,tospo_keiba,2026-04-01 07:32
ジョバンニがクイーンエリザベス2世Cに挑戦 鞍上はジェイソン・コレット【次走報】 (Giovanni to challenge Queen Elizabeth II Cup with Jason Collett as jockey [Next Race Report].),https://news.google.com/rss/articles/CBMiVEFVX3lxTE1UR002M2Y2a3dXU3ZDRHFPOHF5RjZTdnBnYmNaYmRxWnJDT0pyRzBzR1dFZm9MYzlXMG1DeEhIazl1VWJKcExpUXItWGJfRXlXdVdhdA?oc=5,tospo_keiba,2026-04-01 09:04
"【大阪杯追い切り】クロワデュノール復権へラスト11・1秒 斉藤崇調教師「この馬が一番強いところを見せられたら」 ([Osaka Hai Training] Croix du Nord clocks 11.1s for final furlong aiming for comeback; Trainer Takashi Saito: ""Hope this horse can show its strongest side."")",https://news.google.com/rss/articles/CBMiVEFVX3lxTE1ucmhENjRLLUZ4RGw4M29XNVNaRGVHdXdrS2pmdHgtaTdtRExYZmtEcFJzTkdsbHd1YnV2MEwtX3R4QzlOamFjMFRGTXZkZkZNRWZTYg?oc=5,tospo_keiba,2026-04-01 01:10
アルトラムスは皐月賞参戦を視野に調整【次走報】 (Alt Rams in training with Satsuki Sho participation in sight [Next Race Report].),https://news.google.com/rss/articles/CBMiVEFVX3lxTFBKVkRtX2NwMTl2dDcxUGFNeHkwOEdneENEU2xZaDNaZmpHTUdkai10WTQtSHZtVlBBLUJUV1RwU3IyemhyZmM3N0lMemtWbW0zOXRrQw?oc=5,tospo_keiba,2026-04-01 08:06
"【桜花賞・1週前追い切り】アランカールは武豊を背に併入フィニッシュ 「順調にあと1週間いってくれたら」 ([Oka Sho 1-week prior Training] Alain Car finishes alongside with Yutaka Take aboard; ""Hope it goes smoothly for another week."")",https://news.google.com/rss/articles/CBMiVEFVX3lxTE9hU0NmMEtnYmZOcWlHREdDbk9fWktCSi1XWkxMY05BS0tNYmhOSkw3Z2tELXZCYVZFTXBhSm9MRXU3M3dNb2VrZDRKanMwdlg4anhBcQ?oc=5,tospo_keiba,2026-04-01 01:51
アスコリピチェーノは阪神牝馬Sで坂井瑠星と新コンビ結成【次走報】 (Ascoli Piceno forms new combination with Ryusei Sakai for Hanshin Mares S [Next Race Report].),https://news.google.com/rss/articles/CBMiVEFVX3lxTE00U1ZMc3Jxb2RJUXdyQzRvbG81cl8wUzVvaUtaTXphemdnZ3JIX0Q0cktaendiSUQ2enJDQjBZNVNCTE1OaDRFSnMxenI3Q2VzeUlnQg?oc=5,tospo_keiba,2026-04-01 04:06
毎日杯2着ローベルクランツはNHKマイルCを目標に短期放牧へ【次走報】 (Mainichi Hai 2nd-place Laurelcrantz heads for short rest targeting NHK Mile Cup [Next Race Report].),https://news.google.com/rss/articles/CBMiVEFVX3lxTE01UkxzR0VwZmxzMkpoTFJOYUJtWlJIUGU2TmZjYW1ZZzJ6T2o0NEhkcGF5bHNsUWFsYWdpZUpjbXhEeE1iX3J1cUpENUcxaFFBdlRUZQ?oc=5,tospo_keiba,2026-04-01 09:05
エンブロイダリーはクリストフ・ルメールの手綱で阪神牝馬Sへ【次走報】 (Embroidery heads to Hanshin Mares S with Christophe Lemaire aboard [Next Race Report].),https://news.google.com/rss/articles/CBMiVEFVX3lxTE1XdGg0bE9CN2RJQkQxU0Rna1RoUXNFc3ppS3ZQUm1kdU05WTNTRWdTWnAyaWFweUEyVlV1dVk5QnhFNTJlTTRQTk1EOXJjbzFRSTAyWQ?oc=5,tospo_keiba,2026-04-01 10:08
ビッグカレンルーフは左前脚骨折のため桜花賞を回避 (Big Karen Roof withdraws from Oka Sho due to left foreleg fracture.),https://news.google.com/rss/articles/CBMiVEFVX3lxTFB4MHRJWnJmVC04SkRidzk4M2FKVEdDaThzOFhTcHc3UEJGU0U2UDExcTZfQjlERHJRSDYxVnlFVy1kdW1HdmdjRVRVNWhaX3dRcGpzdA?oc=5,tospo_keiba,2026-04-01 07:57
